topic,context
Bagaimana surat lamaran kerja yang baik?,"Poin Penting Menulis Surat Lamaran Kerja Gunakan kertas bergaris. ...  Pastikan menggunakan bahasa yang baik dan benar serta menggunakan bahasa yang resmi. Gunakan kata-kata yang sopan namun resmi. ...  Jangan bertele-tele dan gunakan format penulisan yang tersusun rapi, sesuai dengan ketentuan surat lamaran kerja. Item lainnya... ? 4 Nov 2022"
Apa saja isi surat lamaran kerja?,"Berkas Lamaran Kerja Selengkapnya CV alias Curriculum Vitae. Singkatnya, berkas yang satu ini berita tentang seluruh riwayat diri Anda secara lengkap. ...  Ijazah. ...  Transkrip Nilai. ...  Surat Lamaran Kerja. ...  Pas Foto Terbaru. ...  Portofolio. ...  Identitas pribadi. 6 hari yang lalu"
Apa Perbedaan CV dan lamaran kerja?,"   Perbedaan CV dan surat lamaran kerja pada dasarnya ada pada isi. Jika surat lamaran kerja berisi penawaran dan ketertarikan Anda pada posisi yang tersedia di sebuah perusahaan, CV adalah informasi tentang diri dan pengalaman kerja sekaligus pendukung surat lamaran kerja. 19 Jan 2023"
Surat lamaran kerja diberikan ke siapa?,"Surat lamaran kerja merupakan salah satu dokumen yang dibutuhkan saat melamar kerja. Berikut contoh surat lamaran kerja atau application letter dan curriculum vitae (CV). Surat lamaran kerja ditujukan kepada pimpinan perusahaan yang memiliki wewenang untuk menerima, atau menolak pelamar untuk bekerja di perusahaan. 10 Feb 2023"
Apa Perbedaan CV dan daftar riwayat hidup?,"Secara definisi, CV dan daftar riwayat hidup memiliki arti yang hampir sama. CV merupakan dokumen yang isinya adalah daftar riwayat hidup. Sementara, daftar riwayat hidup merupakan dokumen yang isinya adalah riwayat pendidikan, pengalaman kerja, prestasi, serta keahlian-keahlian yang dimiliki pemilik. 26 Sep 2022"
Apakah surat lamaran harus ditulis tangan?,"Surat lamaran pekerjaan bisa ditulis tangan maupun diketik. Namun ada pula perusahaan atau instansi tertentu yang mensyaratkan agar surat lamaran pekerjaan ditulis dengan tangan. Surat lamaran pekerjaan yang ditulis tangan hendaknya jelas, mudah dibaca dan rapi. 27 Agu 2022"
CV itu terdiri dari apa saja?,"Isi dari dokumen CV ini adalah riwayat pendidikan, nama lengkap, informasi tentang keahlian, keterangan dari tempat dan juga tanggal lahir, riwayat dari pengalaman, data prestasi, dan juga kontak pribadi. 19 Feb 2023"
Jika diminta CV apa saja yang dikirim?,"Biasanya berkas yang diminta adalah: CV / Resume. Surat Lamaran Kerja / Cover Letter. Pas Foto. Scan KTP. Scan Ijazah Terbaru. Scan Sertifikat yang dimiliki. Scan SKCK. Portofolio, jika ada. "
Lampiran CV Apa Saja?,"Hal yang sebaiknya ada sebagai lampiran adalah: Pas foto (foto terbaru) Fotokopi KTP. Daftar riwayat hidup. Fotokopi ijazah terakhir. Fotokopi sertifikat kompetensi (kursus atau pelatihan yang pernah Anda ikuti) "
Apakah CV ditulis tangan atau diketik?,"CV tulis tangan tidak direkomendasikan mengingat CV melampirkan informasi profil diri Kamu secara lengkap. Berbeda dengan surat lamaran kerja yang ditulis tangan, maka CV harus diketik dan print dengan kualitas yang bagus."
Hal hal apa saja yang harus dihindari dalam membuat surat lamaran pekerjaan?,"Hal-hal yang harus dihindari dalam penulisan surat lamaran pekerjaan adalah sebagai berikut, kecuali ... terdapat gambar dan pernak-pernik. menggunakan kertas berwarna. tulisan menggunakan tinta warna-warni. bahasa yang digunakan bertele-tele. menggunakan bahasa baku. "
Langkah langkah membuat CV di HP?,"   Cara Membuat CV Di HP ? Panduan Lengkap Menggunakan Resume Builder Kami Masuk Ke Website Cvmenarik.com. Pilih Format Template CV Yang Tersedia. Isi Informasi Pribadi Anda. Cantumkan & Jelaskan Pengalaman Kerja Anda. Tulis Riwayat Pendidikan Anda. Jangan Lupa Tulis Semua Keterampilan Relevan Anda. Item lainnya..."
Apakah surat lamaran kerja dan CV digabung?,"Berdasarkan jenisnya, surat lamaran terdiri atas surat lamaran pekerjaan yang digabung dengan riwayat hidup atau CV dan surat lamaran yang dipisahkan dari riwayat hidup. Artinya, ketika pelamar menulis surat lamaran yang digabung dengan CV, ia bisa menampilkan maksud dari dua dokumen sekaligus. 13 Des 2022"
Apa saja syarat syarat untuk melamar kerja?,Persyaratan lamaran kerja Curriculum Vitae atau CV. ...  Surat lamaran kerja. ...  Portofolio kerja. ...  Ijazah dan transkrip nilai. ...  Identitas pribadi. ...  Pas foto terbaru. ...  Surat referensi kerja dan sertifikat keahlian. ...  Surat Keterangan Catatan Kepolisian (SKCK) Item lainnya... ? 8 Okt 2022
Apakah SKCK itu penting dalam melamar pekerjaan?,"Surat Keterangan Catatan Kepolisian (SKCK) sering menjadi salah satu syarat lampiran pada lamaran pekerjaan, termasuk ketika melamar kerja di BUMN atau menjadi Pegawai Negeri Sipil. Bagi pelamar kerja yang belum memiliki SKCK, dapat segera mengajukan permohonan pembuatan SKCK di Polsek/Polres sesuai domisili. 9 Sep 2022"
Apa saja yang tidak boleh di tulis di CV?,"Hindari memalsukan hal-hal yang dituliskan dalam CV. Karena hal tersebut bakal merugikan kandidat. Berdasarkan pengalaman Citra, kandidat yang sengaja memalsukan pengalaman di CV lantaran sudah capek sering kali tidak mendapatkan panggilan kerja. ""Mungkin ada kandidat yang sudah capek dan sengaja memalsukan pengalaman. 26 Apr 2022"
Bagaimana Membuat CV yang baik?,"   Berikut ini beberapa langkah untuk membuat CV yang bisa diikuti. Masukkan Data Identitas dengan Benar. ...  Masukkan Riwayat Pendidikan. ...  Masukkan Pengalaman Kerja atau Pengalaman Berorganisasi (Jika Ada) ...  Jelaskan Kualifikasi Diri yang Dimiliki. ...  Tuliskan Keahlian Pribadi yang Menunjang Kemampuan. Item lainnya..."
Apakah CV data pribadi?,"Curriculum vitae (CV)    Selain itu, CV juga berisikan data diri seseorang, mencakup riwayat pendidikan, pencapaian, skill, dan pengalaman kerja serta kegiatan yang sedang dikerjakan. 11 Jul 2022"
Surat lamaran kerja di print kertas apa?,"Surat lamaran kerja sendiri dapat ditulis secara langsung atau diketik, baik ditulis atau diketik, ukuran standar surat lamaran kerja yang benar adalah menggunakan jenis A4 (kuarto) putih polos dengan tebal 80 gram. 22 Apr 2022"
Apakah surat lamaran kerja tidak boleh ada coretan?,Menulis dengan serapi mungkin agar HRD dapat lebih mudah membacanya. Gunakan bahasa yang baik dan benar sesuai EYD. Jangan sesekali ada coretan atau menggunakan Tipe X karena terkesan kurang rapi dan teliti.
Apakah surat lamaran kerja bisa 2 lembar?,"Jadi, kesimpulan dari penjelasan Glints adalah bahwa CV boleh saja berjumlah 2 halaman ataupun lebih. Akan tetapi, alangkah lebih baik jika kamu bisa mempersingkatnya sebaik mungkin agar ringkas dan mudah dibaca. Kalau CV-mu masih terlalu panjang, jangan lupa untuk segera diperbaiki agar lolos ke tahap interview, ya! 30 Apr 2021"
Apa saja isi CV lulusan SMA?,"   Berikut adalah informasi yang perlu dicantumkan dalam menulis CV tamatan SMA: Nama Lengkap. Contact details (No. HP, alamat, email) Profil singkat. Pendidikan. Pengalaman bekerja/ organisasi. Skill. "
Berkas lamaran lengkap itu apa saja?,"Demikianlah berkas lamaran kerja yang umum diminta oleh perusahaan, yang meliputi surat lamaran, curriculum vitae, portofolio, identitas pribadi, pas foto terbaru, ijazah dan transkrip nilai, serta sertifikat pendukung. 16 Des 2022"
CV itu singkatan dari apa?,"Dikutip dari buku berjudul 30 Hari Mencari Kerja yang ditulis oleh M. Hariwijaya, CV adalah uraian diri seseorang mengenai pengetahuan, keterampilan, dan wawasan yang dimiliki. Kepanjangan CV adalah Curriculum Vitae. 12 Nov 2022"
Kapan sebaiknya mengirim CV?,"Jam terbaik    Dilansir dari Business Insider, waktu terbaik untuk kirim email lamaran kerja adalah antara pukul 6 sampai 10 pagi (06.00 ? 10.00) dan tidak lebih dari pukul 4 sore (16.00). 15 Agu 2022"
Mengirim CV dalam bentuk apa?,"   Dokumen lamaran harus menggunakan penamaan yang jelas dengan format pdf. Contohnya seperti 'CV ? Aditya Afnan. 8 Sep 2022"
Apa yang dimaksud dengan CV dan contohnya?,"Curriculum vitae merupakan daftar riwayat hidup yang berisi data dan informasi yang diperlukan untuk melamar pekerjaan. Dalam CV terdapat informasi seperti pendidikan, keahlian, biodata, dan riwayat pekerjaan lainnya. Kamu pun perlu membuat CV semenarik mungkin agar mendapat penilailan yang tinggi dari rekrutmen. 7 Agu 2020"
Apakah SKCK di fotocopy saat melamar kerja?,Syarat selanjutnya adalah fotokopi SKCK atau Surat Keterangan Catatan Kepolisian. SKCK merupakan dokumen yang menunjukkan catatan kriminalitas atau kejahatan seseorang. Perusahaan dapat menjadikan fotokopi SKCK sebagai syarat lamaran kerja untuk menghindari kejadian buruk yang dapat berimbas pada nama baik perusahaan. 3 Sep 2022
CV dulu apa surat lamaran dulu?,"Curriculum vitae adalah urutan berkas lamaran kerja yang diletakkan paling pertama. Melansir karirmu.id, CV harus diletakkan di bagian awal agar memudahkan tim HRD untuk menyeleksi calon pelamar. 7 Nov 2022"
Apakah amplop coklat lamaran kerja harus ditulis?,"   Cantumkan nama dan alamat instansi atau perusahaan yang dituju pada bagian kanan bawah amplop coklat lamaran kerja. Pastikan alamat ditulis dengan lengkap supaya tidak tersasar. Jika tidak tahu nama HRD, cukup tulis Bpk/Ibu HRD."
Apakah daftar riwayat hidup ada fotonya?,"Dalam daftar riwayat hidup, Anda juga bisa memberikan foto diri. Namun, pastikan yang digunakan adalah foto formal atau semi formal dan terlihat rapi. 3 Feb 2022"
CV biasanya di print di kertas apa?,Gunakan kertas putih dan polos     Pastikan Anda menulis CV pada kertas putih bersih dan polos. Ukuran standar yang biasa digunakan adalah jenis A4 (kuarto) dan tebal 80 gram. Menggunakan kertas putih dan bersih dalam menulis CV memudahkan tim penyeleksi nyaman dalam membaca. 17 Nov 2012
CV dibaca apa?,"CV singkatan dari Curriculum Vitae, bagi Anda yang pernah melamar pekerjaan, CV adalah salah satu dokumen yang harus disiapkan. CV merupakan rangkuman riwayat hidup berisi tentang ringkasan mulai dari riwayat sekolah yang pernah ditempuh, hingga apa saja yang pernah dilakukan atau organisasi yang pernah diikuti."
Bagaimana cara menulis alamat surat yang benar?,"Penulisan alamat surat yang benar adalah harus ditulis selengkap-lengkapnya alamat, tidak boleh disingkat, dan tidak boleh menggunakan tanda titik. Mulai dari alamat rumah, nomor rumah, kecamatan, kabupaten, provinsi, dan kode pos. 25 Nov 2022"
Kesalahan umum apa yang sering dilakukan pelamar pada pembuatan surat lamaran kerja?,"Kesalahan umum lainnya yang sering ditemukan dalam surat lamaran kerja adalah pengalaman yang kurang relevan. Meskipun ingin menunjukkan pada rekruter bahwa kamu adalah pekerja berpengalaman, jangan cantumkan work experience yang kurang relevan dengan posisi tertuju. 25 Jul 2022"
Apa yang perlu dilampirkan dalam surat lamaran pekerjaan *?,"3. Contoh Surat Lamaran Kerja Umum Daftar Riwayat Hidup. Foto copy KTP. Foto copy Ijazah dan Transkrip Nilai Terakhir. Foto copy Sertifikat. Pas foto ukuran 3X4 (1 lembar) "
Berapa biaya pembuatan CV?,"Biaya Pembuatan CV 2022    Untuk saat ini biaya pendirian CV sekitar Rp3 sampai Rp8 juta. Anda tidak perlu mengurusnya sendiri, sebab bisa menggunakan layanan perizinan badan usaha. 16 Okt 2022"
CV bikin dimana?,"   Membuat Akta Pendirian CV    Selanjutnya yaitu membuat akta pendirian CV yang dilakukan di hadapan notaris. Anda bebas memilih notaris dari wilayah manapun, meski berbeda dari wilayah domisili CV, selama notaris tersebut telah tersumpah, terdaftar di Kemenkumham, dan memiliki SK pengangkatan. 26 Des 2022"
Bikin CV gratis dimana?,"   10 Website Buat CV Online Gratis Super Mudah Canva. Kickresume.com. Bikin CV. Novoresume. CV Maker. Visual CV. Indeed. Zety. Item lainnya... ? 14 Okt 2022"
Apakah kartu kuning itu penting?,Untuk Melamar ke Perusahaan Swasta    Meskipun tidak semua perusahaan swasta mewajibkan setiap kandidat atau calon karyawan harus menyertakan kartu kuning sebagai syarat kelengkapan dokumen ketika melamar pekerjaan di perusahaan tersebut. 20 Jan 2023
Apakah perlu melampirkan KTP untuk melamar kerja?,"Jika lowongan kerjanya asli dan terpercaya, lampirkan fotokopi KTP dan KK hanya jika diminta. Kalau perusahaan tidak mensyaratkan berkas ini, maka nggak perlu dilampirkan. Cukup kirimkan CV, surat lamaran kerja, dan portofolio. KTP dan KK adalah dokumen yang sifatnya sangat pribadi. 19 Mei 2022"
Apa saja yang harus dibawa pada saat interview?,"Yuk, simak lebih lanjut! 1. Fotokopi CV atau resume. ...  2. Surat rekomendasi. ...  3. Semua dokumen penting. ...  4. Gadget. ...  Portofolio. ...  6. Barang untuk keadaan darurat. ...  7. Pulpen. ...  Tas. Item lainnya... ? 19 Sep 2022"
Apakah melamar kerja harus punya NPWP?,"Menjadi Salah Satu Syarat Untuk Melamar Pekerjaan     Saat sedang mencari pekerjaan, tidak sedikit pemberi kerja yang meminta NPWP sebagai salah satu syarat administrasi. Maka dari itu, ini menjadi alasan utama mengapa seorang fresh graduate harus memiliki NPWP."
Membuat SKCK bayar berapa?,SKCK memiliki masa berlaku sampai dengan 6 bulan sejak masa diterbitkan. Pembuatan SKCK baru dikenakan biaya sebesar Rp 30.000 di luar dari biaya pembuatan dokumen sidik jari. 12 Jan 2023
Apa saja syarat membuat SKCK 2022?,Membawa fotokopi Kartu Keluarga. Membawa fotokopi Akta Kelahiran/Kenal Lahir/Ijazah. Membawa Pas Foto terbaru yang berwarna ukuran 4?6 sebanyak 3 lembar. Mengisi formulir perpanjangan SKCK yang disediakan di kantor Polisi.
CV lebih baik warna apa?,"   Sesuaikan dengan perusahaan dan pekerjaan    Akan tetapi, apabila kamu ingin melamar posisi akuntan di suatu perusahaan swasta, CV dengan sedikit warna atau hitam putih saja adalah warna CV yang baik. Di bawah ini merupakan salah satu contoh CV berwarna hitam-putih dengan sedikit sentuhan warna biru. 5 Jan 2023"
Berapa lama waktu untuk menunggu panggilan kerja?,"Waktu Menunggu    Umumnya, kandidat perlu menunggu minimal selama 5 hari kerja setelah melakukan interview. Jika kamu lupa bertanya saat interview mengenai kapan bisa menanyakan hasilnya, sebaiknya kamu follow up hasil interview beberapa hari lebih lambat dari estimasi timeline tersebut. 26 Sep 2022"
Apakah CV lebih baik ditulis atau diketik?,"Berbeda dengan surat lamaran kerja yang ditulis tangan, maka CV harus diketik dan print dengan kualitas yang bagus. Jangan pula membeli CV jadi yang ada di fotokopian sebab CV jadi biasanya diberikan kepada PNS atau pegawai BUMN saja. Kamu harus mencantumkan bagian vital dalam CV ini secara lengkap dan jujur, ya!"
Contoh isi CV Apa Saja?,"   Isi dari dokumen CV ini adalah riwayat pendidikan, nama lengkap, informasi tentang keahlian, keterangan dari tempat dan juga tanggal lahir, riwayat dari pengalaman, data prestasi, dan juga kontak pribadi. 18 jam yang lalu"
CV lengkap isinya apa?,"Pahami Isi CV Terlebih Dahulu    Identitas Diri (nama lengkap, alamat, nomor telepon dan alamat email) Pendidikan (pendidikan terakhir, jurusan dan IPK) Personalitas (gambaran singkat karakter diri kamu) Keterampilan (keterampilan yang kamu miliki)"
Apakah boleh bohong di CV?,"   Kata orang, rekruter tidak akan tahu kebohongan kandidat. Jadi, sah-sah saja apabila seseorang berbohong di CV. Benarkah demikian? Jawabannya adalah tidak. 11 Feb 2021"
Apa hobi yang bagus untuk melamar kerja?,"   Apa hobi yang cocok untuk melamar kerja? Blogging atau hobi menulis. Menuliskan hobi menulis pada CV dapat menunjukkan kreatifitas dan keahlian dalam copywriting. ...  2. Fotografi, Editing dan Video Production. ...  3. Bermain game strategis seperti catur dan board game. ...  Membaca. ...  Bermain olahraga tim. ...  6. Hobi beresiko tinggi. "
Surat lamaran kerja pake huruf apa?,"Salah satu font untuk CV yang bisa kamu gunakan adalah Calibri. Font satu ini resmi menggantikan Times New Roman sebagai font default pada Microsoft Word sejak tahun 2007. Meskipun menjadi default, Calibri belum digunakan sesering font Arial sehingga tidak terlalu ?pasaran?. 29 Sep 2022"
Berapa jarak spasi surat?,"Spasi: 1,5. Margin (Jarak tepi kertas): Atas (3 cm), Kiri (4 cm), Kanan (3 cm). 7 Jul 2021"
Apakah surat lamaran harus ada fotonya?,"Umumnya, tidak ada aturan khusus mengenai foto formal yang perlu dicantumkan dalam berkas lamaran kerja. Itulah sebabnya banyak yang masih salah, atau menganggap remeh foto diri untuk melamar kerja. Padahal, ada beberapa hal yang perlu diperhatikan, agar bisa mendapat kesan pertama yang baik di mata perekrut. 8 Des 2022"
Apakah surat lamaran kerja ditulis tangan atau diketik?,"Surat lamaran pekerjaan bisa ditulis tangan maupun diketik. Namun ada pula perusahaan atau instansi tertentu yang mensyaratkan agar surat lamaran pekerjaan ditulis dengan tangan. Surat lamaran pekerjaan yang ditulis tangan hendaknya jelas, mudah dibaca dan rapi. 27 Agu 2022"
Berapa lembar CV yang baik?,"CV yang ideal biasanya hanya sepanjang 1,5-2 halaman kertas A4 saja."
Bagaimana jika belum ada pengalaman kerja?,"Jika kamu tidak memiliki pengalaman kerja, masukkan pengalaman dari kerja sukarela, kegiatan sekolah, atau hobi yang relevan yang dapat menunjukkan prestasi atau keterampilan. Hal tersebut akan membantu karena selama ini, pengalaman di organisasi, dapat menguntungkan ketika kamu tidak memiliki pengalaman kerja. 9 Mar 2021"
Apa yang ditulis jika tidak memiliki pengalaman kerja?,"Karena belum adanya pengalaman kerja, kamu harus mencantumkan riwayat pendidikan yang pernah kamu jalani dengan lengkap. Latar belakang pendidikan yang kamu tulis akan memudahkan HR dalam menyeleksi dan menilai kecocokan jurusan/konsentrasi pendidikan dengan posisi kerja yang dipilih."
Apakah CV gaji UMR?,"   Intisari Jawaban. Pengusaha, termasuk Commanditaire Vennootschap (?CV?) atau Persekutuan Komanditer dilarang membayar upah pekerjanya di bawah upah minimum. 14 Apr 2019"
Kenapa PT lebih baik dari CV?,"Namun, PT merupakan badan usaha yang memiliki keuntungan lebih dibanding CV, salah satunya adalah memiliki kredibilitas tinggi, sehingga mempermudah bisnis Anda dalam melakukan kegiatan apapun seperti berpartisipasi dalam tender, lebih dipercaya investor, dan memiliki akses yang lebih luas untuk kegiatan bisnis lainnya ..."
Bagaimana cara agar cepat dapat panggilan kerja?,Tips agar Diterima Kerja Buat ekspektasi yang realistis. ? Freepik.com. ...  2. Asah skill. ? Freepik.com. ...  Update profil profesional. ? Freepik.com. ...  4. Siapkan CV dan portofolio terbaru. ? Freepik.com. ...  Persiapkan wawancara dengan matang. ? Freepik.com. ...  6. Jawab setiap pertanyaan dengan jujur. ? Freepik.com. 23 Nov 2022
Berapa lama HRD melihat CV?,Riset membuktikan HRD memiliki waktu rata-rata kurang dari satu menit untuk membaca CV Anda . Bahkan ada perusahaan yang hanya membutuhkan waktu enam detik per resume. 8 Apr 2015
Subjek lamaran kerja diisi apa?,"Namun, jika tidak ada instruksi dari perusahaan, kamu bisa menggunakan format seperti ini: job application: your name ? position (bahasa Inggris) lamaran kerja: namamu ? posisi yang kamu lamar (bahasa Indonesia) 16 Feb 2023"
Apa saja isi file PDF lamaran kerja?,"Sebagai pertimbangan dan untuk melengkapi berkas yang diminta, berikut ini saya lampirkan: CV/Daftar Riwayat Hidup. Pas foto ukuran 3x4 terbaru. Fotokopi ijazah pendidikan terakhir. Fotokopi SKCK. Fotokopi Kartu Tanda Penduduk (KTP) 23 Des 2021"
Kapan CV dibuat?,CV atau daftar riwayat hidup selalu dibuat saat seseorang akan melamar kerja. Jadi sebuah CV bisa dimanfaatkan untuk mendapatkan pekerjaan yang baru. Memang umumnya untuk melamar kerja tidak hanya dibutuhkan CV saja. tetapi masih banyak dokumen lain yang juga dibutuhkan.
Bagaimana Cara Membuat CV yang Bagus?,"Untuk mengetahui cara membuat CV yang menarik, Anda perlu memperhatikan beberapa hal sebagai berikut: Desain yang kreatif. ...  Identitas seperlunya. ...  Cantumkan Pengalaman pekerjaan secara jelas. ...  Cantumkan skill dan kemampuan yang dimiliki. ...  Sertakan pelatihan/kursus bila ada. "
SKCK itu singkatan dari apa?,"Surat Keterangan Catatan Kepolisian (disingkat SKCK), sebelumnya dikenal sebagai Surat Keterangan Kelakuan Baik (disingkat SKKB) adalah surat keterangan yang diterbitkan oleh Polri yang berisikan catatan kejahatan seseorang."
Apa saja berkas lamaran kerja 2022?,10 Urutan Berkas Lamaran Kerja yang Benar Supaya Dilirik HR 1 1. Surat Lamaran Kerja. 2 2. Daftar Riwayat Hidup (CV) 3 3. Ijazah dan Transkrip Nilai. 4 4. KTP dan KK. 5 5. Pas Foto Terbaru. 6 6. Sertifikat. 7 7. Portofolio. 8 8. Bukti Pengalaman Kerja. Item lainnya... ? 17 Feb 2023
CV di print di kertas apa?,Kertas yang paling umum digunakan untuk mencetak surat lamaran atau dokumen lainnya adalah kertas HVS 70 gsm. Kertas ini mempunyai dua ukuran yaitu kertas A4 dan F4. Jika dibandingkan dengan kertas HVS 80 gsm tentu harganya jauh lebih murah karena berkisar antara 30 ribu rupiah saja. 13 Okt 2021
Map warna apa untuk melamar kerja?,"Adapun map surat lamaran kerja sendiri memiliki standar khusus. Dikutip dari buku Mendapatkan Karier Idaman Dalam Sepekan karya Awan Santosa, map surat lamaran kerja adalah map yang berwarna cokelat dengan ukuran F4. 9 Nov 2022"
Amplop lamaran kerja warna apa?,"Belum tentu?beberapa perusahaan justru membebaskan pelamarnya dalam mengemas surat lamaran. Jadi, kesimpulannya; pilih amplop yang berkarakter kalau tidak ada peraturan 'wajib cokelat' dari penyeleksi. Tidak masalah, ketika Anda menggunakan warna hijau, merah muda, atau biru?selagi rapi dan formal. 30 Mei 2018"
Apakah CV harus menggunakan materai?,"Sebagai informasi tambahan, umumnya CV atau daftar riwayat hidup tidak perlu dilengkapi dengan materai. 17 Jun 2021"
Bagaimana sifat lamaran kerja bagi si pelamar kerja?,Surat lamaran pekerjaan bersifat formal ditandai dari informasi mengenai sumber awal informasi lowongan kerja. Informasi lowongan kerja untuk pekerjaan atau jabatan tertentu biasanya diperoleh dari pengumuman resmi pemerintah atau perusahaan.
Apakah boleh buat CV tulis tangan?,"   Pada umumnya, CV berisi riwayat hidup singkat meliputi pendidikan, pengalaman kerja, data diri, dan lainnya. Selain bisa diketik menggunakan komputer, kamu juga bisa membuat CV tulis tangan. 8 Okt 2022"
Apakah surat lamaran harus A4?,"Surat lamaran kerja sendiri dapat ditulis secara langsung atau diketik, baik ditulis atau diketik, ukuran standar surat lamaran kerja yang benar adalah menggunakan jenis A4 (kuarto) putih polos dengan tebal 80 gram. 22 Apr 2022"
Dimana buat CV gratis?,"   10 Website Buat CV Online Gratis Super Mudah Canva. Kickresume.com. Bikin CV. Novoresume. CV Maker. Visual CV. Indeed. Zety. Item lainnya... ? 14 Okt 2022"
Hal hal apa saja yang perlu dilampirkan dalam lamaran kerja?,"Untuk itu, sebagai bahan pertimbangan Bapak/Ibu Head of Human Resource Department, bersama surat lamaran kerja ini saya turut melampirkan : Fotokopi Ijazah Terakhir. Fotokopi Transkrip Nilai. Fotokopi KTP. Surat Keterangan Catatan Kepolisian (SKCK) Surat Keterangan Berbadan Sehat. Daftar Riwayat Hidup. Item lainnya..."
Apa saja yang harus diperhatikan dalam membuat surat lamaran kerja?,7 Hal yang Harus Diperhatikan Ketika Membuat Surat Lamaran Kerja Memberi Kesan Baik Pada Awal Surat. ...  Hindari Komentar Negatif Pada Mantan Perusahaan. ...  Tuliskan Kontribusi yang Sudah di Berikan Pada Pekerjaan Sebelumnya. ...  Cantumkan Kemampuan Atau Skill yang Dikuasai. Item lainnya... ? 13 Okt 2022
Bagaimana penulisan salam penutup pada surat lamaran kerja?,"Salam penutup perlu dituliskan dalam surat lamaran pekerjaan untuk menunjukkan kesopanan dan penghormatan pelamar. Contoh salam penutup dalam sebuah surat lamaran pekerjaan adalah Hormat saya,. Pilihan A termasuk salam pembuka, sedangkan pilihan B digunakan untuk mengawali penulisan nama dan alamat penerima surat."
Apa saja yang tidak boleh dalam penulisan surat lamaran kerja?,16 Kesalahan Surat Lamaran Kerja yang Harus Dihindari Melupakan beberapa aspek penting. ...  2. Cara menerangkan kemampuan. ...  Penulisan yang kurang rapi. ...  4. Terlihat seakan mengemis. ...  Menulis ?Seperti yang tertera pada CV saya?? ...  6. Surat lamaran kerja yang sama untuk semua jenis pekerjaan. Item lainnya... ? 25 Jul 2022
Hal hal apa saja yang perlu dihindari ketika menulis surat lamaran pekerjaan?,"Hal-hal yang harus dihindari dalam penulisan surat lamaran pekerjaan adalah sebagai berikut, kecuali ... terdapat gambar dan pernak-pernik. menggunakan kertas berwarna. tulisan menggunakan tinta warna-warni. bahasa yang digunakan bertele-tele. menggunakan bahasa baku. "
Bagaimana ciri ciri surat lamaran kerja yang baik?,"Ciri-ciri surat lamaran : Memiliki tempat dan tanggal pembuatan surat lamaran. Memiliki lampiran dan perihal. ...  Memiliki alamat yang akan dituju. Memiliki salam pembuka dan penutup. Memiliki identitas pelamar, tujuan, dan memberitahu terdapat lampiran. Memiliki tanda tangan serta nama terang pelamar itu sendiri. "
Perlukah kartu kuning untuk melamar kerja?,Untuk Melamar ke Perusahaan Swasta    Meskipun tidak semua perusahaan swasta mewajibkan setiap kandidat atau calon karyawan harus menyertakan kartu kuning sebagai syarat kelengkapan dokumen ketika melamar pekerjaan di perusahaan tersebut. 20 Jan 2023
Izin CV Apa Saja?,"Prosedur Mendirikan CV adalah sebagai berikut: Mempersiapkan Data Pendirian CV. Membuat Akta Pendirian CV di Notaris. Memiliki SK Pengesahan CV dari Kemenkumham. Mendaftarkan NPWP. Mendaftarkan SKT Pajak. Mengurus NIB / Nomor Induk Berusaha. "
Berapa minimal karyawan CV?,"Pendiri dan Status Kepemilikan    Sesuai aturan, CV didirikan minimal oleh dua orang yang akan berperan sebagai sekutu aktif dan sekutu pasif dan keduanya harus berkewarganegaraan Indonesia. 22 Apr 2022"
Apakah CV dapat didirikan oleh suami istri?,"Untuk pendirian CV didirikan oleh minimal 2 orang, dalam hal ini suami istri dihitung sebagai 1 karena dianggap 1 harta. Apabila ingin suami istri saja sebagai pemilik dan pengurus usaha maka harus memiliki perjanjian pra-nikah untuk memisahkan harta kekayaan."
