topic,context
Does DECA give scholarships?,"‍Apply through the Student Member Portal. Only current, submitted DECA members may apply, using their membership ID and password. Once logged into the student member portal, click on the “Apply for Scholarships” button at the top. The deadline to apply is January 13, 2023."
What do you get if you win DECA?,"Awards and Scholarships    In addition to placing in competitions, DECA members can win awards like the DECA Emerging Leader Honor Award, which looks impressive on college applications. Even better, DECA's scholarship program annually provides more than $200,000 in scholarships to DECA members. Jun 9, 2022"
Does DECA help get into college?,"Gain meaningful help when it comes to your collegiate dreams    Sure, extracurriculars such as being part of a sports team or the theater club at your school is impressive, but it is not all that unique. By being part of DECA, students are able to pique the interest of college admissions offices all around the country. Apr 28, 2021"
How much money does DECA allocate to scholarships each year also list 5 corporate sponsors?,"Each year, DECA and its corporate partners award over $200,000 in scholarships to DECA members."
What GPA do you need for DECA?,DECA Scholars' Mandate    Scholars must maintain a minimum 2.75 unweighted grade point average (GPA).
What is a benefit of joining DECA?,"DECA provides you with the tools, knowledge and skills to get the edge over your competition. Applying for an internship, scholarship, job or college just got a little easier... DECA membership shows that you are driven, academically prepared, community-oriented and career-focused—ready to tackle your future. Aug 29, 2022"
How much money does DECA allocate to scholarships each year?,"$200,000  We are excited to announce the 2022-2023 DECA scholarship program is open. DECA's scholarship program provides over $200,000 in scholarships to high school and collegiate DECA members each year. Many corporate partners of DECA provide scholarships through the DECA scholarship program. DECA Inc. Sep 12, 2022"
How hard is it to qualify for ICDC DECA?,"The Best DECA Members In The World!    To be eligible to compete at ICDC, members must place in the top 4 in their competitive event at the State Career Development Conference. Sep 8, 2022"
Does DECA cost money?,"What are membership dues? DECA Inc. membership dues are $10 USD per person (student, advisor, alumni and professional) plus appropriate chartered association dues for Collegiate DECA. Association dues can be found on your association's profile at deca.org/chartered-associations."
Does DECA look good on a resume?,"DECA is a nationally and globally recognized organization, and it looks great on any resume or application. Many managers who will be doing the hiring at organizations were a part of DECA in high school and/or college, and seeing ""DECA"" on a resume is a great talking point!"
Is DECA good for resume?,Nothing looks better on a college application or job résumé than being able to show the kind of professional development DECA adds to your curriculum.
Is FBLA or DECA better?,"While FBLA focuses on base knowledge and proficiency in business topics, DECA is more focused on the marketing facet of business. Thus, DECA's competitions involve presenting as well as test-taking, unlike FBLA competitions which consist mainly of testing until one reaches a very high level of competition. Mar 12, 2013"
How much scholarship money do most people get?,"The average scholarship award was $6,041 in 2022 — a 22 percent decrease from last year. During the 2021-22 academic year, 60 percent of American families used scholarships to pay for college. Nov 14, 2022"
How much do most scholarships pay?,"   Scholarship Statistics However, only 7% of college students will receive a scholarship. The U.S. Department of Education awards an estimated $46 billion in scholarship money annually. On average, first-time undergraduates who receive government grants and scholarships at a 4-year college receive about $13,690 annually. Nov 5, 2022"
How many scholarships does each team get?,"Division 1 FBS teams can give out a maximum of 85 full-ride scholarships to athletes. These scholarships are headcount scholarships, which means every athlete who receives a scholarship at the DI FBS level gets a full-ride scholarship. Division 1 FCS programs can provide a maximum of 63 total scholarships. Oct 21, 2022"
Is a 3.7 HS GPA good?,"   Overall, a 3.7 GPA is impressive. As a percentage, a 3.7 GPA means you've achieved an average of 90-92% in your classes. Achieving a 3.7 GPA in high school is good, and with an excellent application, there are many schools where you have a shot at acceptance. May 18, 2022"
How do I pass the DECA exam?,"Tips for Taking DECA Exams Study for Your Exam. Remember to Stay Calm. Read Each Question Slowly. Jan 25, 2016"
What class rank is a 3.7 GPA?,"   A 3.7 GPA, or Grade Point Average, is equivalent to an A- letter grade on a 4.0 GPA scale. This means is equivalent to a 90-92%. The national average GPA is 3.0 which means a 3.7 is well above average. A 3.7 GPA can be hard to raise as it's already so high, but if you're really determined you can make it happen."
What is the dress code for DECA?,"Jeans and any type of denim are not to be worn any time during the conference, including travel to and from the conference, and athletic wear should only be worn for recreational activities during the conference. Business casual attire is appropriate for travel to and from conferences and DECA events."
What grade can you join DECA?,"grades nine through twelve  DECA membership is available to students with career interests in marketing, entrepreneurship, finance, hospitality and management in grades nine through twelve. DECA membership is also open to DECA advisors, alumni and professional members. Students who are in college may join Collegiate DECA."
How long do you have to prepare for a role play in DECA?,"You have 10 minutes to prepare the role play. Write down whatever information necessary on the paper provided. Your role play should be between 5-7 minutes, and structured in the following way: 1-Introduction- (30 seconds) Introduce yourself and say who you are working for."
How much does the average student win in scholarships?,"The average scholarship is worth $7,400. Only 0.2% of students got $25,000 or more in scholarships per year. The NCAA awards more than $2.9 billion in athletics scholarships annually. 48% of students receive federal scholarships. Aug 15, 2022"
Are Big 10 scholarships guaranteed?,"The Big Ten has become the first major conference to guarantee scholarships to all student-athletes through the duration of an athlete's enrollment at one of its universities. Oct 10, 2014"
How rare are full tuition scholarships?,"Less than 1 percent of students get full ride scholarships, showing just how difficult it is to earn one. However, with the right background, proper planning and by knowing where to look, your chances of landing a full ride scholarship can increase."
How many people make it to DECA ICDC?,"DECA's International Career Development Conference supports educational initiatives. The DECA International Career Development Conference (ICDC) is the culmination of the DECA year. More than 19,000 high school students, teacher- advisors, business professionals and alumni gather for several days of DECA excitement."
How much does DECA ICDC cost?,"One of the first questions any new Collegiate DECA member with a high school DECA career asks is, “What is the cost of going to ICDC?” My response is an average of $400 – $500. Jan 16, 2016"
How many people qualify for DECA?,"   More than 10,000 DECA members demonstrate their college and career knowledge and skills by participating in DECA's Competitive Events Program. They are finalists from their chartered associations hoping to be named an international champion."
How much DECA should I take a week?,"Advance Deca Durabolin Cycles for Bulking    For weeks 1-6, you should take 200mg/oed of Testosterone Cypionate, 500mg/week of Deca, 50mg/ed of Dianabol, 4iu/ed of HGH and 0.5 mg/oed of Arimidex. For weeks 7-14, you should take you should go off of Dianabol and continue with the doses you followed from weeks 1-6. Oct 30, 2020"
How long can you use DECA for?,"You can adjust the length of your testosterone and deca cycles to meet your specific needs. These cycles last an average of 12 weeks, but you can extend them up to 16 weeks. For a 16-week cycle, you should take Arimidex, HGH, and testosterone supplement. Deca should be taken for 14 weeks, and dianabol 6 weeks."
Do you have to take a business class to join DECA?,"All students participating in California DECA must have taken or be currently enrolled in one of the following Career and Technical Education (CTE) classes: Marketing, Business Management and Administration, Hospitality and Tourism, and Finance."
What is 3 items that should not go into a resume?,"There's no need to include personal information on a resume such as your social security number, marital status, nationality, sexual orientation, or spiritual beliefs. In fact, it is illegal for employers to ask for these personal details."
Is DECA an extracurricular?,"If economics is one of those things, that might be a good place to focus your extracurricular achievement -- to spike, as Collegevine often puts it. Economics-related extracurriculars could include competitive clubs such as FBLA or DECA, but could also include related activities such as Model UN or debate."
How do you put DECA on a resume?,"   DECArate Your Resume Goal Oriented: Showing that you are involved in DECA shows that you are goal oriented and that you think one step ahead. ...  Commitment: On your resume when you show you have dedicated a significant amount of time to a single activity, it shows that you strive for growth and quality. More items..."
What do kids in DECA do?,"As chapter members, the students participate in various contests, such as writing business plans or role-playing in business scenarios, and travel across the country to participate in competitions and conventions. Oct 23, 2005"
What does DECA do in high school?,"DECA prepares emerging leaders and entrepreneurs for careers in marketing, finance, hospitality and management in high schools and colleges around the globe."
Is DECA only for high school students?,"Who can be a DECA member? DECA membership is available to students with career interests in marketing, entrepreneurship, finance, hospitality and management in grades nine through twelve. DECA membership is also open to DECA advisors, alumni and professional members. Jul 14, 2016"
What is the highest level of DECA competition?,"DECA competition includes three levels: district, state, and international."
Does FBLA look good for college?,"As these competitions put an emphasis on important values such as service, education, and leadership, any student who gets involved in FBLA can rest assured that their applications will look incredible once they get into the hands of college admissions officers in some of the best schools in the country."
Is FBLA or DECA bigger?,Membership numbers for FBLA (230 000) seems to be a bit higher than for DECA (177 000) countrywide.
Do d1 athletes get full rides?,"   However, for NCAA Division I sports, also known as head count sports, men's football, men's and women's basketball, women's volleyball, tennis and gymnastics, scholarships for college students are always full rides."
How can I increase my chances of getting a scholarship?,"Raise Your GPA for More Scholarships. Many scholarships have requirements surrounding GPA levels. ...  Raise Your ACT / SAT Score. ...  Raise Your Class Rank. ...  File the FAFSA. ...  Participate in Community Service. ...  Brush Up on Your Essay Skills. Dec 22, 2022"
Can you have too much scholarship money?,"Receiving too much scholarship money is a rare but possible scenario. If you've received scholarship funds that are greater than your cost of tuition and fees, oftentimes your college or university will send you a refund for the leftover money. Oct 7, 2022"
What are 3 college expenses that scholarships can pay for?,"DOOR scholarships can be used to cover a portion of the following costs: Tuition, registration, and additional fees. Room and board. Books and supplies. Health insurance fees. Transportation or travel expenses. "
What are the 4 types of scholarships?,Some Examples: Academic Scholarships and Merit Scholarships. ...  Community Service Scholarships. ...  First in Family Scholarships. ...  Leadership Scholarships. ...  Legacy Scholarships. ...  Military Scholarships. ...  No Essay Scholarships. ...  Prestigious Scholarships. More items...
What college gives the most scholarships?,"The 50 colleges that offer the most student aid Rank 1 College Columbia University Average financial aid package $55,521 Annual tuition and fees $55,056 Students receiving need-based aid 2,973 1 more row • Oct 29, 2018"
What is the easiest athletic scholarship to get?,"Track and field scholarships are considered to be one of the most accessible and easy to obtain. That is largely due to limited competition. Many athletes are involved in track and field disciplines. Aug 9, 2022"
Can D3 schools give full ride scholarships?,"While Division III schools are not able to offer full or partial athletic scholarships, it's important to note that they can provide financial aid to their student-athletes in other ways. In fact, 75% of Division III athletes receive some type of financial aid—which can be need-based or merit-based. Sep 8, 2021"
Do D2 schools give full ride scholarships?,"Very few student-athletes at Division II schools will receive full scholarships, but most will receive partial scholarships or some other form of athletic-based financial aid. Additionally, student-athletes can apply for other scholarships, like merit or academic scholarships, or other forms of financial aid. Sep 14, 2022"
Is GPA on a 5.0 scale?,"Typically, high schools that use weighted GPAs opt for the 0-5 scale that makes 5.0 the highest possible grade. A GPA higher than 5.0 is rare, but school point systems are occasionally structured so that students taking advanced classes can rack up bonus points."
What GPA is a 93?,"Search for Colleges Using Your GPA Letter Grade Percent Grade 4.0 Scale A 93-96 4.0 A- 90-92 3.7 B+ 87-89 3.3 B 83-86 3.0 8 more rows • Feb 23, 2023"
What is an 87 GPA on a 5.0 scale?,"The Weighted GPA Conversion Chart Letter Grade Percentage AP/IB GPA A 93-96 5.0 A- 90-92 4.7 B+ 87-89 4.3 B 83-86 4.0 8 more rows • Jan 23, 2020"
What is a good score on a DECA exam?,"   What are the criteria for DECA's Certificate of Excellence? ICDC competitors scoring a combined total score of 70% or better on the competitive event components from the preliminary competition will earn a digital Certificate of Excellence. May 10, 2022"
How does DECA help with college?,"DECA's scholarship program provides over $200,000 in scholarships to high school and college DECA members at the International Career Development Conference (ICDC) each year. DECA Inc. administers the program based on guidelines set by the donor. DECA scholarships are strictly merit-based."
What is a Harvard level GPA?,"Average GPA: 4.18     The average GPA at Harvard is 4.18. (Most schools use a weighted GPA out of 4.0, though some report an unweighted GPA. With a GPA of 4.18, Harvard requires you to be at the top of your class. You'll need nearly straight A's in all your classes to compete with other applicants."
What class rank does Harvard look for?,"The Harvard Crimson reports that the average reported GPA of entering freshmen in the class of 2022 was 3.90 on a 4.0 unweighted scale. According to College Data, the average weighted GPA of freshmen matriculates is 4.18. This demonstrates that you need to strive to graduate in the top 5% of your class."
What GPA is honor roll?,"a 3.0-3.499 grade point  Honor Roll & Dean's List. To be placed on the academic honor roll, a student must complete at least 14.0 semester hours with a 3.0-3.499 grade point for the semester, have no grade below C, and no incomplete grade."
Do colleges like to see DECA?,"Does DECA help get into college? Absolutely! College admissions offices love it when high school students are involved in leadership and professional activities. It demonstrates commitment, passion, and clear goal-setting."
Can you wear jewelry for DECA?,"The DECA polos and shirts are perfect for business casual. Dark-colored dress pants like black, navy, and grey look more professional; however, you have the freedom to be more casual and wear khakis. You can wear any color dress shirt, but stay away from patterns. Any jewelry should not be distracting."
How much does DECA cost?,"   What are membership dues? DECA Inc. membership dues are $10 USD per person (student, advisor, alumni and professional) plus appropriate chartered association dues for Collegiate DECA. Association dues can be found on your association's profile at deca.org/chartered-associations."
What are the perks of DECA?,"Membership benefits for students:    of all student organizations. DECA offers state and international recognition through competition in 38 occupational areas. DECA awards more than $250,000 in scholarships each year. DECA promotes free enterprise and entrepreneurship."
How do you greet a judge in DECA?,"Ask/Wait to be Seated.    Most of the time in a DECA role play you're judge is superior or your employer, so you want to be courteous and respectful. After shaking their hand and introducing yourself do not sit down. Either politely ask to be seated or wait until the judges asks you to be seated."
How do you stand out in DECA?,"While Presenting: Be calm, confident, professional and enthusiastic. Make eye contact upon entrance. Have a firm handshake and appropriate greeting. Speak slowly, watch out for ums, uhs, and other nervous habits. Tell the judge why you are there/what you are going to tell them – outline the case study. More items..."
What GPA is good for scholarships?,"3.0 GPA  Minimum requirements range from around 2.0 on the lower end to 3.75 or higher for competitive academic scholarships. Generally speaking, a 3.0 GPA or higher will give you a decent shot at qualifying for a variety of scholarships."
How rare is a full ride scholarship?,"Less than 1 percent of students get full ride scholarships, showing just how difficult it is to earn one. However, with the right background, proper planning and by knowing where to look, your chances of landing a full ride scholarship can increase."
What is the easiest scholarship to win?,"Top easy scholarships in 2023 $10,000 “No Essay” Scholarship. $2,000 Nitro College Scholarship – No Essay. $25,000 No Essay Scholarship. March Madness Scholarship. $5,000 Christian Connector Scholarship. $2,000 CampusReel Virtual Tour Scholarship. Annual Protestant Faith Based College Scholarship. More items... • 3 days ago"
What is the hardest sport to get a college scholarship?,"Hardest Men's Scholarship to Earn    Wrestling: only a 2.7% chance of earning a scholarship. Of the 395 programs, 78 of them are NCAA DI offering 9.9 scholarships per team. There are 64 NCAA DII programs offering 9 scholarships per team. Nov 10, 2021"
Can fafsa cover full tuition?,"The financial aid awarded based on the FAFSA can be used to pay for the college's full cost of attendance, which includes tuition and fees. While it is possible for student financial aid to cover full tuition, in practice it will fall short."
What scholarships pay for everything?,"USDA/1890 National Scholars Program. This scholarship provides full tuition, fees, books, and room and board each year for up to 4 years. Winners will also receive employment with the USDA during the summer and after graduation along with employee benefits. Aug 20, 2022"
How much does it cost to go to DECA ICDC?,"One of the first questions any new Collegiate DECA member with a high school DECA career asks is, “What is the cost of going to ICDC?” My response is an average of $400 – $500. Jan 16, 2016"
How many people qualify for DECA Nationals?,"More than 10,000 DECA members demonstrate their college and career knowledge and skills by participating in DECA's Competitive Events Program. They are finalists from their chartered associations hoping to be named an international champion."
What are three benefits of joining DECA?,"PREPARE for your future Learn. Enrich your career knowledge and skills for your future pursuits. Lead. Enhance your leadership skills as you become a next gen business professional. Compete. Engage in competitive events to prove your business prowess and earn DECA Glass. Discover. "
Does DECA make you bigger?,"Deca durabolin (deca) is one of the most popular anabolic steroids used by bodybuilders to bulk up and gain lean muscle mass. Anabolic steroids such as Deca durabolin are often used as part of 'bulking stack' and can increase muscle growth quickly when combined with a weight training program and protein rich diet. May 3, 2022"
How fast do you see results from DECA?,"In general, Deca will provide noticeable lean muscle mass results within the first 4-6 weeks of use. However, it should be noted that these results will not be as dramatic as those seen with some other steroids - such as Dianabol. Jun 7, 2022"
How much Deca per week?,"For the entire cycle, you should use 200mg/week of Deca, 50mg/eod of Winstrol, 2iu/ed of HGH and Cypionate at 150mg/week. Oct 30, 2020"
Can you take Deca alone?,"Experts believe that starting with a lower dose is good for building tolerance. On the contrary, advanced-level or pros can safely take off using higher power strength. Now you can start your deca dose all alone or consider stacking it with some other drugs. Sep 21, 2022"
Can a freshman join DECA?,"DECA membership is available to students with career interests in marketing, entrepreneurship, finance, hospitality and management in grades nine through twelve. DECA membership is also open to DECA advisors, alumni and professional members. Jul 14, 2016"
What are 4 common resume mistakes?,"Here are just a few of the most common CV mistakes, according to five employers. Having spelling errors and bad grammar. ...  Exaggerating the truth. ...  Poor formatting. ...  An unoriginal personal profile. ...  Not focusing on your achievements. ...  Making your CV too long. ...  Putting the wrong contact information. More items..."
What are the 3 F's of resumes?,"   The 3 F's of resume writing are Function, Form(at) and (e)Ffectiveness. When these 3 elements are adhered to simultaneously in the resume, they make it the perfect fit for the role you're applying to."
How does DECA work in high school?,"DECA's online events challenge members in online business simulations. Using an online program, members compete against other members in their region from their seats in the classroom to earn the opportunity to compete at the international level."
Should I join the DECA Club?,"   DECA provides you with the tools, knowledge and skills to get the edge over your competition. Applying for an internship, scholarship, job or college just got a little easier... DECA membership shows that you are driven, academically prepared, community-oriented and career-focused—ready to tackle your future. Aug 29, 2022"
What are 4 careers that DECA prepares you for?,"We prepare emerging leaders and entrepreneurs for college and careers. Business Management and Administration. Entrepreneurship. Finance. Hospitality and Tourism. Marketing. Personal Financial Literacy. "
How much money does DECA provide in scholarships each year?,"$200,000  APPLY by January 13, 2023    DECA's scholarship program provides over $200,000 in scholarships to high school and collegiate DECA members each year. Many corporate partners of DECA provide scholarships through the DECA scholarship program. Sep 12, 2022"
Is DECA an academic honor?,"The New York DECA Honor Society recognizes students that uphold academic excellence and showcase positive character, leadership, and service through their involvement with New York DECA."
What is DECA called in college?,"The Collegiate Division (formerly Delta Epsilon Chi) includes over 4,000 members in 200+ colleges and universities. The organization's mission statement is: DECA prepares emerging leaders and entrepreneurs in marketing, finance, hospitality and management in high schools and colleges around the globe."
How to prepare for the DECA exam?,"Take as many practice exams as you can and study their keys! After taking a practice exam, if you go through the key, it tells you which answer was right, and what the answers mean. So instead of just learning one term, you learn the overall concept. If there's a specific DECA topic you don't understand, look it up."
What is the biggest DECA chapter?,"The South Forsyth High School DECA chapter has been named the world's largest for the seventh year in a row. May 10, 2016"
How long do DECA competitions last?,"In these competitions, there are two parts: there is the written test (100 question test based on your event in 60 minutes) and the role play (role play scenario based on event in front of a business professional). Where does DECA travel? Regionals depends each year based on where our district chapter's home school is. Aug 30, 2018"
What GPA do you need for FBLA?,"Applicants must have a cumulative, minimum weighted grade point average of 2.5 on a 4.0 scale or equivalent. Unofficial transcript must be provided that verifies GPA. A resume outlining involvement in FBLA, leadership positions held, and awards received."
