topic,context
How hard is it to get into UCLA?,"According to Forbes, UCLA is considered a most selective school with an acceptance rate of 12%. Over 139,000 students applied for the UCLA Class of 2025. Of those applicants, UCLA admissions accepted roughly 31,000 students. Although there are no set UCLA GPA requirements, the average GPA sits around 3.95."
What is the lowest GPA ever?,0.0 on a 4.0 scale is the lowest GPA record.
What is the lowest GPA to get into Harvard?,"You should also have a 4.18 GPA or higher. If your GPA is lower than this, you need to compensate with a higher SAT/ACT score. For a school as selective as Harvard, you'll also need to impress them with the rest of your application. We'll cover those details next."
What GPA is most common?,"The average high school GPA in the US is 3.0, which also accounts for roughly 35% of students who don't end up applying for college. However, for college applicants, the average GPA is more likely between 3.5 and 4.0. 18 Nov 2021"
What is a 10.03 GPA?,"Normally, you would expect the highest score to be the 'perfect' 4.0 score, however, there are several things that a student can do to receive an even higher score. For example, one student actually managed to get a 10.03 GPA score. He did this by taking 17 advanced classes at his school, which awarded him many points."
What is the lowest SAT score for MIT?,"a 1500  There's no absolute SAT requirement at MIT, but they really want to see at least a 1500 to have a chance at being considered."
What is MIT average SAT?,"   For MIT, the average SAT score is between 1500–1570. Nationally, the average composite score is 1000. For Math, MIT accepted students averaged a score of 770–800; nationally the average score was 511. For Reading (sometimes called Verbal) MIT scored an average 750–800. 22 Des 2022"
What is the poor man's Harvard?,"With the diversity and poverty of its students, City College was known as “the poor man's Harvard.”"
Can you go to MIT for free?,"for the 2021–2022 academic year. And for most students with family incomes under $140,000 a year (and typical assets), we ensure that scholarship funding will allow them to attend MIT tuition-free."
What is the IQ of Ivy League?,you can see that the average IQ of all college graduates was 111. The average IQ of Ivy League colleges was 120.
What is the lowest SAT score for Harvard?,"a 1460  There's no absolute SAT requirement at Harvard, but they really want to see at least a 1460 to have a chance at being considered."
What IB score do you need for Ivy League?,"   US Universities    A score in the 40s will increase your academic competitiveness (note that many non-academic elements are in play), but a 38 or higher is still regarded as a strong IB score. You don't want to drop below the 36-point threshold if you're going for the Ivies. 9 Jan 2023"
Is SAT required for Harvard?,"We will allow students to apply for admission without requiring ACT or SAT test results. Consistent with Harvard's whole-person admissions process, standardized tests are only one factor among many."
What university has the lowest acceptance rate?,"Top 20 Institutions with Lowest Acceptance Rates SCHOOL LOCATION ACCEPTANCE RATE Princeton University Princeton, NJ 4% Stanford University Stanford, CA 4% Yale University New Haven, CT 5% Brown University Providence, RI 6% 16 baris lainnya • 24 Feb 2023"
Which Ivy campus is the nicest?,"   Ivy League Rankings 2022 Brown University ranking: #13. Columbia University ranking: #18. Cornell University ranking: #17. Dartmouth ranking: #12. Princeton University ranking: #1. Harvard ranking: #3. UPenn ranking: #7. Yale University ranking: #3. "
Which Ivy is the oldest?,"Harvard University  Founded in 1636, Harvard University is the oldest institution of higher education in the U.S. and one of the most selective in the Ivy League. The university is tied at No. 2 in our National Universities ranking. As a private research institution, Harvard has more than 100 research centers on campus."
What is the most attractive college campus?,"   25 Most Beautiful College Campuses in the USA in 2023 Berry College, Georgia. ...  The University of Notre Dame du Lac, Indiana. ...  University of San Diego, California. ...  Rice University, Texas. ...  University of Virginia, Virginia. ...  Pepperdine University, California. ...  College of William and Mary, Virginia. ...  Duke University, North Carolina. Item lainnya... • 22 Nov 2022"
Which college is most beautiful?,"   Nestled in Kashmir Valley on the banks of Srinagar's Dal Lake, the National Institute of Technology (NIT), which was established in 1960, has one of the most beautiful college campuses in India, without a doubt. 6 Mar 2022"
What is the best non Ivy League school?,"   Best Non-Ivy Schools By Ranking Massachusetts Institute of Technology (MIT) MIT ranks as the #1 Non-Ivy school in the country. ...  Stanford University. ...  University of Chicago. ...  4. California Institute of Technology (Caltech) ...  Duke University. 21 Okt 2022"
Can I get scholarship in USA with low GPA?,"There are also numerous scholarships that have no minimum grade point average requirements and are open to all students. Furthermore, there are 2.0 GPA scholarships that are open to any undergraduate, graduate student, or even high school students who wants to apply so they can attend their accredited college."
Are there scholarships without essays?,"   One of the biggest misconceptions about scholarships is that they all require an essay. This is not true. In fact, there are many great scholarships that don't require an essay at all."
How do I get a fully funded undergraduate scholarship in USA?,List of Fully Funded Undergraduate Scholarships in USA 2023 Clark Global Scholarship Program. ...  The HAAA Scholarship. ...  Yale University Scholarships USA. ...  Treasure Scholarship at Boise State University. ...  University of Memphis Scholarships. ...  Boston University Presidential Scholarship. ...  Berea College Scholarships. Item lainnya... • 3 Des 2022
Who is eligible for international scholarship?,The Education Future International Scholarship is only offered to the meritorious Indian students for studying overseas at any of the top universities globally. Applicant should have a minimum scored 60% in 10th and 12th. Applicants should reflect that they lack means of self-funding their education abroad.
Do scholarships pay for dorms?,"Some cover room and board at the college only. Others cover expenses like books, computers and fees. However, you will find that there are scholarships out there with less rigid stipulations, and these can pay for off campus housing."
Can you keep scholarship money you don't use?,"   However, these funds must be used correctly. Failing to use scholarship funds for education-related expenses can result in a scholarship provider revoking your award, or forcing you to pay back what you spent. In extreme circumstances, providers could take legal action. 7 Okt 2022"
When should you start applying for scholarships?,"When do I apply for scholarships? That depends on each scholarship's deadline. Some deadlines are as early as a year before college starts, so if you're in high school now, you should be researching and applying for scholarships during the summer between your junior and senior years."
Can you get a scholarship twice?,"   Furthermore, one of the greatest things about scholarships is that you can get as many as you need. Undergraduate students applying for scholarships for the first time are often concerned about how receiving scholarships may affect other financial aid packages they hope to get, like federal student aid or work-study. 17 Agu 2022"
Which country is most Favourable for international students?,#8 - Switzerland. 🌍 ...  #7 - The Netherlands. 🌍 Ranked #4 in Europe. ...  #6 - Germany. 🌍 Ranked #3 in Europe. ...  #5 -France. 🌍 Ranked #2 in Europe. ...  #4 - Canada. 🌍 Ranked #2 in North America. ...  #3 - The United States. 🌍 Ranked #1 in Europe. ...  #2 - Australia. 🌍 Ranked #1 in Oceania. ...  #1 - The United Kingdom. 🎓 High-quality teaching. Item lainnya... • 30 Des 2022
Which countries offer full scholarships for bachelors?,Background. Types of Scholarships. CANADA. University of Toronto (Lester B. ...  AUSTRALIA. University of Technology Sydney (UTS Vice-Chancellor's International Undergraduate Scholarship) ...  NEW ZEALAND. New Zealand Scholarships For International Tertiary Students (New Zealand Government) HUNGARY. ...  PORTUGAL. ...  AUSTRIA. Item lainnya...
Can you get scholarship with SAT?,Income-eligible students who live in India and get a total SAT score of 1300 or higher may qualify for a merit-cum-need scholarship at participating universities. Scholarship amounts are based on the student's annual family income. Students who score 1300 or higher earn the honor of being an SAT India Top Performer.
Which scholarship is best for international students?,Undergraduate Scholarships for International Students Aga Khan Foundation International Scholarship. ...  Fulbright Program for Foreign Students Scholarship. ...  MPOWER Global Citizen Scholarship. ...  MPOWER Monthly Scholarship Series. ...  Philanthropic Education Organization International Peace Scholarship. Item lainnya...
Is 1290 a good SAT score?,"Unfortunately, 1290 is not a good SAT score. In reality, it's a weak score that will keep you from achieving your college admissions goals. Although you're still outperforming the majority of test takers, it's still not enough to get you into the top schools in the country. 9 Agu 2022"
Which country is cheapest to study for international students?,"10 of the most affordable places to study abroad Germany. ...  France. ...  Mexico. ...  India. ...  Argentina. ...  Poland. ...  Malaysia. ...  South Africa. Concluding our look at some of the best places to study abroad on a budget, South Africa is renowned for its natural beauty, cultural diversity, and turbulent history. Item lainnya..."
Can I get a full-ride scholarship with a 3.5 GPA?,"For students with a 3.5 GPA, a number of scholarship opportunities are available. There are college-based awards as well as external scholarships. Furthermore, some of these awards are based on merit, while others are need-based."
"Is a $25,000 dollar scholarship good?","A scholarship that offers $25,000 to $49,999 is still worth the student's time and effort. Even a scholarship worth $500 deserves an application, since every dollar won is a dollar less borrowed. There are many more scholarships at these award levels, but here are a dozen of the most famous scholarships."
Which country is No 1 in world?,United States. The United States of America is a North American nation that is the world's most dominant economic and military power.
Where do most international students live in USA?,"Details of each of these states are discussed below: California. California is among the best states in USA for international students known for the 9 top-ranked universities, the best graduate salaries nationally, and its landscape. ...  New York. ...  Texas. ...  Florida. ...  Utah. "
What is the safest country in the world for international students?,The safest countries for international students: Overview Personal safety rank in Europe Country GPI score 1 Iceland 1.107 2 Ireland 1.288 3 Denmark 1.296 4 Austria 1.300 42 baris lainnya • 9 Nov 2022
How can I study in USA for free?,"   International students looking to study in USA for free can enrol themselves in fully-funded universities that do not charge fees for international students. ...  How to Study for Free in the USA? Prepare an Excellent Application. Attend Tuition-Free Universities. Apply for Scholarships. Look for Part-Time Job Opportunities. 16 Jun 2022"
What country doesn't pay for college?,"Countries that offer no (or low) tuition for a college degree. Finland, Germany, Iceland, Scotland and Sweden are among the places that don't charge college tuition, though that often depends on whether you're a resident or an international student. 1 Jul 2022"
Can a poor student study abroad?,"Can poor Indian students study abroad? Yes, your financial status will not be a strong limiting factor if you have an excellent academic record and you meet all other entry requirements for the course. Explore all the ways to fund your studies, especially scholarships. 9 Des 2022"
Which country has no exams?,"   Well, this might sound impossible, but it is true. The country is none other than Finland, the happiest country in the world. In Finland, there are no mandated standardized tests. There are no rankings, no comparisons, no competitions, apart from one exam at the end of students' senior year in high school. 23 Sep 2022"
Which country is the easiest to study?,The following countries will make it easy for international students to earn some extra money during their studies. Study in Russia. ...  Study in New Zealand. ...  Study in Switzerland. ...  Study in France. ...  Study in Australia. ...  Study in Canada. ...  Study in UK. ...  Study in USA. Number of USA universities in the QS World University ranking 2021. Item lainnya... • 30 Jan 2023
Which country is easy to study for international students?,"One of the best countries to study abroad and work in 2023, Germany offers free tuition to undergraduate students in all states but one. Among the list of the best countries to study in Europe, Germany is definitely one of the most popular destinations for international students. 13 Feb 2023"
Can I get full scholarship with 3.9 GPA?,"Getting a full-ride scholarship with a 3.9 GPA is possible, but it isn't as common as you might think. Most scholarships only cover a certain percentage of your tuition, so you will still have to pay some of the cost of college."
Who is most likely to get a scholarship?,"Learners with a 3.5 or higher GPA (17%) are the most likely to receive private scholarships, followed by those with a GPA of 3.0 to 3.4 (13.1%), 2.5 to 2.9 (10.4%), 2.0 to 2.4 (8.3%), and less than 2.0 (7%) (Kantrowitz, 2019). 23 Agu 2022"
What is the most common scholarship?,"Need-Based Scholarships     One of the most popular types of scholarships for college are need-based. These scholarships are accessible to applicants who have a demonstrated financial need, and a program might ask for proof, such as income documentation or FAFSA® information. 22 Jun 2022"
Can non US citizens get college scholarships?,"Many states do not offer government-funded scholarships for undocumented students. However, at least seven states, including Texas and California, do offer financial aid. Additionally, many private scholarships do not require U.S. citizenship for eligibility."
What is the best time to apply for scholarships?,"Common Scholarship Deadlines    Most scholarship application deadlines will occur during the regular academic year, typically September through May. While this does give you some time to apply for scholarships, it still is a good idea to start searching for scholarships early."
What makes you the best scholarship applicant?,"Bring up something that makes you stand out from other students, especially if it's related to the scholarship you're applying for! Whether it's winning awards or competitions, being president of an organization, graduating at the top of your class, or anything else that enhances your application. 15 Okt 2021"
What qualities do scholarships look for?,"The Scholar Qualities Forceful and Unselfish Character. Creativity and Leadership. Intellectual and Personal Vigor. "
Do international students get scholarship in USA?,"Just about every university in the United States offers scholarships to international students. Still, the amount of money the average international student typically pays is higher than the amount domestic students pay."
What is the most prestigious scholarship in the US?,"Most Prestigious Scholarships Name of Scholarship Maximum Award Deadline Month Harry S. Truman Scholarships $30,000 February Luce Scholars Program All Expenses October Marshall Scholarships All Expenses October National Merit Scholarship Program $2,500 November 6 baris lainnya"
How rare is it to get a scholarship?,"   7% of students are likely to receive a scholarship. Only 1.5% of students will receive a full scholarship. $8.8 billion was awarded in need-based scholarships. White students have a 14.2% chance of getting a scholarship, while minority students have 11.2%."
What is the 5 strong scholarship?,The mission of the 5 Strong Scholarship Foundation is to increase the retention and graduation rates at partnering Historically Black Colleges and Universities by assisting in the enrollment and success of academically promising student leaders until graduation.
Does MIT give full ride scholarships?,"This number includes Pell grants and scholarship grants from non-MIT sources. for the 2021–2022 academic year. And for most students with family incomes under $140,000 a year (and typical assets), we ensure that scholarship funding will allow them to attend MIT tuition-free."
Does Yale give full ride scholarships?,All financial aid for Yale undergraduates is need-based. Yale College does not award merit-based scholarships.
Is Harvard free if you make less than 100k?,"If your family's income is less than $75,000, you'll pay nothing. Families who earn more than $150,000 may still qualify for financial aid. For more than ninety percent of American families, Harvard costs less than a public university. All students receive the same aid regardless of nationality or citizenship."
What is the easiest full scholarship to get?,Top easy scholarships in 2023 CJ Pony Parts Scholarship Video Contest. Zombie Apocalypse Scholarship. Young Filmmakers Contest. The 1st Financial Bank Financial Goals Scholarship. Education Matters Scholarship. Top Ten List Scholarship. Unigo $10k Scholarship. I Have A Dream Scholarship. Item lainnya... • 3 hari yang lalu
How can I get Oprah Winfrey scholarship?,Oprah Winfrey Leadership Academy for Girls Scholarship 2023 Selection Process Entrance test will be conducted initially. First stage qualified students will have more extensive testing – Academic and Leadership Potential. Stage 3 will be Selection Camps – Clinical Interviews and a range of Psychological assessments. Item lainnya...
How can I get 1000 dollars in scholarships?,13 Best Tips for Winning College Scholarships Apply for local scholarships. ...  Apply for scholarships with smaller awards. ...  More work = fewer applicants = better chances. ...  Get personal. ...  Don't introduce yourself in your essay. ...  Don't repeat the essay prompt. ...  Don't use quotes. ...  Satisfy all the requirements. Item lainnya... • 28 Mar 2016
Which US university gives 100% scholarship?,Yale University Scholarship USA    This is a fully funded scholarship for international undergraduate/graduate/PhD students at Yale University.
Is it hard to win scholarships?,"Odds of Winning a Scholarship    Only about 1 in 8 college students wins a scholarship, and the average amount used to pay for college is about $4,200 a year. Very few students win $25,000 or more in scholarships each year (only about 0.1%). Among the students who win scholarships, 97% win $2,500 or less. 16 Nov 2020"
How do I know if I got accepted for a scholarship?,"Scholarship providers usually only start reviewing applications once the deadline passes. They then usually choose a winner within 3 months of the deadline. If you've won, they'll contact you by phone or email, and explain to you how you'll receive your scholarship prize money."
How can I get a full scholarship to study in USA?,"Documents required to apply for scholarships to study in the USA Academic scores copy (GPA) Standardized test scores (SAT, ACT, GRE, GMAT score) Photo ID/Passport (Aadhar card in certain cases) Language proficiency proof (IELTS, or TOEFL exam score) Motivation letter/Statement of Purpose. Recommendation letter. "
How do I get a fully funded scholarship in USA?,"Fulbright Scholarships are fully funded scholarships for international students. These scholarships are only offered for masters and PhD studies. Fulbright Foreign Student Program covers full tuition fee, a living stipend, full accommodation fee, airfare and health insurance. 4 Des 2022"
What happens if you get a scholarship and fail?,"Whether you're receiving scholarships, grants, or loans, a failed class could impact whether you qualify for your aid or need to repay your provider anything. The specifics of your academic and financial situation impact your best course of action, so contact your financial aid provider for personalized options. 31 Agu 2022"
Why do scholars fail at school?,"It could be a lack of skill, lack of courage, a lack of commitment, and a lack of goals. When students procrastinate, they get overwhelmed. And when they get overwhelmed, they do mediocre work, making them fail."
Are you guaranteed a scholarship?,"While many students rely on institutional scholarships to help pay for college, you are never guaranteed a scholarship from a college you attend. Although you may be granted one, it is never set in stone. 22 Des 2022"
What are some of the craziest scholarships?,"List produced by the Facts The Gertrude J. ...  Mycological Society of America Scholarships: Award varies. ...  Tattoo Journal Ink Scholarship: Up to $1,800. ...  American Board of Funeral Service Education National Scholarship Program: $2,500. ...  American Association of Candy Technologists John Kitt Memorial Scholarship: $5,000. Item lainnya..."
What is the most difficult part of finding scholarships?,"The most difficult part is making sure your child finds the time to search for relevant awards, complete the applications, draft essays, ask for letters of recommendation, and send them all out before the deadline passes. Here are four tips to help you and your child navigate the application process. 4 Nov 2019"
In which country I can get full scholarship?,By country of interest. US Scholarships. UK Scholarships. Canada Scholarships. India Scholarships. China Scholarships. Germany Scholarship. Japan Scholarships. Item lainnya... • 6 hari yang lalu
How do you ask for a scholarship?,Here's a list of steps you can follow to write a scholarship application letter: Review the organization's requirements. ...  Include your contact information. ...  Introduce yourself and why you're applying. ...  Discuss your major accomplishments. ...  List your unique skills or qualities. ...  Express your interest in your education or career. Item lainnya... • 6 Mei 2022
Which American city is best for international students?,"Here are the top 8 best cities to study in USA that you should consider. Boston. Chicago. San Francisco. Los Angeles. New York. Atlanta. Washington, DC. San Diego. "
Which country sends most students to USA?,"The majority of international students studying in the United States are originally from China and India, totaling 290,086 students and 199,182 students respectively in the 2021/22 school year. 4 Jan 2023"
Which is the cheapest city in USA for international students?,"Listed below are most affordable cities in USA for international students: San Diego. This city has lower tuition fees and is very affordable from the point of living. ...  Baltimore. Baltimore is known to be the city of charm. ...  Atlanta. ...  Philadelphia. ...  Houston. ...  Chicago. "
Which state is cheapest for international students?,"1. Wyoming. The cheapest state to study and live in the USA for international students is Wyoming or the 'Equality State' as they call it. It is the 10th largest state in the USA by area, but the least populous. 31 Mei 2022"
Can I bring my parents to USA on student visa?,"If your parent(s) or other family members, including children over the age of 21, wish to enter the U.S. temporarily to visit, they may enter on a B-2 tourist visa. As an F-1 or J-1 student, you should write an invitation letter to your relative or family member to submit with their B-2 visa application."
Can I stay in US after student visa?,An Optional Practical Training (OPT) extension or STEM OPT extension to your F-1 visa can allow you to stay in the US legally after you graduate.
How much bank balance is required for US student visa?,"While there are no rules requiring a minimum bank balance to apply for a student visa for the USA from India, it costs approximately $500 USD to obtain your F-1 student visa. The cost is broken down into two fees: the I-901 SEVIS fee ($350) and the DS-160 form fees ($160)."
Who is the boy scored 1600 on the SAT?,"Stephen Kennedy, a senior at Flint Hill School in Oakton, recently learned he had received a perfect 1600 score on the SAT he took at the school in late August. “I worked pretty hard to achieve a score that I wanted,” said Kennedy, who recently turned 18. 19 Sep 2022"
Who has gotten a perfect SAT?,"A Davis Senior High School student received a perfect score on his SAT exam. Apurva Mishra's father called KCRA 3 when the results arrived, ecstatic that his son scored a 1600 score, placing him in the 99th percentile in the nation among test-takers. He also got every single question correct. 18 Jan 2022"
Can an international student get scholarship with SAT?,"   You could browse these universities and check the scholarship requirements and funding option. Institutions around the world readily accept SAT as A valid indicator of English proficiency, and so does scholarship organization. 19 Sep 2022"
What is 99th percentile on SAT?,SAT Score Percentiles Chart SAT Score Nationally-Representative Percentile Percentile Among Actual SAT Test Takers 1600 99+ 99+ 1520 99+ 99 1510 99 98 1500 99 98 87 baris lainnya
