topic,context
What clubs look best for college?,"What Are the Best Extracurriculars for College? Leadership Work and Positions. Colleges seek out applicants with leadership experience. ...  Part-Time Jobs. ...  Sports and Athletic Participation. ...  Academic Clubs and Teams. ...  Artistic and Creative Pursuits. ...  Volunteering and Community Service. ...  Internships. "
How do you win a DECA competition?,"7 Tips to Help You Ace Your Role-play Understand Performance Indicators. Learn your performance indicators! ...  Study Exam Questions. The exam is just like one in school: the more you study, the better you'll do. ...  Practice, Practice, Practice. ...  Make a Chart. ...  Create a Visual. ...  Engage the Judge. ...  End Strong. Jan 9, 2015"
How can DECA FBLA benefit you?,FBLA Review: How does it help me? Gain knowledge and experience about the business world. Develop leadership skills. Build self-confidence. Network with like-minded students all over the country. Compete in numerous challenges and competitive events. Get the opportunity to travel to attend conferences. Get a scholarship. More items...
What is the hardest sport to go D1 in?,"Boxing. The Sweet Science. That's the sport that demands the most from the athletes who compete in it. It's harder than football, harder than baseball, harder than basketball, harder than hockey or soccer or cycling or skiing or fishing or billiards or any other of the 60 sports we rated."
Do D1 athletes get free gear?,"D1 schools, with more money to spend and less budget restrictions, will typically give out more gear, equipment, recovery tools, and other random items to their athletes. However, this does not mean that D2 schools do not do the same thing."
Do all D1 athletes get free food?,"Related Stories. Division I student-athletes can receive unlimited meals and snacks in conjunction with their athletics participation, the Legislative Council decided Tuesday. The rule, which applies to walk-ons as well as scholarship student-athletes, is an effort to meet the nutritional needs of all student-athletes. Apr 15, 2014"
What ACT score gives you a full ride?,"Overall, my research so far has been surprising in that there are a few schools that will offer full-tuition scholarships starting in the 22 – 25 ACT range, but most full-ride scholarships require a 28 ACT or higher."
Who is most likely to get a scholarship?,"Learners with a 3.5 or higher GPA (17%) are the most likely to receive private scholarships, followed by those with a GPA of 3.0 to 3.4 (13.1%), 2.5 to 2.9 (10.4%), 2.0 to 2.4 (8.3%), and less than 2.0 (7%) (Kantrowitz, 2019). Aug 23, 2022"
What scholarships do most people get?,"   We've included a few badges to help you identify some features of the scholarships. Fulbright Scholarship Program. ...  Excelsior Scholarship. ...  The Coca-Cola Scholarship. ...  National Merit Scholarship. ...  Hispanic Scholarship Fund. ...  Hope Scholarship. ...  The Gates Scholarship. ...  The Gates Millennium Scholars Program. More items... • Jan 4, 2023"
Can I buy a car with scholarship money?,"Buying a car to drive to and from campus is an expense that many college students incur. Unfortunately, it's not one that can be covered by scholarship money. Oct 7, 2022"
Do you keep leftover scholarship money?,"   What happens to leftover scholarship money. If you earned scholarships and grants that add up to more than your total cost of attendance, your school may send you a refund of the leftover scholarship money. Keep in mind, you may have to pay taxes on that amount."
Can I buy a laptop with scholarship money?,"If you received grant or scholarship money to attend college, you may be able to purchase a laptop with your funds. Some financial aid packages include a stipend specifically reserved for laptops, books, and other school-related expenses. Federal Pell Grants can also be used to purchase laptops (in a roundabout way). Jun 1, 2022"
How much is a D1 stipend?,"In addition to a tuition free education, student-athletes will now receive yearly stipends of $2,000 to $4,000 intended to cover cost-of-living expenses."
Can you live off of scholarships?,"Just as you can use scholarships to pay for tuition, you can use scholarship money for living expenses as well. What some students may not realize is that room and board can oftentimes be just as expensive as tuition – if not more. Aug 10, 2019"
What type of scholarship pays for everything?,"A full ride scholarship is an award that covers all expenses related with college. This includes tuition, books, fees, room and board, and possibly even living costs. The goal is to remove any need for additional financial aid."
How can I get Oprah Winfrey scholarship?,Oprah Winfrey Leadership Academy for Girls Scholarship 2023 Selection Process Entrance test will be conducted initially. First stage qualified students will have more extensive testing – Academic and Leadership Potential. Stage 3 will be Selection Camps – Clinical Interviews and a range of Psychological assessments. More items...
What grades do scholarships look at?,"Some scholarship committees only consider applicants whose GPA meets a certain threshold. Minimum requirements range from around 2.0 on the lower end to 3.75 or higher for competitive academic scholarships. Generally speaking, a 3.0 GPA or higher will give you a decent shot at qualifying for a variety of scholarships."
What GPA do you need for a full scholarship?,"A 4.0 Grade Point Average is not only a high GPA, it's an impressive GPA that's sure to catch the eyes of many scholarship providers. Since the minimum GPA for a full-ride scholarship is usually set at 3.5, a 4.0 is sure to always be above and beyond what's required. Nov 7, 2022"
What SAT score do you need for a full scholarship?,"   So you're probably wondering, What's a good SAT score for scholarships, and how can I find them? The short answer is that you should aim for an SAT score between 1200 and 1600 if you want to secure some scholarships based on merit–and the higher within that range you score the more money you're looking at. Sep 5, 2022"
What GPA do scholarships use?,"Students who hold a GPA between 3.5 to 4.0 may distinguish themselves to institutions awarding academic scholarships. Since many students may receive high GPAs, colleges often grant scholarships to those who meet other criteria in addition to having a high GPA. Jun 4, 2020"
What sport is the hardest to get recruited for?,"The 5 Hardest Sports to Make it to the Pros In (Statistically) Ice Hockey. If you enjoy the majesty of gliding over the ice and the thrill of smashing into other adults, you might want to pursue a career in hockey. ...  Baseball. ...  Soccer. ...  Basketball. "
How rare is a full ride athletic scholarship?,"Most student-athletes do not receive a full-ride scholarship—in fact, only 1 percent do. Still, full-ride scholarships as the goal for many athletes, as they typically cover tuition and fees, books, room and board, supplies, and sometimes even living expenses."
What GPA do you need for a D3 scholarship?,There are no set NCAA GPA requirements for Division 3 as schools set their own admissions standards you must meet in order to compete.
Is playing D3 sports worth it?,"If you want to focus on academics as much as your sport, a D3 program is your best bet. This doesn't mean you don't train or practice. But it's less demanding and intense than it would be at a D1 or D2 school. Academics are just as important as athletics in a D3 school."
Can you verbally commit to a D3 school?,"Currently, there are no NCAA rules regulating when an athlete can commit to a college. An athlete can make a verbal commitment to a school whenever they want, assuming the coach at the school has made them an offer."
What GPA do you need for a D2 scholarship?,a 2.2 GPA  The minimum GPA you can have to be considered an early academic qualifier for D1 is a 2.3 GPA and a 980 SAT combined score or 75 ACT sum score. You will need a 2.2 GPA and a 900 SAT combined score or 68 ACT sum score to be eligible at the Division II level.
What GPA do you need to play D2 sports?,"To study and compete at a Division II school, you must earn 16 NCAA-approved core-course credits, earn a minimum 2.2 core-course GPA and submit your final transcript with proof of graduation to the Eligibility Center."
How many D1 athletes get full rides?,"NCAA divisions    Just 85 full ride scholarships are available to NCAA D1 universities annually. Fewer still are on offer to D2 colleges. Division 3 includes 432 schools, but these institutions do not offer college athletic scholarships."
What is a 7.0 GPA?,"   Your grade point average (GPA) is the average result of all your grades and is calculated on a 7-point grading scale. 7 being the highest (HD), and 0 is the lowest (fail)."
What GPA does Harvard accept?,"a 4.18 GPA or  You should also have a 4.18 GPA or higher. If your GPA is lower than this, you need to compensate with a higher SAT/ACT score. For a school as selective as Harvard, you'll also need to impress them with the rest of your application."
What is the highest GPA ever?,"A GPA higher than 5.0 is rare, but school point systems are occasionally structured so that students taking advanced classes can rack up bonus points. One student even managed to land a stunning 10.03 GPA by taking 17 advanced classes at a school that awarded bonus points."
What is a 97% in GPA?,"Search for Colleges Using Your GPA Letter Grade Percent Grade 4.0 Scale A+ 97-100 4.0 A 93-96 4.0 A- 90-92 3.7 B+ 87-89 3.3 8 more rows • Feb 24, 2023"
How hard is it to get a 3.8 GPA in college?,"A 3.8 GPA, or Grade Point Average, is equivalent to an A- letter grade on a 4.0 GPA scale. This means is equivalent to a 90-92%. The national average GPA is 3.0 which means a 3.8 is far above average. Because a 3.8 is already so high it can be hard to raise, but with hard work and dedication it is possible!"
What is a 1.88 GPA?,"   The national average for a GPA is around 3.0 and a 1.8 GPA puts you below that average. A 1.8 GPA means that you've gotten only C-s and D+s in your high school classes so far. Since this GPA is significantly below a 2.0, it will make things very difficult for you in the college application process."
What is the average GPA in America?,"   3.0  The average GPA in US High Schools is 3.0. This number varies by gender – the average female GPA is 3.1 and the average male GPA is 2.9."
How to convert a 100 GPA to 4.0 GPA?,"Converting your college GPA to a 4.0 scale is not necessarily as simple as saying a 95 on a 100-point scale is a 4.0. ... 1. Compare your individual grades to a 4.0 scale. A+ 97-100 4.0 A 93-96 4.0 A- 90-92 3.7 B+ 87-89 3.3 B 83-86 3.0 7 more rows • Nov 15, 2020"
What is the highest GPA in college?,"4.0  When you study at a US university, your GPA is on a scale from 0.0 to 4.0, with 4.0 being the highest your GPA can be. GPA is very important in US universities. Oct 28, 2021"
Does DECA look good for college?,"Joining DECA is an excellent way to prepare for college and career success, impress college admissions officers, and jumpstart future business opportunities. Jun 9, 2022"
Can DECA benefit you academically?,"   DECA provides you with the tools, knowledge and skills to get the edge over your competition. Applying for an internship, scholarship, job or college just got a little easier... DECA membership shows that you are driven, academically prepared, community-oriented and career-focused—ready to tackle your future. Aug 29, 2022"
Does the DECA test matter?,"Though they are often overlooked, these exams can make or break your chance at winning in competition. Additionally, they can bump you up into that highly coveted first place spot."
Is DECA Club worth it?,"By being part of DECA, students are able to pique the interest of college admissions offices all around the country. Moreover, being part of DECA will show people in admissions offices that you are driven and already have a good idea of what kind of career you ultimately want to go down. Apr 28, 2021"
What is the hardest school to get into?,"The 25 Hardest Colleges to Get Into in 2023 1) Harvard University. 2) Columbia University. 3) Caltech. 4) Stanford University. 5) MIT. 6) Princeton University. 7) Yale University. 8) Brown University. More items... • Nov 11, 2022"
What GPA is needed for Yale?,"In truth, you need close to a 4.0 unweighted GPA to get into Yale. That means nearly straight As in every class."
What is the lowest GPA to get into Stanford?,"There is no minimum GPA or test score, nor is there any specific number of AP or honors courses you must have on your transcript in order to have your application reviewed or be admitted to Stanford. Aug 4, 2022"
What is the lowest GPA Harvard accepted?,"a 4.18 GPA  Continue to work hard, take difficult classes, and show your passions outside of school! To get to Harvard your GPA has to be at least a 4.0 and even then if you get in your lucky but they require at least a 4.18 GPA only ."
What is the lowest SAT score for Ivy League?,The minimum SAT score to get into an Ivy League school ranges from 690 to 730 for the reading section and from 700 to 730 for the math section. Getting 700 or 710 (or higher) on both of these sections will give you an advantage at most Ivy League universities.
What is the lowest SAT score at Harvard?,"a 1460  There's no absolute SAT requirement at Harvard, but they really want to see at least a 1460 to have a chance at being considered."
What GPA is president's list?,"The President's Honor Roll, published at the end of each semester, contains the names of students who have earned a GPA of 4.0."
Is 89 average with honors?,Candidates for honors from Grades 1 to 12 shall be top ten learners whose General Average is 90 and above.
Is Dean's List impressive?,"Earning a spot on the dean's list at your college is one the highest levels of recognition for scholarly achievement. Every term, the highest-ranked students based on GPA receive this award."
What is a good DECA exam score?,"   What are the criteria for DECA's Certificate of Excellence? ICDC competitors scoring a combined total score of 70% or better on the competitive event components from the preliminary competition will earn a digital Certificate of Excellence. May 10, 2022"
Does DECA have a dress code?,"Jeans and any type of denim are not to be worn any time during the conference, including travel to and from the conference, and athletic wear should only be worn for recreational activities during the conference. Business casual attire is appropriate for travel to and from conferences and DECA events."
Do you need a suit for DECA?,"   Males must be in a suit, official DECA blazer or sport coat with dress slacks, collared dress shirt, necktie, dress shoes and dress socks. Business Casual for gentlemen means a collared shirt and dress slacks / khakis. For ladies, it includes slacks and a dress polo or button-down blouse."
Can you wear a skirt to DECA?,"updated the dress code standards for competition and attendance at the International Career Development Conference – with an emphasis on MORE conservative attire. FEMALES: skirts and dresses must be at or below the knee; dress blouse or a collared dress shirt and appropriate neckwear (necktie, ascot, scarf)."
Can you wear boat shoes to DECA?,"Skin-tight or revealing clothing • Midri-baring clothing • Swimwear • Athletic clothing • Leggings or graphic designed hosiery/tights • Clothing with printing that is suggestive, obscene or promotes illegal substances • Unacceptable types of dress shoes include boat shoes, canvas or fabric shoes, flip flops or casual ..."
How long should you run DECA?,"Deca should be taken for 14 weeks, and dianabol 6 weeks. Deca 50 is a great choice for cutting as it can be combined with testosterone. Use a 250mg testosterone enanthate (Tenorex) supplement for the first eight weeks of a cutting cycle such as the one shown here. Take 200mg of deca from weeks 1-12."
How do you ace a DECA role play?,"   7 Tips to Help You Ace Your Role-play Understand Performance Indicators. Learn your performance indicators! ...  Study Exam Questions. The exam is just like one in school: the more you study, the better you'll do. ...  Practice, Practice, Practice. ...  Make a Chart. ...  Create a Visual. ...  Engage the Judge. ...  End Strong. Jan 9, 2015"
How long is a DECA roleplay?,"between 5-7 minutes  Your role play should be between 5-7 minutes, and structured in the following way: 1-Introduction- (30 seconds) Introduce yourself and say who you are working for."
What are the DECA competition dress colors?,"   The DECA polos and shirts are perfect for business casual. Dark-colored dress pants like black, navy, and grey look more professional; however, you have the freedom to be more casual and wear khakis. You can wear any color dress shirt, but stay away from patterns."
How to impress a DECA judge?,"2) Politely ask your judge to clarify or expand on the question, or to repeat it. ...  DECA Handshake. Direct. Engaging. Concise. Affectionate.​ Ask to be Seated. Have Good Eye Contact. Slow Down!! Read the Entire Role Play. Hit ALL Your Performance Indicators. Use Visuals. Use Your Time Wisely. More items..."
Is DECA bigger than Fbla?,Membership numbers for FBLA (230 000) seems to be a bit higher than for DECA (177 000) countrywide.
What is the easiest scholarship to get?,"Top easy scholarships in 2023 $10,000 “No Essay” Scholarship. $2,000 Nitro College Scholarship – No Essay. $25,000 No Essay Scholarship. March Madness Scholarship. $5,000 Christian Connector Scholarship. $2,000 CampusReel Virtual Tour Scholarship. Annual Protestant Faith Based College Scholarship. More items... • 3 days ago"
Can I get a full ride scholarship with a 3.5 GPA?,"For students with a 3.5 GPA, a number of scholarship opportunities are available. There are college-based awards as well as external scholarships. Furthermore, some of these awards are based on merit, while others are need-based."
How many A's do you need for a scholarship?,"Sometimes referred to as merit scholarship, you will need to demonstrate remarkable academic results (typically at least 5As at SPM or equivalent) to secure this award. The scholarship quantum differs depending on your results."
What is a good GPA for a full ride scholarship?,"A 4.0 Grade Point Average is not only a high GPA, it's an impressive GPA that's sure to catch the eyes of many scholarship providers. Since the minimum GPA for a full-ride scholarship is usually set at 3.5, a 4.0 is sure to always be above and beyond what's required. Nov 7, 2022"
What SAT score will get you a full ride?,"Shoot for at least a 28 on the ACT or above 1300 on the SAT. Some scholarships allow for flexibility, so check the particular scholarship, but these numbers generally give you the most options. Encourage your student to also pursue a high GPA or even 4.0, especially their senior year."
How do you get a 100% scholarship?,"   How to get a full scholarship Know where to look. ...  Prepare in advance. ...  Work hard and keep motivated. ...  Make yourself stand out from other applicants. ...  Read the application instructions carefully. ...  Submit an exceptional scholarship essay or cover letter. ...  Be realistic. "
What are the top 5 scholarships?,"   We've included a few badges to help you identify some features of the scholarships. Fulbright Scholarship Program. ...  Excelsior Scholarship. ...  The Coca-Cola Scholarship. ...  National Merit Scholarship. ...  Hispanic Scholarship Fund. ...  Hope Scholarship. ...  The Gates Scholarship. ...  The Gates Millennium Scholars Program. More items... • Jan 4, 2023"
Which school gives most scholarships?,"The 50 colleges that offer the most student aid Rank 1 College Columbia University Average financial aid package $55,521 Annual tuition and fees $55,056 Students receiving need-based aid 2,973 1 more row • Oct 29, 2018"
What's the hardest sport to go D1 in?,"Boxing. The Sweet Science. That's the sport that demands the most from the athletes who compete in it. It's harder than football, harder than baseball, harder than basketball, harder than hockey or soccer or cycling or skiing or fishing or billiards or any other of the 60 sports we rated."
What sport looks best on a college application?,Think of it this way football and basketball are likely the most impressive sports but a benchwarmer football player will always be less impressive than a varsity lacrosse player. But also competition level matters.
How rare is a full-ride athletic scholarship?,"Most student-athletes do not receive a full-ride scholarship—in fact, only 1 percent do. Still, full-ride scholarships as the goal for many athletes, as they typically cover tuition and fees, books, room and board, supplies, and sometimes even living expenses."
What scholarship pays for everything?,"What's a full-ride scholarship? It's a financial award, like any other scholarship, but with a difference—it covers all your college expenses. And not just tuition—a full-ride scholarship also covers your housing, meals, books, lab fees, and sometimes even living costs. Mar 29, 2022"
What happens if FAFSA is more than tuition?,"Since financial aid is intended to cover your education expenses, schools expect students to use as much as they need to pay for direct and indirect costs. Once you receive an overage check from your financial aid, the Internal Revenue Service (IRS) may count this as income, so you will have to file taxes. May 20, 2020"
What happens if FAFSA doesn't cover everything?,"Request Additional Federal Student Loans     If you've exhausted other options and still need additional funds to help you pay for school, contact your school's financial aid office to find out if you're eligible for additional federal student loans."
What are some weird scholarships you can get?,"List of Weird Scholarships Doodle for Google. ...  Flavor of the Month Scholarship. ...  Zombie Apocalypse Scholarship. ...  Debt.com Scholarship For Aggressive Scholarship Applicants. ...  Charlie and Kathy Barnhart and Ken Haynes, Jr. ...  Chick and Sophie Major Memorial Duck Calling Scholarship Contest. ...  A Voice for Cats Essay Contest. More items..."
How much does DECA Nationals cost?,"One of the first questions any new Collegiate DECA member with a high school DECA career asks is, “What is the cost of going to ICDC?” My response is an average of $400 – $500. Jan 16, 2016"
What is the dress code for DECA ICDC?,"   Males must be in a suit, official DECA blazer or sport coat with dress slacks, collared dress shirt, necktie, dress shoes and dress socks. Business Casual for gentlemen means a collared shirt and dress slacks / khakis. For ladies, it includes slacks and a dress polo or button-down blouse."
How long is a DECA exam?,"The test consists of 100 questions that are specific to your individual cluster. You will be given one hour to complete the test on your own (even in partner situations, each member will take their own test) The questions are chosen from several different business topics and it will account for 50% of your DECA score."
How fast can you feel DECA?,"In general, Deca will provide noticeable lean muscle mass results within the first 4-6 weeks of use. However, it should be noted that these results will not be as dramatic as those seen with some other steroids - such as Dianabol. Jun 7, 2022"
Which is better for bulking Tren or DECA?,"Trenbolone is another popular steroid. It is even more effective at building muscle mass than Deca-Durabolin. Nov 24, 2022"
Will I gain muscle on DECA?,Deca Durabolin is an effective steroid if you want to bulk up and increase your muscle mass. It is possible to gain up to 30 pounds in 3 months.
Does DECA affect your heart?,"DECA also induced myocardial oxidative stress, as evidenced by the reduced levels of total reduced thiols after heart reperfusion in exercised rats treated with the anabolic steroid. These results indicate that cardiotoxic effects of supraphysiological doses of AAS involve reduced heart antioxidant capacity."
How much muscle can you gain on DECA?,"   Deca Durabolin and Dianabol cycle stacking results:    During the course of this stack cycle, one can experience a surge in muscle mass gain of about 30 to 40 pounds. Whereas, users experience a surge in their lifting capabilities of about 50 to 70 pounds. Dec 5, 2022"
What is a good score for a DECA test?,"   What are the criteria for DECA's Certificate of Excellence? ICDC competitors scoring a combined total score of 70% or better on the competitive event components from the preliminary competition will earn a digital Certificate of Excellence. May 10, 2022"
Is DECA good for athletes?,"Some studies say that when it's used in controlled amounts, Deca Durabolin can bring more good than harm. As it can greatly improve lean muscle mass and body mass. Athletes use this steroid to improve and quicken their recovery from any injuries, and to have it help with joint pain. Sep 17, 2019"
Can you take DECA on its own?,"A deca cycle typically lasts 17 weeks, so users should take a break to reduce the risks of damage to the liver. A low dosage is recommended for beginners in order to gradually build tolerance. Meanwhile, experienced users can up the ante and take higher doses, either solo or by stacking drugs together. Jan 21, 2023"
How much deca should I take for my first cycle?,"Deca Durabolin Dosage    Beginners who cycle this steroid generally inject 200 mg per week. However, on the first week this is taken as two 100 mg doses with a few days in between. From the second week onward, it's normal to inject the full 200mg once each week. Feb 14, 2023"
