topic,context
CV lengkap apa aja isinya?,"   Isi dari dokumen CV ini adalah riwayat pendidikan, nama lengkap, informasi tentang keahlian, keterangan dari tempat dan juga tanggal lahir, riwayat dari pengalaman, data prestasi, dan juga kontak pribadi. Oya, untuk melamar pekerjaan, nantinya CV ini menjadi dokumen yang sangat penting lho ya. 19 Feb 2023"
Berapa pajak CV perbulan?,"Mulai tahun 2022, CV tidak diizinkan menggunakan skema PPh final UMKM. Tarif PPh badan ditetapkan sebesar 22%. Apabila badan usaha CV masih belum memiliki omzet lebih dari 4.8 miliar rupiah, maka terdapat fasilitas pengurangan tarif sebesar 50% atas seluruh penghasilan kena pajak. 17 Jan 2023"
Apa bedanya CV dan surat lamaran kerja?,"Perbedaan CV dan surat lamaran kerja pada dasarnya ada pada isi. Jika surat lamaran kerja berisi penawaran dan ketertarikan Anda pada posisi yang tersedia di sebuah perusahaan, CV adalah informasi tentang diri dan pengalaman kerja sekaligus pendukung surat lamaran kerja. 19 Jan 2023"
Bikin CV buat apa?,"CV bukan hanya penting untuk melamar, tetapi juga untuk perekrut. Jika dibuat dengan baik akan mempermudah mereka untuk memilah-milah mana yang sesuai dengan posisi yang diperlukan. Karena itu, saatnya kamu belajar cara membuat CV lamaran kerja yang menarik."
Bikin kartu kuning di mana?,Cara Buat Kartu Kuning di Disnaker Datang ke kantor Disnaker setempat. Cari tempat atau bagian pembuatan kartu AK-1. ...  Serahkan dokumen persyaratan yang diminta. Anda akan disuruh menunggu selama proses pencetakan kartu kuning. Anda akan dipanggil untuk mengambil kartu kuning yang sudah dicetak. Item lainnya...
Pembuatan Kartu kuning di mana?,"   Kunjungi situs resmi Dinas Ketenagakerjaan, melalui alamat https://karirhub. kemnaker.go.id/. Selanjutnya, datangi kantor Disnaker untuk mengambil kartu kuning yang sudah dilegalisir. Jangan lupa fotokopi untuk cadangan dan minta legalisasi di kantor Disnaker masing-masing. 10 Des 2022"
Bikin Kartu kuning persyaratannya apa saja?,"Adapun syarat membuat kartu kuning yang diminta biasanya berupa fotocopy ijazah, KTP, KK, dan pas foto berukuran 3x4. Pembuatan kartu kuning sendiri tidak dipungut biaya alias gratis. Namun, pencari kerja hanya bisa membuat kartu kuning di daerah aslinya, yaitu yang tertera di KTP. 15 Nov 2022"
Apakah melamar kerja harus pakai ijazah asli?,"   Praktik tahan ijazah para pekerja tidak diatur dalam Undang-Undang Ketenagakerjaan No. 13 Tahun 2003. Oleh karena itu, memang tidak ada ketentuan dan larangan perusahaan menahan ijazah karyawan secara hukum. 6 Des 2022"
Apa yang dimaksud dengan CV lengkap?,"Mengutip dari situs resmi Prakerja, CV atau Curriculum Vitae adalah sebuah dokumen yang berisi daftar riwayat hidup. Isi Curriculum Vitae (CV) berisi informasi lengkap dan kronologis mengenai data diri, latar belakang akademik beserta prestasi dan pencapaiannya, pengalaman profesional, kualifikasi, dan deskripsinya. 17 Jan 2023"
Interview ke 3 biasanya apa?,"   3. User Interview. Tahap selanjutnya adalah wawancara dengna user atau user interview. User adalah sebutan untuk orang-orang yang nantinya akan menjadi atasan atau rekan satu tim kamu. Dalam tahapan ini, user biasanya akan menanyakan berbagai hal teknis terkait posisi yang kamu lamar."
Bagaimana cara memperkenalkan diri saat interview?,"   Cara Perkenalan Diri Saat Interview dan Contohnya Fokus dan Berikan Atensi pada Kehadiran HRD. ...  Perhatikan Gesture Tubuh Kamu saat Bicara. ...  Berikan Salam Pembuka. ...  Mulai Perkenalan dengan Data Diri secara Umum. ...  Jelaskan Jurusan dan Apa yang Dipelajari. ...  Jelaskan Pengalaman Berkuliah. ...  Jelaskan Pengalaman Kerja dengan Efektif. Item lainnya... ? 6 Des 2022"
Berapa lama waktu wawancara kerja?,"Waktu Wawancara Lebih Lama    Akan tetapi, lazimnya sebuah wawancara kerja profesional terjadi selama kurang lebih 30 menit sampai 45 menit, bahkan bisa sampai 1 jam. 16 Agu 2022"
Pengangguran apa harus punya NPWP?,"Pengangguran atau pekerja gaji di bawah Rp 4,5 juta pemilik NPWP. Kelompok ketiga adalah siapa pun pemilik Nomor Pokok Wajib Pajak (NPWP), sekalipun ia adalah seorang pengangguran atau pekerja dengan penghasilan yang masuk PTKP. Memiliki NPWP merupakan salah satu kriteria pihak yang wajib melaporkan SPT Tahunan-nya. 11 Mar 2022"
Buat NPWP bawa apa saja?,Syarat membuat NPWP pribadi bagi wirausaha Warga Negara Indonesia (WNI): fotokopi KTP. Warga Negara Asing (WNA): membawa fotokopi paspor/kartu izin tinggal (KITAP/KITAS). Surat Keterangan Usaha (SKU) minimal dikeluarkan oleh lurah/bukti tagihan listrik. Surat pernyataan yang sudah ditandatangani di atas meterai. 2 Des 2022
Jika belum bekerja klu diisi apa?,"   Direktorat Jenderal Pajak (DJP) menjelaskan bahwa Wajib Pajak yang belum bekerja dan mengajukan pendaftaran NPWP dapat mencentang pilihan Pekerjaan dalam Hubungan Kerja pada menu Sumber Penghasilan. Kemudian, untuk kode KLU-nya dapat dipilih 96034 sebagai kode KLU bagi pegawai swasta."
Buat SKCK itu dimana?,"Tata cara permohonan untuk memperoleh SKCK dapat dilakukan dengan cara mendaftar secara langsung di loket pelayanan SKCK di setiap kantor polisi dengan membawa dokumen yang dipersyaratkan serta mengisi formulir yang telah disiapkan oleh petugas, atau mendaftar secara online dengan cara mengunggah dokumen yang ..."
Rekam sidik jari dimana?,"Catatan : saat akan melakukan pengambilan SKCK asli, Anda akan ditanyai rumus sidik jari. Untuk ini, Anda bisa mengurusnya di Polres dengan surat rekomendasi dari Polsek setempat."
Apakah bisa bikin SKCK langsung ke Polsek?,"   Merujuk pada Peraturan Kapolri Nomor 18 Tahun 2014, pembuatan SKCK dapat dilakukan pemohon di mana saja baik tingkat Polsek, Polres, Polda hingga Mabes Polri. 2 Nov 2022"
SKCK pakai materai berapa?,"Di kantor tersebut, kamu harus mengisi surat penyataan belum memiliki akte kelahiran yang sudah disediakan oleh petuas. Kemudian ditempel materai Rp 6.000, dan ditandatangi. 15 Mei 2017"
Apakah CV wajib ada fotonya?,"Sebetulnya tidak ada aturan soal ini. Meski begitu, topik soal perlu tidaknya mencantumkan foto dalam Curriculum Vitae memang jadi bahan perbincangan belakangan ini. Apalagi di Amerika Serikat, seperti dilansir Zety.com, pelamar kerja sangat tidak disarankan mencantumkan foto di CV. 10 Sep 2022"
Kenapa CV harus 2 orang?,"Syarat yang paling utama dalam pendirian CV adalah pendiri dari CV itu sendiri. Pasalnya, dalam mendirikan CV harus ada minimal 2 orang, yakni sekutu aktif dan sekutu pasif. Mengapa harus menentukan dua pendiri CV tersebut? Hal ini karena menyangkut hak dan kewajiban dari sekutu aktif dan sekutu pasif. 26 Des 2022"
Apa saja ciri-ciri dari CV?,"   Ciri-ciri CV Memiliki pendiri dua orang atau lebih. Terdiri dari dua sekutu, yakni sekutu aktif (sekutu komplementer) dan sekutu pasif (sekutu komanditer). Sekutu aktif mengelola perusahaan. Sekutu pasif menanamkan modal. Item lainnya..."
Sebaiknya wawancara kerja di hari apa?,Banyak ahli karir yang menyarankan untuk datang wawancara pada pertengahan pagi. Hal ini merupakan waktu yang efektif karena orang sedang menggunakan waktu produktifnya di kantor. Wawancara yang Anda lakukan pun akan lebih produktif. Hari Selasa juga merupakan waktu yang tepat bagi Anda untuk datang wawancara kerja. 20 Jul 2016
Bagaimana Cara HRD menolak pelamar kerja?,"   Cara Menolak Pelamar Kerja Secara Halus Tolak Kandidat Segera Mungkin. ...  2. Sesuaikan Bentuk Komunikasi dan Kalimat yang Anda Pilih. ...  3. Feedback yang Membangun dan Jujur. ...  4. Luangkan Waktu untuk Berkomunikasi dengan Kandidat. ...  Minta Feedback dari Kandidat. ...  6. Jalin Hubungan Baik. 5 Des 2022"
Apakah boleh surat lamaran di print?,Surat lamaran pekerjaan bisa ditulis tangan maupun diketik. 27 Agu 2022
CV ditulis di kertas apa?,Gunakan kertas putih dan polos     Pastikan Anda menulis CV pada kertas putih bersih dan polos. Ukuran standar yang biasa digunakan adalah jenis A4 (kuarto) dan tebal 80 gram. Menggunakan kertas putih dan bersih dalam menulis CV memudahkan tim penyeleksi nyaman dalam membaca. 17 Nov 2012
CV dibuat oleh siapa?,"CV memiliki keistimewaan yang tidak dimiliki oleh pelaku ekonomi lainnya, yaitu dibuat oleh minimal dua orang; yaitu orang yang menyandang gelar direktur dan memiliki kewajiban tidak terbatas dan orang yang mempunyai tanggung jawab terbatas atau investor. 1 Jan 2023"
Apakah harus ada SKCK untuk melamar kerja?,"SKCK adalah salah satu dokumen resmi yang sangat penting jika kamu ingin melamar pekerjaan. Jika kamu sedang mencari pekerjaan, kamu bisa mendaftarkan diri kamu di EKRUT. 29 Sep 2022"
CV sebaiknya berwarna apa?,"   Sesuaikan dengan perusahaan dan pekerjaan    Akan tetapi, apabila kamu ingin melamar posisi akuntan di suatu perusahaan swasta, CV dengan sedikit warna atau hitam putih saja adalah warna CV yang baik. Di bawah ini merupakan salah satu contoh CV berwarna hitam-putih dengan sedikit sentuhan warna biru. 5 Jan 2023"
Apakah HRD menghubungi perusahaan lama?,"Ketika HRD melihat surat keterangan kerja calon pegawai, apakah mereka benar-benar menelpon kantor lamanya? Tentu saja! Sudah sejak lama ini dilakukan."
Apakah semua HRD akan memeriksa keaslian ijazah?,Jawabannya iya. HRD selalu mengecek kebenaran informasi yang tertera dalam CV dan menandai ciri-ciri paklaring palsu hingga mengetahui ciri-ciri ijazah palsu. 22 Jul 2022
Cara menjawab interview Apa motivasi anda bekerja?,Berikut adalah beberapa tips yang perlu diingat saat menjawab pertanyaan tentang motivasi kerja: Relevan dengan Pekerjaan yang Anda Lamar. ...  2. Berikan Motivasi yang Positif dan Antusias. ...  3. Jangan Membuat Diri Sendiri Terkesan Angkuh. ...  Menjawab dengan Jujur. ...  Memberitahu Lingkungan Kerja Seperti Apa yang Memotivasi. Item lainnya... ? 28 Des 2022
Fasilitas apa saja yang Anda inginkan selain gaji?,"Selain Gaji Pokok, 10 Fasilitas Ini Bisa Kamu Harapkan dari Calon Perusahaan Tunjangan transportasi. ? Freepik.com. ...  Tunjangan tempat tinggal. ? Pexels.com. ...  Tunjangan teknologi. ? Freepik.com. ...  Katering makan siang. ...  Program pengembangan SDM. ...  Sponsor beasiswa. ...  Fleksibilitas jadwal kerja. ...  Fasilitas khusus untuk pekerja wanita. Item lainnya... ? 10 Feb 2023"
Apa jawaban jika ditanya hobi?,"Pilih hobi yang menyinggung posisi terkait    Kamu bisa coba menjawab, ?Di waktu luang, saya hobi membaca buku fiksi dan nonfiksi?. Secara tidak langsung, jawaban tersebut menunjukkan bahwa kamu memiliki salah satu skill yang dibutuhkan untuk menjadi seorang editor. 5 Mar 2021"
Berapa spasi dalam surat?,"Ukuran Font: 12. Spasi: 1,5. Margin (Jarak tepi kertas): Atas (3 cm), Kiri (4 cm), Kanan (3 cm). 7 Jul 2021"
Surat lamaran Kerja dicetak kertas apa?,"Surat lamaran kerja sendiri dapat ditulis secara langsung atau diketik, baik ditulis atau diketik, ukuran standar surat lamaran kerja yang benar adalah menggunakan jenis A4 (kuarto) putih polos dengan tebal 80 gram. 22 Apr 2022"
Apa aja isi surat lamaran?,"Isi surat lamaran kerja adalah: Alamat pengirim: Dicantumkan di sebelah kanan atas. Tanggal surat: Dicantumkan dua atau tiga baris di bawah alamat pengirim. Alamat surat: Nama perusahaan ditulis lengkap pada baris pertama, diikuti nama gedung pada baris kedua dan nama jalan pada baris berikutnya. Item lainnya... ? 25 Nov 2022"
Surat lamaran lengkap apa aja?,"Berkas Lamaran Kerja Selengkapnya CV alias Curriculum Vitae. Singkatnya, berkas yang satu ini berita tentang seluruh riwayat diri Anda secara lengkap. ...  2. Ijazah. ...  3. Transkrip Nilai. ...  4. Surat Lamaran Kerja. ...  Pas Foto Terbaru. ...  6. Portofolio. ...  7. Identitas pribadi. 6 Feb 2023"
Hal hal apa saja yang harus dihindari dalam penulisan surat lamaran pekerjaan?,"Hal-hal yang harus dihindari dalam penulisan surat lamaran pekerjaan adalah sebagai berikut, kecuali ... terdapat gambar dan pernak-pernik. menggunakan kertas berwarna. tulisan menggunakan tinta warna-warni. bahasa yang digunakan bertele-tele. menggunakan bahasa baku. "
Apa saja yang harus dihindari agar CV terlihat menarik?,"Hapus Lima Hal Ini dari CV Anda Agar Terlihat Menarik dan... Judul 'Curriculum Vitae' Sumber: Pixabay. ...  Alamat Lengkap. Pada masanya, menulis alamat lengkap di dalam CV adalah penting untuk urusan surat-menyurat. ...  Pengalaman Kerja yang Tidak Relevan. ...  Keterangan Pekerjaan. "
Apakah CV harus penuh?,"Idealnya, CV hanya terdiri dari dua sampai tiga lembar saja. Tidak disarankan melebihi batas tersebut. Maka dari itu, tuliskan hal-hal yang dirasa perlu dan relevan, serta hindari informasi yang dirasa tidak perlu dicantumkan. 26 Apr 2022"
Cara menjawab pertanyaan apa kelemahanmu?,"   4 Tips Menjawab Pertanyaan Interview ?Apa Kelemahanmu?? Dengan Tepat ? Mengutamakan kejujuran. ...  ? Jangan rendah diri untuk mengungkapkan. ...  ? Tidak tepat untuk berbalik menyalahkan orang lain. ...  ? Berikan jawaban yang proporsional. 8 Okt 2020"
Bisakah melamar pekerjaan tanpa ada lowongan?,"KOMPAS.com - Melamar kerja di sebuah perusahaan tak harus menunggu lowongan dibuka. Kamu bebas menebar CV maupun resume kapan pun dan di manapun. Kalau menunggu perusahaan membuka lowongan kerja, sama saja seperti pungguk merindukan bulan. 20 Jun 2021"
Job Title artinya apa ya?,"Job title diisi apa? Apabila diterjemahkan ke dalam bahasa Indonesia, job title berarti judul pekerjaan. Job title di CV diisi dengan nama posisi pekerjaan yang diberikan perusahaan."
Modal usaha CV minimal berapa?,Kualifikasi Bidang Umum : Kualifikasi Kecil : Jika jumlah modal disetor > Rp 50 juta sd Rp 500 juta. Kualifikasi Menengah : Jika jumlah modal disetor > Rp 500 juta sd Rp 10 Milyar. Kualifikasi Besar : Jika jumlah modal disetor > Rp 10 Milyar.
Apa saja kelemahan dari CV?,Kekurangan CV    a. Sekutu pasif tidak mengelola perusahaan dan hanya mempercayakan modal kepada sekutu aktif. b. Tanggung jawab sekutu aktif tidak terbatas. c. Harta kekayaan sekutu aktif dapat disita jika perusahaan mengalami kebangkrutan. 11 Feb 2022
Apa yang harus kita jawab saat interview?,"Tips Menjawab Pertanyaan Interview ?Apa Tujuan Kariermu?? Tentukan tujuan kariermu. ...  Riset soal posisi dan perusahaan yang dilamar. ...  Fokus pada jawaban seputar karier. ...  Mulai dengan tujuan jangka pendek, lalu ke jangka panjang. ...  Jelaskan apa yang akan kamu lakukan untuk mencapai tujuan. ...  Sempatkan untuk berlatih. 20 Feb 2023"
Apa saja kesalahan dalam surat lamaran pekerjaan?,"   16 Kesalahan Surat Lamaran Kerja yang Harus Dihindari Melupakan beberapa aspek penting. ...  2. Cara menerangkan kemampuan. ...  Penulisan yang kurang rapi. ...  4. Terlihat seakan mengemis. ...  Menulis ?Seperti yang tertera pada CV saya?? ...  6. Surat lamaran kerja yang sama untuk semua jenis pekerjaan. Item lainnya... ? 25 Jul 2022"
Tes interview ke 2 biasanya apa?,"Wawancara kerja kedua biasanya melibatkan banyak pewawancara seperti Kepala Bagian, Manajer Langsung, dan / atau Eksekutif Departemen. Penting bagi kamu untuk siap secara mental untuk bertemu dengan orang yang berbeda, karena mereka mungkin mengajukan pertanyaan yang sebelumnya telah kamu jawab dalam wawancara pertama. 30 Jun 2022"
Apa yang dilihat pertama kali oleh HRD?,"Poin yang pertama kali dilihat HRD dari berkas lamaran, terutama yang tertera dalam CV adalah pengalaman magang/kerja. HRD ingin tahu apakah pengalaman yang kamu miliki sesuai untuk menempati posisi yang kosong di perusahaan. 4 Jun 2022"
Apakah lamaran kerja harus ditulis?,Surat lamaran kerja harus ditulis menggunakan tata bahasa yang baik dan benar (formal). Hal ini karena surat lamaran kerja adalah surat resmi yang dibuat oleh pelamar kerja yang ditujukan kepada pimpinan perusahaan atau HRD. 8 Okt 2022
CV dikirim dalam bentuk apa?,Mengirim CV dan Berkas Lain Dalam Format PDF atau Doc     Agar proses seleksi yang oleh HRD bisa berjalan lancar. Sebaiknya kamu mengirimkan salah satu dari kedua format di atas agar dapat lanjut ke tahap selanjutnya. 7 Feb 2023
Bisakah CV didirikan oleh satu orang?,"Syarat yang paling utama dalam pendirian CV adalah pendiri dari CV itu sendiri. Pasalnya, dalam mendirikan CV harus ada minimal 2 orang, yakni sekutu aktif dan sekutu pasif. Mengapa harus menentukan dua pendiri CV tersebut? Hal ini karena menyangkut hak dan kewajiban dari sekutu aktif dan sekutu pasif. 26 Des 2022"
CV Apa itu artinya?,Curriculum Vitae (CV) atau Resume atau Daftar Riwayat Hidup adalah gambaran diri Anda yang sesungguhnya. Memiliki CV yang efektif dan menarik akan meningkatkan kesempatan Anda dalam mendapatkan pekerjaan idaman Anda.
Apa syarat membuat SKCK 2022?,Membawa fotokopi Kartu Keluarga. Membawa fotokopi Akta Kelahiran/Kenal Lahir/Ijazah. Membawa Pas Foto terbaru yang berwarna ukuran 4?6 sebanyak 3 lembar. Mengisi formulir perpanjangan SKCK yang disediakan di kantor Polisi.
Apa saja yang harus di fotocopy untuk melamar kerja?,"   Yang perlu Dilampirkan Dalam Surat Lamaran Kerja Pas foto (foto terbaru) Fotokopi KTP. Daftar riwayat hidup atau Curiculum Vitae (CV) Fotokopi ijazah terakhir. Fotokopi sertifikat kompetensi (kursus atau pelatihan yang pernah diikuti) Portofolio. 16 Jan 2022"
Berapa spasi untuk surat?,"Ukuran Font: 12. Spasi: 1,5. Margin (Jarak tepi kertas): Atas (3 cm), Kiri (4 cm), Kanan (3 cm). 7 Jul 2021"
Melamar kerja pakai baju apa?,"   Untuk pergi melakukan interview, baik itu untuk melamar pekerjaan atau melamar beasiswa, sebaiknya kamu menyiapkan beberapa list pakaian seperti di bawah ini: Kemeja Lengan Pendek. Kemeja Lengan Panjang. Jas atau Blazer. Celana Panjang Bahan. Sepatu Pantofel atau Sepatu Formal. Dasi. "
Lamar kerja pake amplop apa?,"   Standar Ukuran Amplop Lamaran Kerja Berwarna coklat polos. Berukuran F4. Memiliki perekat atau tali di bagian penutupnya. 6 Des 2022"
Apa yang ditulis di amplop surat lamaran kerja?,"Amplop lamaran kerja harus ditulis dengan jelas dan detail. Walaupun tidak ada aturan yang baku terhadap penulisan amplop lamaran kerja, tetapi,dengan membaca contoh amplop surat lamaran kerja ini semoga dapat membantu Anda dalam menulis amplop lamaran kerja. 6 Feb 2021"
Map untuk cowok warna apa?,Semua berkas tersebut dimasukkan kedalam 1 map kertas dengan ketentuan: Warna Biru untuk Laki-Laki. Warna Merah untuk Perempuan.
Bolehkah amplop lamaran kerja tulis tangan?,Format penulisan pada amplop lamaran kerja berisi informasi yang sangat penting. Oleh sebab itu hindari menulis secara sembarangan. Tulisan pada amplop lamaran bisa kamu tulis tangan ataupun diketik pada selembar kertas. 11 Apr 2022
Berkas CV lengkap apa saja?,"Berkas Lamaran Kerja Selengkapnya CV alias Curriculum Vitae. Singkatnya, berkas yang satu ini berita tentang seluruh riwayat diri Anda secara lengkap. ...  2. Ijazah. ...  3. Transkrip Nilai. ...  4. Surat Lamaran Kerja. ...  Pas Foto Terbaru. ...  6. Portofolio. ...  7. Identitas pribadi. 14 Feb 2023"
Berapa lembar surat lamaran kerja?,"Dengan begitu, 1 halaman umumnya dianggap ideal. Nah, jika kamu memiliki CV dua halaman atau lebih sebagai fresh graduate, akan lebih baik jika diperpendek menjadi maksimal satu halaman. Akan tetapi, Wheatman juga menambahkan bahwa penting untuk memastikan CV-mu tidak terlalu pendek juga. 30 Apr 2021"
Skill CV apa aja?,Contoh Hard Skill dalam CV Computer Skills. Marketing Skills. 3. Design Skills. 4. Writing Skills. Data Analytic Skills. Communication Skills. Problem Solving Skills. 3. Interpersonal Skills. Item lainnya... ? 21 Sep 2022
Skill dalam CV apa aja?,25 Contoh Hard Skill dalam CV Bahasa asing. Menjadi poliglot atau seseorang yang menguasai banyak bahasa merupakan hal yang berharga di dunia kerja. ...  Copywriting. Keahlian membuat salinan menarik yang sesuai dengan kebutuhan klien sangat berguna di berbagai industri. ...  Desain grafis. ...  Bahasa pemrograman. ...  Photo and video editing. 7 Feb 2023
3 Siapa yang menerima surat lamaran pekerjaan?,Lamaran pekerjaan biasanya diterima oleh HRD dalam suatu perusahaan. 22 Agu 2022
Apa itu CV dan contoh CV?,"Curriculum vitae merupakan daftar riwayat hidup yang berisi data dan informasi yang diperlukan untuk melamar pekerjaan. Dalam CV terdapat informasi seperti pendidikan, keahlian, biodata, dan riwayat pekerjaan lainnya. Kamu pun perlu membuat CV semenarik mungkin agar mendapat penilailan yang tinggi dari rekrutmen. 7 Agu 2020"
Apakah CV pakai ijazah?,"""Standarnya CV dilengkapi dengan surat dokumen sertifikat dan ijazah pelengkap calon kandidat,"" ujarnya kepada detikcom, Minggu (29/9/2019). 29 Sep 2019"
Apakah di CV harus ada gelar?,"Apabila curriculum vitae diserahkan untuk mendaftar disuatu pekerjaan, maka tidak perlu mencantumkan gelar akademik di penulisan nama. 17 Apr 2022"
Apakah boleh surat lamaran di fotocopy?,"Saat melamar kerja, pastikan kamu menulis lamaran dengan baik. Selain membuatnya, kamu juga bisa membeli surat ini difotocopy. 18 Okt 2022"
CV ukuran berapa?,Pastikan Anda menulis CV pada kertas putih bersih dan polos. Ukuran standar yang biasa digunakan adalah jenis A4 (kuarto) dan tebal 80 gram. 17 Nov 2012
Lulusan SMA bisa kerja jadi apa?,"7 Pekerjaan untuk Lulusan SMA, Gaji Besar dan Bisa Sambil Kuliah Sales Marketing. Pekerjaan yang cocok untuk lulusan SMA yang pertama adalah sebagai sales marketing, atau tenaga pemasar produk. ...  Penulis. ...  Pengajar Bimbel. ...  4. Bisnis Online. ...  Input Data. ...  6. Pramugari/Pramugara. ...  Anak Buah Kapal. 5 Des 2022"
Buat CV biaya berapa?,"Biaya Pembuatan CV 2022    Untuk saat ini biaya pendirian CV sekitar Rp3 sampai Rp8 juta. Anda tidak perlu mengurusnya sendiri, sebab bisa menggunakan layanan perizinan badan usaha. Anda bisa memilih paket sesuai dengan budget perusahaan. Perbedaan harga terletak pada kelengkapan dokumen yang akan diurus. 16 Okt 2022"
CV online isinya apa saja?,"Apa yang harus saya cantumkan dalam CV saya? Detail pribadi. Tentu saja, calon pemberi pekerjaan harus dapat menghubungi Anda untuk wawancara kerja. ...  Pengalaman kerja. ...  Pendidikan. ...  Pernyataan pribadi atau profil CV. ...  Kompetensi dan keahlian. ...  Kursus dan pelatihan terkait pekerjaan. ...  Aktivitas. "
Siapa yang menulis surat lamaran kerja?,"Orang yang menulis surat lamaran pekerjaan disebut sebagai pelamar kerja. Dengan demikian, jawaban yang tepat adalah B. Baca pembahasan lengkapnya dengan daftar atau masuk akun Ruangguru. GRATIS!"
Apa bedanya antara CV dan Resume?,"CV, atau curriculum vitae, adalah dokumen yang secara rinci menjelaskan riwayat hidup seseorang berdasarkan pengalaman, kualifikasi dan prestasinya. Sedangkan, resume adalah dokumen yang memberikan rangkuman pengalaman, kualifikasi dan prestasi seseorang di suatu bidang yang spesifik. 30 Jun 2022"
Bagaimana bunyi kalimat penutup dalam surat lamaran kerja?,"Demikian surat lamaran ini saya buat, atas perhatian Bapak/Ibu saya ucapkan terima kasih. Semoga surat lamaran kerja ini dapat menjadi pertimbangan untuk meloloskan saya pada tahap wawancara. Atas perhatian serta kesempatan yang Bapak/Ibu berikan, saya ucapkan terima kasih. 30 Nov 2022"
Pendidikan di CV diisi apa?,"Cara Menulis Riwayat Pendidikan di CV    Pastikan untuk selalu mencantumkan gelar, jurusan, nama dan lokasi sekolah atau institusi pendidikan, serta tahun kelulusan."
Bagaimana contoh kalimat penutup surat?,"Bagian Penutup Surat yang Benar Atas perhatian Bapak kami sampaikan terima kasih. Semoga informasi yang kami berikan bermanfaat bagi Saudara. Demikianlah harapan kami. ...  Atas perhatian Saudara, kami ucapkan terima kasih. Atas kerja sama Anda, kami sampaikan terima kasih. Item lainnya... ? 21 Jul 2021"
Bagaimana cara menulis tanggal surat yang benar?,"Tanggal surat harus ditulis sesuai dengan waktu pembuatan, mulai dari tanggal, bulan, dan tahun, Toppers. Penulisan tanggal surat resmi berada di pojok kanan atas, sedangkan surat dinas atau niaga, tanggal surat terletak di bawah kop surat. 18 Jan 2022"
Apa saja kesalahan yang sering terjadi dalam penulisan surat?,"Kesalahan Penulisan Kata Tidak Baku. Kesalahan Penggunaan Huruf Kapital. Kesalahan Penulisan Kata Depan. Kesalahan Penggunaan Tanda Baca. Ketidakbakuan Pemilihan Kata. Ketidaktepatan Pemilihan Kata. Ketidakhematan Pemilihan Kata/ Penggunaan Kata Mubazir. "
Apakah surat lamaran harus tulis tangan atau diketik?,"   Surat lamaran kerja biasa diketik di Microsoft Word untuk hasil yang lebih rapih. Namun, kamu juga bisa membuat lamaran kerja dengan tulis tangan. Surat lamaran kerja tulis tangan ini biasanya digunakan untuk melamar CPNS, toko retail dan yang lainnya. 14 Feb 2023"
Bagaimana agar surat lamaran kerja menarik untuk diterima?,"   Cara Bikin Surat Lamaran Kerja yang Baik dan Benar, Biar Cepat... Pastikan menggunakan bahasa yang baik dan benar. ...   Gunakan kata yang sopan namun resmi. ...   Jangan bertele-tele dan gunakan format penulisan yang tersusun rapi dan sesuai dengan ketentuan surat lamaran kerja. Item lainnya... ? 17 Mar 2022"
Berapa lama balasan surat lamaran kerja?,Pelamar kerja bisa menunggu balasan lamaran kerja dari perusahaan yang dilamar selama dua pekan. 13 Des 2021
Berapa biaya pembuatan kartu kuning?,Pembuatan kartu kuning tidak dipungut biaya alias gratis. Anda hanya perlu mendatangi Disnaker setempat atau mendaftar secara online lebih dulu. 12 Jan 2023
Bisakah CV didirikan 1 orang?,"Syarat yang paling utama dalam pendirian CV adalah pendiri dari CV itu sendiri. Pasalnya, dalam mendirikan CV harus ada minimal 2 orang, yakni sekutu aktif dan sekutu pasif. Mengapa harus menentukan dua pendiri CV tersebut? Hal ini karena menyangkut hak dan kewajiban dari sekutu aktif dan sekutu pasif. 26 Des 2022"
Apakah pemilik CV boleh terima gaji?,"Selain prive, gaji yang dibayarkan kepada anggota CV juga merupakan penghasilan kena pajak bagi CV sesuai Pasal 9 ayat (1) huruf j UU PPh. Idealnya, orang pribadi yang merupakan pemilik CV tidak menerima gaji dari CV karena merupakan satu kesatuan dengan CV, sebagaimana diuraikan pada bagian penjelasan Pasal 9 ayat (1) ..."
