topic,context
What does a ++ grade mean?,Letter grade Percentage Grade definition A+ 90-100 Excellent A 85-89 Very good A– 80-84 Very good B+ 75-79 Good B.
What is a 93 GPA on a 4.0 scale?,"To convert your GPA to a 4.0 scale: Letter Grade Percent Grade 4.0 Scale A 93-96 4.0 A- 90-92 3.7 B+ 87-89 3.3 B 83-86 3.0 8 more rows • Feb 23, 2023"
How many A's is a 3.8 GPA?,"   A 3.8 GPA, or Grade Point Average, is equivalent to an A- letter grade on a 4.0 GPA scale. This means is equivalent to a 90-92%."
How many A's do you need for a 3.8 GPA?,"A 3.8 GPA, or Grade Point Average, is equivalent to a A- letter grade on a 4.0 GPA scale, and a percentage grade of 90–92."
What percent is a 3.9 GPA?,GPA Percent 4.0 100-99 3.9 98-97 3.8 96-95 3.7 94-93 30 more rows
What is the highest GPA?,"a 4.0  The unweighted scale is most common, and the highest possible GPA on this scale is a 4.0. The unweighted scale doesn't take the difficulty of a student's classes into account. Weighted scales are also used at many high schools. Typically, they go up to a 5.0."
Is a 86 GPA good?,"A 3.1 GPA, or Grade Point Average, is equivalent to a B letter grade on a 4.0 GPA scale. This means is equivalent to an 83-86%. The national average GPA is 3.0 which means your 3.1 is just above average and with a bit of work can be raised even further to really stand out."
What majors have the lowest GPA?,"   Science majors tend to have lower GPAs on average, with chemistry being the major with the lowest average GPA. Oct 15, 2022"
What college has the highest GPA requirement?,"   Universities With the Highest Average GPAs Brown University. 3.71. Stanford University. 3.66. Harvard University. 3.64. Yale University. 3.62. Columbia University. 3.59. Vanderbilt University. 3.57. Duke University. 3.56. Baylor University. 3.56. More items..."
What's a good GPA for Ivy League?,"   According to a series of self-reported surveys done by students that use US News, during the application for Fall 2020, more than half of the students admitted to Ivy League schools had a 4.0 GPA. The number of acceptances drastically decreases once you go lower than 3.7, although still a handful can be seen. Jun 7, 2022"
How much is a 95% GPA?,GPA Scale Letter Grade Grade Points Numerical Grade A 4.0 94–96 A- 3.7 90–93 B+ 3.3 87–89 B 3.0 84–86 9 more rows
What is a 7.3 GPA on a 4.0 scale?,Converting 10 point CGPA to 4 point GPA (S to cgpa converter) 10 Point CGPA Equivalent 4 Point GPA USA Grade Equivalent 7.3 3.14 A 7.2 3.10 A 7.1 3.07 A 7.0 3.04 A 87 more rows
What is 80% of a 4.0 GPA?,"A 2.7 GPA, or Grade Point Average, is equivalent to a B- letter grade on a 4.0 GPA scale, and a percentage grade of 80–82."
Is it possible to have a 6.0 GPA?,"It Depends on the Scale    Typically, high schools that use weighted GPAs opt for the 0-5 scale that makes 5.0 the highest possible grade. A GPA higher than 5.0 is rare, but school point systems are occasionally structured so that students taking advanced classes can rack up bonus points."
What college has a 100% acceptance rate?,"Established in 1911 in southwestern Utah, Dixie State University features a 100% acceptance rate. The campus, which sits adjacent to the Red Cliffs National Conservation Area, serves more than 11,000 students, about 60% of whom attend full time."
What is USA highest GPA?,"When you study at a US university, your GPA is on a scale from 0.0 to 4.0, with 4.0 being the highest your GPA can be. GPA is very important in US universities. Oct 28, 2021"
What do DECA winners get?,"   DECA is pleased to announce the 2021-2022 scholarship recipients. Each year, DECA and its corporate partners award over $200,000 in scholarships to DECA members."
How do I prepare for DECA?,"Have a firm handshake and appropriate greeting. Speak slowly, watch out for ums, uhs, and other nervous habits. Tell the judge why you are there/what you are going to tell them – outline the case study. Solve the problem of the case study - address the performance indicators."
Does DECA pay for college?,"DECA's scholarship program provides over $200,000 in scholarships to high school and college DECA members at the International Career Development Conference (ICDC) each year. DECA Inc. administers the program based on guidelines set by the donor. DECA scholarships are strictly merit-based."
Do you have to wear a blazer for DECA?,"An official DECA blazer must be worn during competition and on- stage during ICDC only. Travel to and from conferences and non-conference activities such as shopping, sight-seeing, or going out for meals."
How long does it take for DECA to start working?,"4-6 weeks  In general, Deca will provide noticeable lean muscle mass results within the first 4-6 weeks of use. However, it should be noted that these results will not be as dramatic as those seen with some other steroids - such as Dianabol. Jun 7, 2022"
What college has the happiest students?,"The 10 Colleges With the Happiest Students Rose-Hulman Institute of Technology (Terre Haute, IN) ...  University of Dallas (Irving, TX) ...  Texas Christian University (Fort Worth, TX) ...  Kansas State University (Manhattan, KS) ...  Auburn University (Auburn, AL) ...  Vanderbilt University (Nashville, TN) ...  Tulane University (New Orleans, LA) More items... • Jan 4, 2023"
What is the #1 university in the world?,"Stanford University     Stanford, California, U.S. Aug 12, 2022"
What is the hardest college to get into?,"Top 10 Hardest Colleges to Get Into Harvard. Cambridge, MA. 3.19% Columbia. New York, NY. 3.73% Caltech. Pasadena, CA. 3.92%* Stanford. Stanford, CA. 3.95%* MIT. Cambridge, MA. 3.96% Princeton. Princeton, NJ. 4.38%* Yale. New Haven, CT. 4.47% Brown. Providence, RI. 5.03% More items..."
What GPA is required for UCLA?,"a 3.0 GPA  You must have a 3.0 GPA (3.4 for non-residents) or higher and no grades lower than a C in required high school courses. You can also substitute SAT subject tests for courses. If you don't meet the requirements, it is possible to gain admission with a high enough score on the ACT/SAT plus on two SAT subject tests."
What GPA does Stanford require?,"There is no minimum GPA or test score, nor is there any specific number of AP or honors courses you must have on your transcript in order to have your application reviewed or be admitted to Stanford. Aug 4, 2022"
What GPA does Yale require?,"You should also have a 4.14 GPA or higher. If your GPA is lower than this, you need to compensate with a higher SAT/ACT score. For a school as selective as Yale, you'll also need to impress them with the rest of your application."
What is the lowest GPA accepted to Harvard?,"Continue to work hard, take difficult classes, and show your passions outside of school! To get to Harvard your GPA has to be at least a 4.0 and even then if you get in your lucky but they require at least a 4.18 GPA only ."
What is the lowest GPA accepted to UCLA?,"3.0 GPA  UCLA requires a minimum 3.0 GPA     Because UCLA is part of the rigorous UC system, the UCLA GPA requirements are dictated by the whole UC system. In order to get into any UC school, students must earn at least a 3.0 GPA and may not have any grades below a “C”."
Does Harvard accept average students?,"While it is definitely possible to get into schools like Harvard with an average GPA, it is one of the hardest Ivy League schools to get into. So, if you want to give yourself the best possible chance of getting in, you are going to want to take your coursework seriously from the very first day of your freshman year."
What is the lowest GPA ever?,0.0 on a 4.0 scale is the lowest GPA record.
What is the best lowest GPA?,"Unofficially, 2.0 is the lowest GPA accepted into a standard college, so while there's a chance that college admission is possible, it's not likely at more than a few institutions."
What is the easiest Ivy League to get into?,"   Cornell University  1. What's the easiest Ivy League school to get into? While all Ivy League schools have a low acceptance rate, Cornell University has the highest acceptance rate among them. Cornell's acceptance rate is 11%, but try not to get too hung up on the numbers. Dec 21, 2022"
What is the lowest SAT score for MIT?,"a 1500  There's no absolute SAT requirement at MIT, but they really want to see at least a 1500 to have a chance at being considered."
What is the lowest SAT score ever recorded?,"   400  The lowest SAT score is 400. Your total SAT score is comprised of a Math section score and an Evidence-Based Reading and Writing score. Each SAT section is scored between 200 and 800 points. The average SAT score for the class of 2020 was 1051."
What is MIT average SAT score?,"   between 1500–1570  For MIT, the average SAT score is between 1500–1570. Nationally, the average composite score is 1000. For Math, MIT accepted students averaged a score of 770–800; nationally the average score was 511. For Reading (sometimes called Verbal) MIT scored an average 750–800. Dec 22, 2022"
Who got a 1600 on the SAT?,"Celebrity Score University Bill Gates 1590 Harvard University Ben Bernanke 1590 Harvard University Bill O'Reilly 1600 Marist College Ryan Fitzpatrick 1580 Harvard University 27 more rows • Nov 27, 2018"
What is the highest SAT score ever recorded?,"1600  Hari, from Colorado, achieved 1600 on the SAT, the highest SAT score ever recorded. He also received a perfect score of 36 on the ACT. Oct 3, 2022"
Is Dean's List a big deal?,"Earning a spot on the dean's list at your college is one the highest levels of recognition for scholarly achievement. Every term, the highest-ranked students based on GPA receive this award."
Is deans list better than honor roll?,Those students who have earned a 3.75 to 4.0 GPA for the quarter are placed on the Dean's List. Those students who have earned a 3.25 to 3.749 GPA for the quarter are placed on the Honors List.
Is there a valedictorian in Grade 10?,"The titles for learners with honors including valedictorian, salutatorian, first honorable mention, and so forth shall be used for Grade 6 and Grade 12 graduates but not for Grade 10 completers. In case of a tie, candidates shall be declared in the same honor ranking. Mar 17, 2016"
What honors is a 3.97 GPA?,"   Summa cum laude: 3.97 - 4.00. Magna cum laude: 3.95 - 3.96. Cum laude: 3.92 - 3.94. "
Does Grade 12 have valedictorian?,"The titles for learners with honors including valedictorian, salutatorian, first honorable mention, and so forth, shall be used for grade 6 and grade 12 graduates but not for grade 10 completers."
What is higher then dean's list?,Summa Cum Laude -- is awarded to candidates whose grade-point-average is 3.900 or higher. Magna Cum Laude -- is awarded to candidates whose grade-point-average is 3.700-3.899. Cum Laude -- is awarded to candidates whose grade-point-average is 3.5000-3.699.
Can you put dean's list on resume?,"Include Dean's list on your resume if you have been added to it regularly. Making the Dean's list for many semesters throughout your college career demonstrates a strong, consistent work ethic, as well as academic ability."
Can you wear a turtleneck to DECA?,"FEMALES • Business suit with blouse, shell, or turtleneck • Blazer with skirt or dress slacks and with blouse, shell, or turtleneck • Business dress with jacket • Dress shoes and stockings - - - - - - - - MALES • Business suit with collared dress shirt and necktie or • Sport coat/dress slacks, collared shirt and ..."
What is the DECA dress code?,"Jeans and any type of denim are not to be worn any time during the conference, including travel to and from the conference, and athletic wear should only be worn for recreational activities during the conference. Business casual attire is appropriate for travel to and from conferences and DECA events."
What should you bring to DECA?,"Q. What do I need to pack? Professional outfits with professional shoes (no open toe, no canvas, no Sperrys for competitive events), PJs, casual outfit, loungewear for hanging out. We will provide packing lists as the event gets closer."
How much is a full scholarship worth?,"And not just tuition—a full-ride scholarship also covers your housing, meals, books, lab fees, and sometimes even living costs. In money terms, it can be worth anywhere from $20,000 to more than $50,000, depending on your school's costs. Mar 29, 2022"
How long does it take for DECA to kick in?,"Deca injections    While the effects may be slightly slow and steady, you may feel that the drug begins to work around the 4th week of dosing. Sep 21, 2022"
How long should your DECA roleplay be?,"between 5-7 minutes  Your role play should be between 5-7 minutes, and structured in the following way: 1-Introduction- (30 seconds) Introduce yourself and say who you are working for. Also give a brief synopsis of what you will be discussing with them."
How do you introduce yourself in DECA?,"1. Introduction (0.5 minutes) Firm handshake, eye contact, smile. Introduce your name, position, and purpose of your presentation. Sit up straight, keep your hands on the desk (never on your lap) Thank the judge for their time. Nov 9, 2018"
Is a blazer required for DECA?,"An official DECA blazer must be worn during competition and on- stage during ICDC only. Travel to and from conferences and non-conference activities such as shopping, sight-seeing, or going out for meals."
What do you do in DECA competitions?,"Participants will be given a 100-question, multiple-choice exam covering business administration. They are then given a written case study, and have 10 minutes to read it and prepare for a 10 minute presentation of the case study."
How do you greet judges in court?,"Only a respectable way of addressing. You call (judges) sir, it is accepted. You call it your honour, it is accepted."
How do you qualify for ICDC DECA?,"The Best DECA Members In The World!    To be eligible to compete at ICDC, members must place in the top 4 in their competitive event at the State Career Development Conference. Sep 8, 2022"
What is a DECA case study?,"Individual Case Studies are designed to measure a broad range of knowledge, skills and attitudes, both general business/marketing/management and industry-specific, identified by business and industry professionals as essential to success in a given occupation."
How many questions is the DECA test?,"100-  Rubrics and role plays used by DECA are not provided by MBA Research. Questions regarding these aspects of the competitive events should be directed to state advisors. All exams are 100-item, multiple-choice."
Can I get a scholarship with a 3.7 GPA?,"High school students who maintain a 3.7 GPA or higher have access to a wide variety of scholarship programs. In fact, your GPA will qualify you for more than one scholarship opportunity. You should take full advantage of your high GPA and apply for as many scholarships as you are eligible for."
How rare is a full ride to Harvard?,"   Harvard does not offer any merit-based aid and no full-ride scholarships. However, they do meet 100% of students' demonstrated financial needs. Almost half of the batch at Harvard University avails need-based scholarships or financial aid every year. Nov 22, 2022"
Which college gives the most merit scholarships?,"Most Students Receiving Merit Aid School Location Percent of students receiving non-need based aid Gonzaga University Spokane, WA 51% University of Denver Denver, CO 50% The New School New York, NY 49% University of South Carolina Columbia, SC 49% 17 more rows"
Will a 4.0 GPA get you a scholarship?,"   A 4.0 Grade Point Average is not only a high GPA, it's an impressive GPA that's sure to catch the eyes of many scholarship providers. Since the minimum GPA for a full-ride scholarship is usually set at 3.5, a 4.0 is sure to always be above and beyond what's required. Nov 7, 2022"
Should I retake a 1290 SAT score?,"Unfortunately, 1290 is not a good SAT score. In reality, it's a weak score that will keep you from achieving your college admissions goals. Although you're still outperforming the majority of test takers, it's still not enough to get you into the top schools in the country. Aug 9, 2022"
Is a 1500 SAT competitive?,"   A 1500 puts you in nearly the 95th percentile of all 1.7 million test takers. Just 100 points shy of a perfect score, a 1500 makes you eligible to apply to every college and university in the country and be competitive for admission at almost every single one, including elite institutions."
What SAT score do you need to get merit scholarships?,"between 1200 and 1600  So you're probably wondering, What's a good SAT score for scholarships, and how can I find them? The short answer is that you should aim for an SAT score between 1200 and 1600 if you want to secure some scholarships based on merit–and the higher within that range you score the more money you're looking at. Sep 5, 2022"
How rare is a full scholarship?,"How hard is it to get a full ride scholarship? Less than 1 percent of students get full ride scholarships, showing just how difficult it is to earn one. However, with the right background, proper planning and by knowing where to look, your chances of landing a full ride scholarship can increase."
Which scholarship is fully funded?,"Fulbright Scholarships are fully funded scholarships for international students. These scholarships are only offered for masters and PhD studies. Fulbright Foreign Student Program covers full tuition fee, a living stipend, full accommodation fee, airfare and health insurance. Dec 2, 2022"
How much is the Bill Gates scholarship?,"The Gates Millennium Scholars Program is another Gates minority scholarship. The program grants an average of $12,785 to 1,000 annually-selected scholars."
What is the hardest scholarship to get?,"7 Hardest Scholarships to Get But Worth Every Penny The Gates Cambridge Scholarship. The Gates Millennium Scholars Program. The Fulbright scholarship program. Rhodes Scholarship. Churchill Scholarship. Princeton Scholarship. Mitchell Scholarship. Conclusion On The hardest scholarships to get. Read Also: Nov 29, 2022"
How can I get 1000 dollars in scholarships?,"13 Best Tips for Winning College Scholarships Apply for local scholarships. ...  Apply for scholarships with smaller awards. ...  More work = fewer applicants = better chances. ...  Get personal. ...  Don't introduce yourself in your essay. ...  Don't repeat the essay prompt. ...  Don't use quotes. ...  Satisfy all the requirements. More items... • Mar 28, 2016"
What ACT score is needed for scholarships?,"At a minimum, an ACT score of 25 should qualify you for lower-level scholarship money. However, as the amount increases, scholarships become more competitive and the score ranges increase. Again, the barest minimum to shoot for is the 20-25 score range. May 29, 2020"
What percent of people get a full scholarship?,"Report Highlights. Over 1.7 million scholarships are awarded annually. However, only 7% of college students will receive a scholarship. The U.S. Department of Education awards an estimated $46 billion in scholarship money annually. Nov 5, 2022"
What is the hardest sport to get recruited for college?,"Most Competitive Sports for Recruitment Football. This is the most popular sport in the country, and the most difficult to get recruited for. ...  Baseball/Softball. America's pastime shares much the same fate as football, but both genders can participate in this one. ...  Men's Wrestling. ...  Track and Field. ...  Fencing. ...  Women's Crew. Nov 4, 2022"
What is the hardest sport to go to college for?,"The hardest major sport to play in college? For boys, it's wrestling (2.7 percent), then volleyball (3.3 percent) and basketball (3.5 percent). For girls, it's a tie between volleyball (3.9 percent) and basketball (3.9 percent). And that's for Divisions I-III. Jun 22, 2016"
Which D1 sports offer full ride scholarships?,"The “Full Ride”    up to the full “cost of attendance” – this is the scholarship that goes to NCAA Division I ""headcount"" sports: football (FBS only)/ basketball/ women's volleyball, tennis, and gymnastics recruits."
What is the maximum amount a student can get from FAFSA?,"The maximum amount of money you can get from a Pell Grant is: $6,495 (2021-22). The amount granted depends on your Expected Family Contribution (EFC), cost of attendance, your status as a full-time or part-time student, and your plans to attend school for a full academic year or less."
Can I buy a laptop with financial aid?,"If you received grant or scholarship money to attend college, you may be able to purchase a laptop with your funds. Some financial aid packages include a stipend specifically reserved for laptops, books, and other school-related expenses. Federal Pell Grants can also be used to purchase laptops (in a roundabout way). Jun 1, 2022"
How do I convince my FAFSA to give me more money?,"Top Ten FAFSA Tips to Maximize Your Eligibility File the FAFSA early. ...  Minimize income in the base year. ...  Reduce reportable assets. ...  Save strategically. ...  Spend strategically. ...  Coordinate 529 college savings plans with the American Opportunity Tax Credit (AOTC). ...  Maximize the number of children in college at the same time. More items... • Oct 3, 2022"
Why did FAFSA give me nothing?,"You didn't complete the FAFSA     The FAFSA is used by the Department of Education and schools to determine a student's eligibility for financial aid. If you did not complete the FAFSA for the academic year when you are seeking aid, you won't receive any. Dec 5, 2022"
What disqualifies you from getting financial aid?,"Incarceration, misdemeanors, arrests, and more serious crimes can all affect a student's aid. Smaller offenses won't necessarily cut off a student from all aid, but it will limit the programs they qualify for as well as the amount of aid they could receive. Larger offenses can disqualify a student entirely. Dec 22, 2022"
How much does FAFSA give on average?,"However, the amount students receive is based on different factors, such as the type of institution students attend (public versus private), as well as their household income. For instance, the average scholarship and grant aid award for students attending four-year public schools in 2020-21 was $7,813. Jan 4, 2023"
Do I have to compete to be in DECA?,"Although competing is a large part of DECA, you can help plan events, participate in community service, and/or simply attend the meetings/conferences. Who can join DECA? Anyone in grades nine through twelve in high school can join DECA. DECA membership is also open to DECA advisors, alumni and professional members. Aug 30, 2018"
What skills do you gain from DECA?,"Throughout the year, from the time you start your project to the time you deliver your final presentation, you greatly improve your presentation skills through practice and feedback. You will learn to create a visually-appealing presentation, speak clearly, and engage your audience."
What are the 4 career areas DECA focuses on?,"Within each category and type of event, DECA offers a variety of options in each of the four career clusters — marketing, finance, hospitality and management — as well as entrepreneurship and personal financial literacy."
How long does a DECA exam take?,"The test consists of 100 questions that are specific to your individual cluster. You will be given one hour to complete the test on your own (even in partner situations, each member will take their own test) The questions are chosen from several different business topics and it will account for 50% of your DECA score."
How long do you get for DECA test?,"HOME / SCDC 2021 / VIRTUAL TESTING    Each test has 100 questions. Once students begin, they must complete the test in one sitting and within 60 minutes."
Does DECA require public speaking?,"If you're one of them, then keep reading because public speaking is such an important part of DECA. Between roleplays and even just interacting with your fellow members at your chapter, learning to properly speak in public is a necessity. Sep 3, 2019"
How do I bring my DECA to school?,"Bring Collegiate DECA to Your Campus Meets DECA. Inc Requirements. ...  Meet Your Association's Requirements. ...  Obtain the Approval of Your College or University. ...  Officially Request to Start a Chapter. ...  Get Approval and Make It Official by Submitting Your Members. ...  Get Started. "
What's better for bulking Tren or Deca?,"In conclusion, Deca-Durabolin and Trenbolone are both great options for bulking. They both have their pros and cons, so it really comes down to personal preference. If you're looking for a safe and effective way to bulk up, either of these steroids will do the job. Nov 24, 2022"
What is the strongest steroid for bodybuilding?,"   Dianabol is generally considered to be the most efficient steroids for building muscle. If you're looking to boost your performance, an stack of steroids is suggested. Combining 4 anabolic steroids will aid in building muscle quickly. Jan 9, 2023"
What steroids build muscle the fastest?,"Dianabol is known as the fastest acting bulking steroid, with users typically putting on 10-15lbs of mass within the first 6 weeks of use. But it also causes a slew of side effects, many of which are permanent. With D-Bal Max, you are getting the positives of Dianabol, with none of the negatives. May 23, 2022"
What is the healthiest steroid for bodybuilding?,"The 3 Safest Bodybuilding Steroids are: Testosterone (Testo Max) Anavar (Anvarol) Deca Durabolin (DecaDuro) Jun 30, 2022"
What are the side effects of DECA Male?,"Side effects of nandrolone decanoate may include symptoms of masculinization like acne, increased hair growth, voice changes, and decreased sexual desire due to its ability to suppress endogenous testosterone synthesis while not being a sufficient androgen itself."
