topic,context
What is Mark Zuckerberg SAT score?,Mark Zuckerberg.    The founder of Facebook scored the perfect 1600 on the SAT and attended Harvard University. There's no surprise there on the score or prestigious university! 21 Des 2022
What was Ben Affleck SAT score?,"List of celebrity SAT scores Celebrity Score Known for Ben Affleck Almost perfect Actor and director (Argo, The Town) Bill Gates 1590 Microsoft co-founder Bill O'Reilly 1585 Political commentator and host of The O'Reilly Factor James Woods 1579 Actor (Scary Movie 2, Any Given Sunday) 18 baris lainnya"
Can you get a scholarship with a 1200 SAT score?,"There are many different types of scholarships available for college students, including those with an 1151-1200 SAT score, and many of them don't require a certain GPA, major, or other factors that might make it seem impossible to win one."
What is a SAT score of 1200?,"   What percentile is a 1200 SAT score? Earning a 1200 SAT score puts you at the 74th percentile, meaning that you scored higher than 74% of test takers."
Is USA or UK better for international students?,"If you know what kind of environment you'd like to study in then the UK is the place to be, but if you're keen on exploring different climates and cultures, maybe the USA would be a better fit. 30 Nov 2022"
Do all international students get job in USA?,"Students with a F-1 student visa can find job opportunities in USA for international students. But in order to stay back and work in the US, it is important to obtain a post study work visa. There are 2 types of work visa that an international student with a job in the US can get, take a look: H-1B Visa. 28 Okt 2022"
Which state is safe to study in USA?,Best state to be a student in the USA 2022 State Overall Rank Crime California 1 442 New York 2 363.8 Minnesota 3 277.5 Utah 4 260.7 27 baris lainnya
Why do students prefer US over Canada?,"Generally speaking, many international students prefer the United States for its varied climate options compared to Canada. So if pleasant weather all year round is an essential factor to you, studying in the USA will be a better option than in Canada. 15 Mei 2022"
Are US salaries higher than Canada?,"Salaries in the US vs Canada    While the differences aren't large between earning amounts in Canada and the US, Americans actually have higher average salaries than Canadians. The average salary of Americans is $56,690 and it is about $43,867 in Canada. These are both in USD. 24 Nov 2022"
Is it better to immigrate to Canada or USA?,"While the USA offers better salary packages, Canada has better healthcare, more maternity leaves and other social benefits. Average work hours for Canada is slightly higher than that of the US. The annual leave structure of both countries is similar."
What country has the best study?,#8 - Switzerland. 🌍 ...  #7 - The Netherlands. 🌍 Ranked #4 in Europe. ...  #6 - Germany. 🌍 Ranked #3 in Europe. ...  #5 -France. 🌍 Ranked #2 in Europe. ...  #4 - Canada. 🌍 Ranked #2 in North America. ...  #3 - The United States. 🌍 Ranked #1 in Europe. ...  #2 - Australia. 🌍 Ranked #1 in Oceania. ...  #1 - The United Kingdom. 🎓 High-quality teaching. Item lainnya... • 30 Des 2022
What undergraduate degree is best?,"Unsurprisingly, the list is dominated by bachelor's degrees in STEM (science, technology, engineering, and mathematics), as these degrees tend to have a better payoff compared to others (Day & Martinez, 2021). 11 Jan 2023"
Which is the best EU country to study?,"Deutschland is consistently named as one of the best countries for international students who want to study abroad in Europe each year. Sharing its borders with eleven other countries, Germany is truly the center of it all. 6 hari yang lalu"
Where is the nicest place in the world to live?,Sweden. #1 in Quality of Life. #5 in Best Countries Overall. ...  Denmark. #2 in Quality of Life. #10 in Best Countries Overall. ...  Canada. #3 in Quality of Life. ...  Switzerland. #4 in Quality of Life. ...  Norway. #5 in Quality of Life. ...  Finland. #6 in Quality of Life. ...  Germany. #7 in Quality of Life. ...  Netherlands. #8 in Quality of Life. Item lainnya...
What is the easiest English speaking country to move to?,Here are the 15 best English speaking countries to move to if you want the tax advantages of living abroad without having to learn a new language. ...  15 Expat Countries that Speak English (and Make Sense Tax-Wise) Bahamas. ...  Belize. ...  Bermuda. ...  Dominica. ...  Gibraltar. ...  Ireland. ...  Isle of Man. ...  Jersey. Item lainnya...
Which English country is best for living?,"Which is the best English-speaking country to live in? Canada has the highest quality of life in the world according to the OECD. The U.S is one of the most technologically advanced countries in the world and is also home to some of the biggest corporations in the world like Apple, Microsoft, Google, and Amazon. Item lainnya... • 3 Apr 2022"
Which country has free university?,"Nordic nations Denmark, Finland, Iceland, Norway and Sweden all offer opportunities to study free or at low cost: In Norway, university study is available free of charge to all students, regardless of study level or nationality."
Which is the best free university in the world?,"Want to study tuition-free? Here are the Top 5 Tuition Free Universities in the World Technical University of Munich, Germany. ...  Heidelberg University, Germany. ...  Ludwig Maximillian University of Munich, Germany. ...  University of Helsinki, Finland. ...  Free University of Berlin, Germany. 29 Des 2022"
Which country students study the most?,Which are the most searched for countries for studying overseas? The Top 10 Countries for Studying Abroad Number of countries searching to study here the most 1. Canada 36 2. Spain 13 3. England 10 4. Japan 9 12 baris lainnya
What countries are free for international students?,"Germany: offers free tuition for citizens as well as international students. Greece: offers free tuition for citizens as well as international students; however, all classes are taught in Greek. Iceland: offers free tuition for citizens as well as international students. Kenya: offers free tuition for citizens."
Which university is the cheapest in USA?,Affordable Universities in the USA for International Students California State University. Southeast Missouri State University. Arkansas State University. The University of Wisconsin. Brigham Young University. Brooklyn College. The University of Louisiana at Monroe. Southwest Minnesota State University. Item lainnya...
Can international students study for free in USA?,"The USA has a lot of universities and colleges that don't require any tuition fees, and you can study there for free. These institutions are operated through donations, and endowments and you will find a lot of faculty that work there are simply very passionate about their job and want to help students study for free."
Can international students get free education in USA?,"International students can study in USA for free by applying for fully-funded or partially-funded scholarships in the USA. The amount of funding provided by each scholarship varies according to the applicant's study level, course, and institution. 16 Jun 2022"
Can I study in USA for cheap?,There are various American universities that offer affordable — or even free — study programmes to international students. We've created two lists below with some of the cheapest Bachelor's and Master's degrees we could find in the US. 17 Nov 2022
Can non American citizens get scholarships?,"Many states do not offer government-funded scholarships for undocumented students. However, at least seven states, including Texas and California, do offer financial aid. Additionally, many private scholarships do not require U.S. citizenship for eligibility."
What are two things you should never do when applying for a scholarship?,Six Things to Avoid When Applying for Scholarships 1) Paying for scholarship assistance. ...  2) Failure to meet the application deadline. ...  4) Failure to send in a complete application. ...  5) Failure to write legibly. ...  6) Failure to proofread their application. 9 Mar 2021
What is the best time to apply for a scholarship?,"Most scholarship application deadlines will occur during the regular academic year, typically September through May. While this does give you some time to apply for scholarships, it still is a good idea to start searching for scholarships early."
What qualifies you for a scholarship?,"One of the most common requirements for scholarships is academic achievement. Organizations typically assess your academic achievements by looking at your GPA, the classes you took, and your performance on standardized tests (like the SAT or ACT). These credentials show how well you have performed in academics so far. 8 Nov 2021"
What GPA do you need to qualify for a scholarship?,"3.0 GPA  Some scholarship committees only consider applicants whose GPA meets a certain threshold. Minimum requirements range from around 2.0 on the lower end to 3.75 or higher for competitive academic scholarships. Generally speaking, a 3.0 GPA or higher will give you a decent shot at qualifying for a variety of scholarships."
Which scholarship gives most money?,"Featured Online Schools Miss America Additional Information Amount Awarded: Varies, up to $12,000 Deadline: Varies Coca-Cola Scholars Foundation Additional Information Amount Awarded: Up to $20,000 Deadline: August Buick Achievers Additional Information Amount Awarded: $25,000 Deadline: Varies 7 baris lainnya"
What is the most prestigious college scholarship?,"Most Prestigious Scholarships Name of Scholarship Maximum Award Deadline Month Harry S. Truman Scholarships $30,000 February Luce Scholars Program All Expenses October Marshall Scholarships All Expenses October National Merit Scholarship Program $2,500 November 6 baris lainnya"
Does university of North Carolina give full scholarship for international students?,"While we'll automatically consider you for scholarships when you apply as a first-year student, and as an international student, you won't be eligible to receive need-based financial aid and so you'll want to be prepared to pay the full cost of attendance for non-resident students."
Does UNC Charlotte give full ride scholarships?,The Freeman Scholarship is designed to cover the cost of tuition and fees for deserving students and their families who demonstrate financial need as determined by the FAFSA and qualify as Pell-eligible.
Is Duke or UNC a better school?,"Duke Is the Better School     Both schools have a good track record of producing well-educated players when they graduate, but Duke's academics top UNC's. According to BlueDevilDaily.com, Duke is better than North Carolina in NCSA Power Ranking (No. 3 vs. No."
Why Charlotte is the best place to live?,"   You'll find far more square footage, better locations, and commutes as well as a higher quality of life thanks to the affordability of Charlotte! The basic cost of living in Charlotte is lower than the national average by about 8% making the Queen City a great place to live!"
What is the average GPA for UNC?,"4.39  Average GPA: 4.39     The average GPA at UNC is 4.39. This makes UNC Extremely Competitive for GPAs. (Most schools use a weighted GPA out of 4.0, though some report an unweighted GPA. With a GPA of 4.39, UNC requires you to be at the top of your class."
What is UNC best known for?,"   UNC-Chapel Hill is a global leader known for its innovative teaching and ground-breaking research. Carolina offers a variety of courses and programs to prepare students to thrive in a rapidly evolving economy. 4 hari yang lalu"
What is the #1 public university in the world?,"   1 public university in the world. For the ninth straight year, UC Berkeley tops the list of the world's best public universities and remains the fourth-best university overall in U.S. News & World Report's 2023 global universities rankings. 3 Nov 2022"
What is the number 1 public university in America?,"1. University of California—Los Angeles. UCLA has an A+ ranking in almost all of the categories that Niche rates. With a fairly small acceptance rate of 17%, the school's the most popular major is economics. 17 Nov 2022"
What is the number 1 university in USA?,"   Harvard University is a private institution in Cambridge, Massachusetts, just outside of Boston. This Ivy League school is the oldest higher education institution in the country and has the largest endowment of any school in the world."
Is it easier to get into Duke or UNC?,"Therefore, the acceptance rate alone is not a good indicator that Duke University is a better school or will be more difficult for you specifically to get into. On the flipside, University of North Carolina at Chapel Hill (UNC) is easier to get into based on acceptance rate alone."
What GPA is required for Harvard?,"a 4.18 GPA or  You should also have a 4.18 GPA or higher. If your GPA is lower than this, you need to compensate with a higher SAT/ACT score. For a school as selective as Harvard, you'll also need to impress them with the rest of your application."
Is UNC good for out-of-state students?,"UNC stays true to its roots by embracing a strong preference for in-state students. Of these North Carolina applicants to the Class of 2025, 42.2% were accepted. For out-of-state students, however, the acceptance rate was just 10.5%. ... SAT and ACT* scores. North Carolinians 1310-1500 Out-of-State Students 1370-1540 1 baris lainnya"
What program is UNC Charlotte known for?,"The most popular majors at University of North Carolina--Charlotte include: Business, Management, Marketing, and Related Support Services; Health Professions and Related Programs; Computer and Information Sciences and Support Services; Engineering; Social Sciences; Psychology; Biological and Biomedical Sciences; ..."
Where can I nap at UNC?,"The Nap Map: Best spots to sleep on UNC's campus Graham Memorial. ...  Davis Library, couches throughout the first floor. ...  Undergraduate Library, basement. ...  McCorkle Place. ...  That water fountain, outside Playmaker's Theater. ...  Kenan Memorial Stadium, offseason and non-game days. ...  Coker Arboretum. ...  BONUS: Make do with your circumstance. 18 Feb 2016"
Is UNCC a Tier 1 university?,"For the seventh consecutive year, UNC Charlotte's Professional MBA program has been named a “Tier 1 Global” program by CEO Magazine. 28 Feb 2022"
What is the fastest growing university in NC?,"   UNC Charlotte  UNC Charlotte is the fastest growing university in North Carolina."
What is the lowest GPA accepted to MIT?,"There's no minimum required GPA; however, competitive applicants typically have a 3.5 GPA or above, and mostly As in math and science courses."
What GPA does MIT require?,"There is no minimum required GPA, but competitive applicants generally have a GPA of 3.5 or above, and mostly A's in mathematics and science courses."
What is the lowest GPA to get into MIT?,"   Aim high. Even though there are no official MIT GPA requirements, you should aim for a 4.17 weighted GPA. If you're already a junior or senior figuring out how to get into MIT and your GPA is lower than 4.17, know that scores close to the average MIT SAT scores or ACT scores can counterbalance a lower GPA."
What is a 3.90 GPA?,"   Let's break it down. A 3.9 GPA, or Grade Point Average, is equivalent to an A- letter grade on a 4.0 GPA scale. This means is equivalent to a 90-92%. The national average GPA is 3.0 which means a 3.9 is far above average. A 3.9 is so high that it can be hard to raise it any higher!"
Does MIT require all SAT scores?,"MIT has the Score Choice policy of ""Highest Section."" This is also known as ""superscoring."" This means that you can choose which SAT tests you want to send to the school. Of all the scores they receive, your application readers will consider your highest section scores across all SAT test dates you submit."
Is Charlotte NC a cheap place to live?,"Home and Rental Prices    This makes Charlotte an incredibly affordable city, as housing is 14% cheaper on average than the rest of the country. NerdWallet, PayScale, and Best Places all give Charlotte favorable scores for housing. 22 Sep 2022"
Is Charlotte cost of living?,Charlotte's housing expenses are 18% lower than the national average and the utility prices are 6% lower than the national average. Transportation expenses like bus fares and gas prices are 6% lower than the national average. Charlotte has grocery prices that are 1% lower than the national average.
Is Charlotte rent expensive?,"Charlotte is the #42 most expensive large city in the U.S., with a median rent of $1,486. Citywide, the median rent currently stands at $1,314 for a 1-bedroom apartment and $1,440 for a 2-bedroom."
Is it worth moving to Charlotte?,"A: Charlotte, NC, is a lovely place to live. With a lower-than-average cost of living, strong financial industry, relatively mild climate, and up-and-coming food scene, it's no wonder it was one of the top 20 fastest-growing cities in the U.S. 12 Okt 2022"
Why is Charlotte so cheap?,"Part of the reason Charlotte is so affordable is thanks to how affordable land is. Because there is room to build homes, new builders can take advantage of the affordable land prices and build products that are of high quality for an affordable price."
What are the pros and cons of living in Charlotte NC?,"   Pros And Cons Of Living In Charlotte, North Carolina Productive job market. Competitive cost of living. Access to education. Plenty of fun things to do. Close to so much more. Growth comes with a price. Bad traffic congestion. Issues with the environment. Item lainnya..."
What is the coldest month in Charlotte?,"January  Charlotte's coldest month is January when the average temperature overnight is 32.1°F. In July, the warmest month, the average day time temperature rises to 90.1°F."
How cold does Charlotte get?,"Charlotte averages seven nights a year with lows in the range of 11 to 20 degrees F and one night of 10 °F (-12 °C) or below. The coldest nights most commonly occur in January, although December and February can also get that chilly."
What is the hottest month in Charlotte NC?,"Record high temperature in Charlotte    The highest daily temperature recorded in Charlotte happened relatively recently, according to the National Weather Service: 104 degrees on July 1, 2012. The warmest month on record, meanwhile, was July 1993, when the temperature averaged 85.5 degrees. 5 Mei 2022"
What part of Charlotte is best to live in?,"   Our Top 10 Most Requested Neighborhoods in Charlotte, NC Southend. Southend is one of Charlotte's most popular neighborhoods, and it's easy to see why. ...  Dilworth Uptown. Dilworth Uptown is one of Charlotte's most desirable neighborhoods. ...  NoDa. ...  Elizabeth. ...  Myers Park. ...  Plaza Midwood. ...  Ballantyne. ...  Berewick. Item lainnya... • 22 Apr 2022"
Is Charlotte NC good for families?,"A regular on 'best places to live in the US' lists, Charlotte is more than just the home of the Charlotte Hornets and NASCAR Hall of Fame. The Queen City also boasts a high-quality school system, events and amenities for all ages, and safe, peaceful neighborhoods, all at an affordable price. 20 Apr 2022"
How far is Charlotte from the ocean?,How far is Carolina Beach: Charlotte is around 200 miles and a 3.5-hour drive from Carolina Beach. Another beach near Charlotte that is also located in the Wilmington area is Carolina Beach. 6 Jul 2020
What is the best place in NC to live?,"   Greensboro. One of the cities to make up the state's “Triad” region, Greensboro is home to five colleges and a vibrant art scene. ...  Davidson. ...  Winston-Salem. ...  Durham. ...  Carrboro. ...  Southern Pines. ...  Asheville. ...  Wilmington. Item lainnya..."
What salary is considered middle class in NC?,"The minimum income that a single person must make to be considered middle class is $25,149 and the maximum income is $75,444. About 52% of the Triad falls into that middle-income range. 13 Jan 2023"
Is it cheaper to live in North Carolina?,The cost of living in North Carolina is about 4% lower than in the average U.S. city. 2 Des 2022
How much does McDonald's pay in NC an hour?,"Average McDonald's Crew Member hourly pay in North Carolina is approximately $11.58, which is 10% below the national average."
Is dating hard in Charlotte NC?,"On a list compiled by BestPlaces, Charlotte ranks number 10 out of 80 cities ranked worst to best in terms of dating. If you think going outside of Mecklenburg County helps you, well, unfortunately the study also covers Rock Hill and Gastonia. 19 Apr 2022"
Is Charlotte a walkable city?,"   Walk Score, an organization that promotes walkable neighborhoods and measures the walkability of cities in the U.S., gave Charlotte an overall walkability score of 26.4. 25 Feb 2022"
Is Charlotte a happy city?,"Charlotte, NC    It's a big jump down to the second happiest city in North Carolina. The Queen City had even marks in the three big categories, with ranks of 61-78-68. 2 Mar 2022"
Is North Carolina an Ivy League?,"Are there Ivy League universities in North Carolina? Yes, Duke University is an Ivy League school in North Carolina, but you should consider North Carolina's other public and private universities, as well. 1 Sep 2022"
Does Charlotte have a homeless problem?,"Homelessness in Charlotte    As of Dec. 31 in Mecklenburg, more than 2,600 people are experiencing homelessness, according to the county's Housing and Homelessness dashboard. 10 Feb 2023"
Does Charlotte NC get hurricanes?,"CHARLOTTE, N.C. — Since the 1800s North Carolina has taken dozens of direct hits from hurricanes. Some of the storms have brought wind speeds as high as 150 mph. 26 Okt 2022"
What are the cons of living in Charlotte NC?,"Cons of Living in Charlotte, NC Economic Disparities. ...  Mosquitos. ...  Pollen. ...  Crime. ...  Humidity. ...  Poor Soil Quality. ...  Traffic Congestion. "
Can you live in Charlotte NC without a car?,Is there any city in North Carolina where you can get around without a car? Charlotte has a pretty extensive bus system. There is also a light rail line that goes from uptown to UNCC and to south Charlotte that is popular with commuters.
Is Charlotte a clean city?,"Charlotte is notoriously a clean city. Staying clean is not easy for a city with over 900 000 people. Charlotte's city council prioritizes debris clean-up, drain maintenance, sidewalks, and street repairs. 31 Jan 2022"
What is the crime rate of Charlotte NC?,"110 homicides in 2022, compared to 98 in 2021. 7,178 violent crimes in 2022, compared to 7,589 in 2021. 261 rapes in 2022, compared to 228 in 2021. 1,996 residential burglaries in 2022, compared to 2,147 in 2021. 12 Jan 2023"
How hard is UNC to get into?,"For the UNC enrollment class of 2021, UNC Chapel Hill admissions received 53,775 first-year applications, and the UNC Chapel Hill acceptance rate for this year was 19.2%. The middle 50% of admits achieved UNC SAT scores of 1350-1500. Beyond this, 74% of them ranked in the top 10% of their class."
Is UNC a prestigious college?,UNC-Chapel Hill ranks fifth among national public universities for 22nd consecutive year. The 2023 rankings list Carolina as 29th overall between public and private institutions. 12 Sep 2022
Is UNC campus beautiful?,"Our campuses are among the most beautiful in the U.S.     Details: UNC's Louis Round Wilson Library and Duke Chapel — deemed """"a beacon of Collegiate Gothic architecture"""" — were both standouts on the university's campuses. 5 Okt 2022"
How selective is UNC Charlotte?,"The acceptance rate at UNC Charlotte is 67.2%.    For every 100 applicants, 67 are admitted. This means the school is moderately selective."
Are Duke and UNC rivals?,
What kind of person should not go to UNC?,"UNC has very high academic expectations, so a person who cannot stay motivated or does not care about their academic success should not attend UNC. An individual that has difficulty balancing their personal life with a heavy workload will have difficulty with the challenges at UNC-Chapel Hill."
What is the most popular major at UNC?,"The most popular majors at University of North Carolina at Chapel Hill include: Social Sciences; Biological and Biomedical Sciences; Communication, Journalism, and Related Programs; Multi/Interdisciplinary Studies; Computer and Information Sciences and Support Services; Business, Management, Marketing, and Related ..."
Should you put dean's list on CV?,"Include Dean's list on your resume if you have been added to it regularly. Making the Dean's list for many semesters throughout your college career demonstrates a strong, consistent work ethic, as well as academic ability."
What GPA is a dean's list?,"a 3.5 GPA  The exact dean's list GPA requirements will depend on each particular pool of students, but is usually at least a 3.5 GPA. To be eligible, you'll also need to be a full-time student taking a minimum number of credits (often around 12 credits)."
Is president or dean's list better?,The Dean's List is a list of students that received A's and B's for the semester. The President's List is a list of students that received all A's for the semester. 14 Des 2022
Is Dean's List an award or honor?,"A dean's list is an academic award, or distinction, used to recognize the highest level scholarship demonstrated by students in a college or university. This system is most often used in North America, though institutions in Europe, Asia, and Australia may also employ similar measures."
Is Dean's List rare?,"The Dean's List, created in 1995, commends outstanding academic performance by graduating students, equivalent to the top 5% of student achievement. It is currently awarded to around 40-50 graduates per year (growing every year as student numbers increase)."
