topic,context
Does UNC Charlotte give scholarships?,"UNC Charlotte awards more than 1,600 scholarships each year to incoming freshman, transfer, undergraduate, and graduate students with outstanding academic accomplishments and demonstrated financial need."
Does UNC give full ride scholarships?,The most prestigious of UNC Chapel Hill scholarships is the Morehead-Cain Scholarship which is a four year fully funded program within the University. The Morehead-Cain Scholarship aims to support the top academic students and leaders in the world. 10 Agu 2021
Does UNCC give scholarships to international students?,"They issue scholarships and funds based on your degree, so they may have something you can apply for. You can contact them at: https://graduateschool.uncc.edu/contact."
Does UNC Charlotte give good financial aid?,"Typically, 51% of undergraduate students at University of North Carolina at Charlotte receive an average of $7,347 in grants and scholarships and 49% receive an average of $6,585 in student loans."
Is UNC Charlotte a Tier 1 school?,"About Us. CEO Magazine again recognizes the MBA program for quality and ROI. For the seventh consecutive year, UNC Charlotte's Professional MBA program has been named a “Tier 1 Global” program by CEO Magazine. 28 Feb 2022"
Is UNC Charlotte hard to get into?,"The acceptance rate at UNC Charlotte is 67.2%.    For every 100 applicants, 67 are admitted. This means the school is moderately selective. The school expects you to meet their requirements for GPA and SAT/ACT scores, but they're more flexible than other schools."
What GPA do you need to get a scholarship to UNC?,"There is no minimum GPA or test score required for consideration, nor is there any GPA or test score that guarantees a scholarship offer. Criteria include academic achievement, leadership qualities, commitment to service and potential for success at the University."
What GPA do you need to get into UNC?,A student who earns at least a 2.5 weighted high school grade point average OR a minimum test score on either the ACT (19) or the SAT (1010) is eligible for review by any of the 16 UNC System universities.
How rare is it to get a full ride scholarship?,"Less than 1 percent of students get full ride scholarships, showing just how difficult it is to earn one. However, with the right background, proper planning and by knowing where to look, your chances of landing a full ride scholarship can increase."
What is the easiest scholarship to get for international students?,Easiest Scholarships To Get For International Students. Fullbright Scholarships. The American Association of University Women International Fellowship. Aga Khan Foundation International Scholarship | Scholarships For International Students. Chevening Scholarships | Scholarships For International Students. Item lainnya...
Which university in us gives full scholarship for international students?,"Yale University Scholarship is a fully funded scholarship for international students. This scholarship is offered for undergraduate, masters and PhD. Yale Scholarship can vary from a few hundred dollars to over $70,000 per year; the average Yale need-based scholarship is over $50,000. 4 Des 2022"
Can you get a full scholarship as an international student?,"University Scholarships for International Students    Just about every university in the United States offers scholarships to international students. Still, the amount of money the average international student typically pays is higher than the amount domestic students pay."
What major is UNC Charlotte known for?,"The most popular majors at University of North Carolina--Charlotte include: Business, Management, Marketing, and Related Support Services; Health Professions and Related Programs; Computer and Information Sciences and Support Services; Engineering; Social Sciences; Psychology; Biological and Biomedical Sciences; ..."
What is UNCC famous for?,"   As North Carolina's urban research university, UNC Charlotte is a diverse and inclusive institution with local-to-global impact that transforms lives, communities and industries through access and affordability, exemplary undergraduate, graduate, and professional programs, scholarship, creative work, innovation and ..."
What is UNC Charlotte known for academically?,"Along with computer science, the university also has ranked engineering programs, motorsports programs and nursing programs. 23 Feb 2019"
Is UNC Charlotte a prestigious school?,University of North Carolina--Charlotte Rankings    University of North Carolina--Charlotte is ranked #219 out of 443 National Universities. Schools are ranked according to their performance across a set of widely accepted indicators of excellence. Read more about how we rank schools.
How prestigious is UNC Charlotte?,"According to College Factual's 2023 analysis, UNC Charlotte is ranked #316 out of 2,241 schools in the nation that were analyzed for overall quality. This puts it in the top 15% of all schools in the nation."
Is UNC an elite school?,"   With a strong program of academics, a proud athletic tradition, and a commitment to research, UNC is one of the South's preeminent institutions."
Is UNC Charlotte a dry campus?,"Permitted Alcoholic Beverages; Restrictions. Beer and Unfortified Wine are the only Alcoholic Beverages permitted on the Campus, unless specifically permitted under paragraphs V.B and V.C."
What GPA do you need to get into Charlotte?,"With a GPA of 4.07, UNC Charlotte requires you to be at the top of your class. You'll need nearly straight A's in all your classes to compete with other applicants. You should also have taken plenty of AP or IB classes to show your ability to excel in academic challenge."
Can I get into UNC Charlotte with a 3.1 GPA?,"What GPA Do I Need To Get Into UNC Charlotte? Students admitted to UNC Charlotte have an average unweighted GPA of 3.6. Out of all students that were admitted, 50.99% submitted a class rank."
What is the lowest GPA UNC will accept?,Minimum cumulative GPA of 2.0     A cumulative UNC-Chapel Hill grade-point average of at least a 2.000 is required.
Do you need a 4.0 GPA to get a scholarship?,"Although a strong GPA helps increase your chances of getting a full-ride scholarship, you don't need a perfect 4.0 to be qualified. In fact, GPA requirements are most commonly set at a 3.0 average, with what's considered to be a ""good GPA"" typically being a score between 3.5 and 3.8. 7 Nov 2022"
Can you get an academic scholarship with a 3.5 GPA?,"For students with a 3.5 GPA, a number of scholarship opportunities are available. There are college-based awards as well as external scholarships. Furthermore, some of these awards are based on merit, while others are need-based."
Is it harder to get into Duke or UNC?,"Therefore, the acceptance rate alone is not a good indicator that Duke University is a better school or will be more difficult for you specifically to get into. On the flipside, University of North Carolina at Chapel Hill (UNC) is easier to get into based on acceptance rate alone."
What GPA is needed for Duke?,"a 4.13 GPA or  You should also have a 4.13 GPA or higher. If your GPA is lower than this, you need to compensate with a higher SAT/ACT score. For a school as selective as Duke, you'll also need to impress them with the rest of your application."
What is the average GPA for Harvard?,"4.18  Average GPA: 4.18     The average GPA at Harvard is 4.18. (Most schools use a weighted GPA out of 4.0, though some report an unweighted GPA. With a GPA of 4.18, Harvard requires you to be at the top of your class. You'll need nearly straight A's in all your classes to compete with other applicants."
What SAT score do you need for a full scholarship?,"   So you're probably wondering, What's a good SAT score for scholarships, and how can I find them? The short answer is that you should aim for an SAT score between 1200 and 1600 if you want to secure some scholarships based on merit–and the higher within that range you score the more money you're looking at. 5 Sep 2022"
How do you get 100% free scholarships?,"Full-ride academic scholarship: Be at the top of your class with a great GPA, take AP/honors classes, and get perfect (or close to perfect) SAT or ACT scores. Along with academic merit, it also helps to also have leadership skills or community involvement, too (see below). 29 Mar 2022"
How do you get 100% scholarship?,"   How to get a full scholarship Know where to look. ...  Prepare in advance. ...  Work hard and keep motivated. ...  Make yourself stand out from other applicants. ...  Read the application instructions carefully. ...  Submit an exceptional scholarship essay or cover letter. ...  Be realistic. "
Which country is best for full free scholarship?,By country of interest. US Scholarships. UK Scholarships. Canada Scholarships. India Scholarships. China Scholarships. Germany Scholarship. Japan Scholarships. Item lainnya... • 6 hari yang lalu
Which country is best for fully funded scholarship?,Top 10 Fully Funded Scholarships for International Students Fulbright program in the USA. Azerbaijan Government Fully Funded Scholarships. Rotary Peace Fellowships. Australia Awards. E4D Scholarships for Developing Countries in Switzerland. GIST Scholarships in South Korea. ESED Scholarships. Item lainnya... • 16 Feb 2022
Which scholarship is easy to get in USA?,"Fulbright Scholarship (USA)    The Fulbright Program is a unique, most extensive US government-funded educational program aimed at international academic and cultural exchange. There are some steps you have to complete for applying for the 2022/2023 year."
Which scholarship is fully funded for international student in USA 2023?,"Fulbright Foreign Student Scholarship to the USA     This America scholarship is a fully funded program. Level of Study: Masters, PhD, Research. Deadline : October 31, 2023 ."
How hard is it to get a scholarship in USA for international students?,"   Although a good profile is essential while applying for a scholarship, test scores like GRE, SAT or GMAT also increase your chances of getting a scholarship. Yet, only 13% of total students with such profiles are able to bag a scholarship. The amount of money that can be earned from these scholarships is also limited."
Which university in USA gives the most scholarship?,"The 50 colleges that offer the most student aid Rank 1 College Columbia University Average financial aid package $55,521 Annual tuition and fees $55,056 Students receiving need-based aid 2,973 1 baris lainnya • 29 Okt 2018"
Which university gives free scholarships in USA?,Fulbright Scholarship 2023. Level: Masters / PhD. ...  Hubert H. Humphrey Fellowship Program. ...  Knight Henessy Scholars Program at Stanford University. Level: Masters / PhD. ...  Yale University Scholarship. ...  Bill Gates Scholarships. ...  University of New Haven Scholarship. ...  AAUW Fellowship Program. ...  Boston University Scholarship. Item lainnya... • 10 Des 2022
Can I study in USA for free?,"The USA has a lot of universities and colleges that don't require any tuition fees, and you can study there for free. These institutions are operated through donations, and endowments and you will find a lot of faculty that work there are simply very passionate about their job and want to help students study for free."
What is the easiest way to get a scholarship?,6 Easy Tips on How to Get a Scholarship for College Start Your Scholarship Applications Early. ...  Explore College Scholarships. ...  Look Locally for Private Scholarships. ...  Use Scholarship Search Engines to Expand Your Search. ...  Prioritize the Scholarships You're Seeking. ...  Continue Applying to Scholarships Throughout College. Item lainnya... • 17 Mei 2022
Why do people go to UNC Charlotte?,"UNC Charlotte and the University Career Center provide several avenues for you to pursue experiential education opportunities. Depending upon your major and the industry you are interested in working in you may select to pursue internships, cooperative education, practicum experiences, clinicals, or student teaching. 17 Feb 2021"
Is UNC Charlotte an easy school?,"The academics at UNC Charlotte are challenging. However, it is doable. Most of your classes depend on your major or the selection of classes you choose to take each year."
What is the average GPA for UNC Charlotte?,Academic Profile of Admitted Students PROFILE OF ADMITTED FIRST-YEAR STUDENTS (FALL 2020) MIDDLE 50% RANGE High School Grade Point Average 3.8-4.4 wtd 3.4-3.9 unwtd SAT 1120-1340 ACT 21-28
Why is Charlotte so popular?,"   Charlotte has been recognized as one of the best places to live in the United States by the U.S. News & World Report. The online news magazine has cited the city's “own culture, culinary sophistication and unique feel” as the primary reasons people choose to settle down here."
What is UNC Charlotte acceptance rate?,
What GPA do you need to graduate UNCC?,"2.0  GRADE POINT AVERAGES    To graduate, a student must be in good academic standing and have earned a grade point average of at least 2.0 and a grade point average of at least 2.0 in the major and in any minor."
Is UNC a top tier school?,"   University of North Carolina at Chapel Hill's ranking in the 2022-2023 edition of Best Colleges is National Universities, #29."
What is the dress code for UNC Charlotte?,"A. Uniforms consist of a Charlotte green logo-shirt, khaki pants, Charlotte green multi-purpose jacket with logo, UNC Charlotte baseball cap and a UNC Charlotte ski cap. Optional items decided by unit directors include green logo t-shirts, khaki shorts, a wide brimmed hat and a rain suit. B."
Is UNC Charlotte Tier 1?,"About Us. CEO Magazine again recognizes the MBA program for quality and ROI. For the seventh consecutive year, UNC Charlotte's Professional MBA program has been named a “Tier 1 Global” program by CEO Magazine. 28 Feb 2022"
Is UNC a top 10 school?,University of North Carolina at Chapel Hill is ranked #29 out of 443 National Universities. Schools are ranked according to their performance across a set of widely accepted indicators of excellence. Read more about how we rank schools.
Is UNC better then Duke?,"North Carolina has the edge in national championships with six to Duke's five, but the schools are tied with five apiece since Krzyzewski took over in 1980. 31 Mar 2022"
Who is ranked higher UNC or Duke?,"Duke Is the Better School     Both schools have a good track record of producing well-educated players when they graduate, but Duke's academics top UNC's. According to BlueDevilDaily.com, Duke is better than North Carolina in NCSA Power Ranking (No. 3 vs. No."
Which UNC campus is hardest to get into?,"How Hard Is It to Get Into UNC Chapel Hill? UNC is an extremely difficult school to get into. The university admitted a record-low 23.5% of regular decision applicants to its class of 2025, accepting just 10,446 students from a pool of 44,3821. 15 Sep 2021"
Is UNC a public ivy?,"   Moll's list of the Public Ivies consisted of 15 schools, including William & Mary, UC Berkeley, the University of North Carolina at Chapel Hill, the University of Michigan, UCLA, and the University of Virginia."
Is UNC in the Ivy League?,"You can do so by choosing to attend one of the many “Public Ivies.” This select group of public universities are known for their distinguished academic programs and low in-state tuition costs. ... What are the original Public Ivy schools?  1 School UNC Chapel Hill State NC Acceptance Rate 25% Undergraduate Enrollment 19,261 6 kolom lainnya • 15 Feb 2023"
Can you drink on UNC campus?,"It is illegal to have an open container of alcohol on campus and in many other public spaces, including public roads and sidewalks and property owned by the town of Chapel Hill. It is illegal for any person under the age of 21 to have any amount of alcohol in their body at any time."
Is UNC a pretty campus?,"Our campuses are among the most beautiful in the U.S.     Details: UNC's Louis Round Wilson Library and Duke Chapel — deemed """"a beacon of Collegiate Gothic architecture"""" — were both standouts on the university's campuses. 5 Okt 2022"
Can you have a car on campus at UNC Charlotte?,Permits are required to park anytime the University is open.    Parking on campus requires a permit or payment of visitor parking fees whenever the University is open (weekdays from 5 a.m. Monday until 10 p.m. Friday).
What majors is UNC Charlotte known for?,"The most popular majors at University of North Carolina--Charlotte include: Business, Management, Marketing, and Related Support Services; Health Professions and Related Programs; Computer and Information Sciences and Support Services; Engineering; Social Sciences; Psychology; Biological and Biomedical Sciences; ..."
What GPA does NYU?,
Is UNC Charlotte selective?,
What is 2.8 GPA in college?,"   A 2.8 GPA, or Grade Point Average, is equivalent to a B- letter grade on a 4.0 GPA scale. This means is equivalent to a 80-82%. The national average GPA is 3.0 which means a 2.8 is just a bit below average. With a few quick tips you can likely raise your GPA even higher!"
What is a B+ GPA at UNC?,Grade points are assigned as follows:    A+ = 4.3. A = 4.0. A- = 3.7. B+ = 3.3.
What GPA do you need to get into Yale?,"a 4.0 unweighted GPA  Yale GPA Requirements    However, unweighted GPAs are not very useful, because high schools weight GPAs differently. In truth, you need close to a 4.0 unweighted GPA to get into Yale. That means nearly straight As in every class."
Can an average student get into UNC?,"Average GPA: 4.39     With a GPA of 4.39, UNC requires you to be at the top of your class. You'll need nearly straight A's in all your classes to compete with other applicants. Furthermore, you should be taking hard classes - AP or IB courses - to show that college-level academics is a breeze."
Can I get a full ride scholarship with a 3.8 GPA?,"Although a strong GPA helps increase your chances of getting a full-ride scholarship, you don't need a perfect 4.0 to be qualified. In fact, GPA requirements are most commonly set at a 3.0 average, with what's considered to be a ""good GPA"" typically being a score between 3.5 and 3.8. 7 Nov 2022"
Can I get a full ride scholarship with a 3.5 GPA?,"For students with a 3.5 GPA, a number of scholarship opportunities are available. There are college-based awards as well as external scholarships. Furthermore, some of these awards are based on merit, while others are need-based."
Can you get a full ride scholarship with a 3.0 GPA?,The GPA you need to get a full ride scholarship varies from college to college. Some scholarship providers may look for a certain GPA like 3.5 to 3.7 on a scale of 4.0. They may also assess your particular class rank (E.g. top 5% or 10% in your class). Others look at ACT or SAT scores.
What is the minimum GPA for scholarships in USA?,"Minimum requirements range from around 2.0 on the lower end to 3.75 or higher for competitive academic scholarships. Generally speaking, a 3.0 GPA or higher will give you a decent shot at qualifying for a variety of scholarships."
What is the #1 University in the world?,"Stanford University     Stanford, California, U.S. 12 Agu 2022"
What GPA does Stanford require?,"There is no minimum GPA or test score, nor is there any specific number of AP or honors courses you must have on your transcript in order to have your application reviewed or be admitted to Stanford. 4 Agu 2022"
What GPA does Harvard accept?,"a 4.18 GPA or  You should also have a 4.18 GPA or higher. If your GPA is lower than this, you need to compensate with a higher SAT/ACT score. For a school as selective as Harvard, you'll also need to impress them with the rest of your application."
What is the lowest GPA Harvard accepted?,"a 4.18 GPA  Continue to work hard, take difficult classes, and show your passions outside of school! To get to Harvard your GPA has to be at least a 4.0 and even then if you get in your lucky but they require at least a 4.18 GPA only ."
What is the hardest college to get into?,"Top 10 Hardest Colleges to Get Into Harvard. Cambridge, MA. 3.19% Columbia. New York, NY. 3.73% Caltech. Pasadena, CA. 3.92%* Stanford. Stanford, CA. 3.95%* MIT. Cambridge, MA. 3.96% Princeton. Princeton, NJ. 4.38%* Yale. New Haven, CT. 4.47% Brown. Providence, RI. 5.03% Item lainnya..."
How to get full scholarship in USA for international students?,"Ask Your School. No matter where you live or attend school, your first step when searching for scholarships should be your school's financial aid office. Most colleges offer scholarship programs specifically for international students attending the institution."
Do scholarships cover all 4 years?,"Full-tuition scholarships are the holy grail of college scholarships- prizes that will cover the majority of your college costs for four years. These scholarship awards can cover tuition costs to all of your living expenses, depending on the terms determined by the provider."
Which country gives full free scholarship?,"3. Which countries give full scholarships to foreign students? Germany, Greece, Japan, China, Switzerland, the Netherlands, and Korea, are among the nations that offer full scholarships to international students. Make sure the scholarship is accepted at the school you want to attend."
Which international scholarship is easiest?,"   Fullbright scholarship is famously known for being the easiest scholarship to get for International students."
Which country is easiest to get scholarship?,"Answer - China is the easiest country to apply for a scholarship. Q3. Which country gives a full free scholarship? Answer - Countries such as Germany, Finland, Iceland, and Austria offer various free or low tuition schemes to international students. 14 Nov 2022"
Which university gives the most scholarship to international students?,10 U.S. Colleges That Most Aid Foreign Students School (state) Number of international students who received aid during 2021-2022 Wesleyan University (CT) 92 Dartmouth College (NH) 327 Duke University (NC) 174 Stanford University (CA) 245 7 baris lainnya • 14 Sep 2022
What are the top 5 scholarships?,"   We've included a few badges to help you identify some features of the scholarships. Fulbright Scholarship Program. ...  Excelsior Scholarship. ...  The Coca-Cola Scholarship. ...  National Merit Scholarship. ...  Hispanic Scholarship Fund. ...  Hope Scholarship. ...  The Gates Scholarship. ...  The Gates Millennium Scholars Program. Item lainnya... • 4 Jan 2023"
Which scholarship is fully funded in USA for international students 2023?,"Fulbright Foreign Student Scholarship to the USA     This America scholarship is a fully funded program. Level of Study: Masters, PhD, Research. Deadline : October 31, 2023 ."
What is the most prestigious scholarship?,"Most Prestigious Scholarships Name of Scholarship Maximum Award Deadline Month Harry S. Truman Scholarships $30,000 February Luce Scholars Program All Expenses October Marshall Scholarships All Expenses October National Merit Scholarship Program $2,500 November 6 baris lainnya"
Can you get a free scholarship in America as an international student?,"That said, there are still many opportunities for scholarships for international students in USA-based colleges and universities – if you know where to look. The most famous higher education scholarships that international students can apply for are Fulbright Scholarships and the Fulbright Program."
Can I get a fully funded scholarship in USA?,"More than 1000 fully funded undergraduate scholarships 2023-2024 are available at USA top universities for international students. These scholarships provide an average monthly stipend of $1000 along with tuition fees, accommodation charges, health insurance, and travel allowance. 3 Des 2022"
Can a average student get a full scholarship in USA?,"There's a common myth out there that a student can't win a college scholarship unless they have perfect grades, a stellar extracurricular record, or some kind of extraordinary athletic ability. This just isn't true."
What is the easiest scholarship to get?,"Top easy scholarships in 2023 $10,000 “No Essay” Scholarship. $2,000 Nitro College Scholarship – No Essay. $25,000 No Essay Scholarship. March Madness Scholarship. $5,000 Christian Connector Scholarship. $2,000 CampusReel Virtual Tour Scholarship. Annual Protestant Faith Based College Scholarship. Item lainnya... • 3 hari yang lalu"
How much money do I need to study in USA as an international student?,"Students from India can expect to shell out around INR 8.85 Lakhs per annum to cover their living and meal expenses while studying in the US. Plus, student visa fees for USA from India applying for undergraduate courses in rupees is 13,056."
What SAT score do you need for scholarships?,"   The minimum SAT score for scholarship across universities ranges from 1200 to 1600."
Which is the cheapest university in USA for international students?,Affordable Universities in the USA for International Students California State University. Southeast Missouri State University. Arkansas State University. The University of Wisconsin. Brigham Young University. Brooklyn College. The University of Louisiana at Monroe. Southwest Minnesota State University. Item lainnya...
Which country is cheaper for international students?,"Ireland is considered one of the cheapest countries to study abroad because: The cost of living is relatively low, at 10.68% lower than in the US. There are many scholarships and financial aid options available for students. You can work while you learn to help offset living costs and tuition costs. 27 Okt 2022"
