topic,context
What's better NPP or Deca?,"NPP is a short-chain ester while Deca is a long-chain ester. The shorter the ester, the more potent it is, and the faster you'll see results. On average, users of NPP will see size gains within a couple of months, while those taking Deca will have to wait for an extra month or so. Oct 30, 2020"
What are the side effects of Deca?,"Its consumption can trigger a series of adverse side effects in the body, both acute and chronic [18]. However, acute adverse effects have also been described, primarily consisting of headaches, fluid retention, gastrointestinal irritation, diarrhea, abdominal pain, jaundice, menstrual abnormalities, and hypertension. Nov 11, 2020"
What are red flags in a resume?,"One of the most common resume red flags is an unexplained lengthy employment gap between previous roles. These gaps can sometimes lead hiring managers to assume that you have struggled to land jobs in the past, potentially indicating poor performance or some other shortcoming. Mar 31, 2021"
What are the 3 F's of resume writing?,"   The 3 F's of resume writing are Function, Form(at) and (e)Ffectiveness. When these 3 elements are adhered to simultaneously in the resume, they make it the perfect fit for the role you're applying to."
What disqualifies a resume?,"5 Resume Deal-Breakers That Could Disqualify You in Seconds Spelling and/or grammatical errors. ...  Incorrect or missing contact information. ...  Unprofessional email address. ...  Outdated or irrelevant information. ...  Failure to demonstrate and quantify results. "
How do you write a killer resume?,"24 tips for writing a killer resume Know your audience. The first step to writing an effective resume is to know your audience. ...  Use keywords. ...  Consider formatting. ...  Explain relevance. ...  Keep it brief. ...  Tell a story. ...  Quantify successes. ...  Demonstrate diverse skills. More items... • Jun 8, 2021"
What are 3 common mistakes people make on resumes?,11 Common CV Mistakes According to Employers Having spelling errors and bad grammar. ...  Exaggerating the truth. ...  Poor formatting. ...  An unoriginal personal profile. ...  Not focusing on your achievements. ...  Making your CV too long. ...  Putting the wrong contact information. ...  Not tailoring your CV to the specific role. More items...
What are the 4 C's of resume writing?,"To become an employer magnet, they'll need a handful of essential qualities known as the 4 C's: Creativity, Communication, Collaboration, and Critical Thinking."
Can you win money in DECA?,"DECA's scholarship program provides over $200,000 in scholarships to high school and college DECA members at the International Career Development Conference (ICDC) each year. DECA Inc. administers the program based on guidelines set by the donor. DECA scholarships are strictly merit-based."
What do you do during DECA?,"DECA offers a wide variety of competitive events for participants. Participants may choose from topics in marketing, finance, hospitality, tourism, sports and entertainment, sales, business law and ethics, retail operations, management, or community involvement."
Is DECA important for college?,"Collegiate DECA is a tremendous benefit for your students, campus and community. From case studies and activities to use in the classroom to access to cutting edge teacher professional development, DECA is aligned to Career and Technical Education goals to help support your program and curriculum."
What are the benefits of joining DECA?,"PREPARE for your future Learn. Enrich your career knowledge and skills for your future pursuits. Lead. Enhance your leadership skills as you become a next gen business professional. Compete. Engage in competitive events to prove your business prowess and earn DECA Glass. Discover. "
Which scholarship gives the most money?,"Featured Online Schools Miss America Additional Information Amount Awarded: Varies, up to $12,000 Deadline: Varies Coca-Cola Scholars Foundation Additional Information Amount Awarded: Up to $20,000 Deadline: August Buick Achievers Additional Information Amount Awarded: $25,000 Deadline: Varies 7 more rows"
What GPA is high honor?,"cum laude, ""With Honors"", cumulative GPA of 3.5 and above; magna cum laude, ""With High Honors"", cumulative GPA of 3.65 and above; summa cum laude, ""With Highest Honors,"" cumulative GPA of 3.85 and above."
What is the highest honor in high school?,"valedictorian  The title of valedictorian is used to distinguish indivduals who have achieved the highest level of academic excellence. Students who earn an unweighted 4.0 GPA, through the seventh semester of high school, will receive valedictorian designation."
How do I study for DECA?,"Take as many practice exams as you can and study their keys! After taking a practice exam, if you go through the key, it tells you which answer was right, and what the answers mean. So instead of just learning one term, you learn the overall concept. If there's a specific DECA topic you don't understand, look it up."
How does DECA work high school?,"DECA's online events challenge members in online business simulations. Using an online program, members compete against other members in their region from their seats in the classroom to earn the opportunity to compete at the international level."
Is DECA only for high school?,"Who can be a DECA member? DECA membership is available to students with career interests in marketing, entrepreneurship, finance, hospitality and management in grades nine through twelve. DECA membership is also open to DECA advisors, alumni and professional members."
Does FBLA give scholarships?,FBLA DISTINGUISHED BUSINESS LEADER SCHOLARSHIP     This scholarship is designed to recognize outstanding FBLA members for their activity and involvement in the association. The number of scholarships given depends on yearly contributions to the FBLA Distinguished Business Leader Scholarship fund.
Does FBLA cost money?,HIGH SCHOOL State dues are $4 per member. National dues are $6 per member.
What is the difference between FBLA and DECA?,"1. The FBLA tries to prepare you for the American business enterprise and the transition from school to work while DECA tries to prepare you in marketing, finance, hospitality, and management. 2. The FBLA stands for Future Business Leaders of America, while DECA stands for Distributive Education Clubs of America."
What extracurriculars are Ivy League?,"The best extracurricular activities for the Ivies Starting a club. Many students struggle to find an extracurricular activity that picks their interests. ...  Participate in a summer program. ...  Competing in academic events. ...  Writing for the school newspaper. ...  Joining the theater program. ...  Doing an internship. "
What is the most common club to join on a college campus?,"Academic Academic clubs  Academic    Academic clubs are by far the most popular clubs to join while you're attending college. You could be majoring in business, STEM, or education and there will be a club that's perfect for you. Dec 21, 2022"
How many clubs do colleges want you to do?,"How Many Extracurriculars Should You Do? Strong applications tend to have between 8 and 10 extracurricular activities. This sounds like a lot, but many activities are seasonal, so it's possible to fit, for example, three to four sports into one year. Jul 2, 2021"
What is the best high school club?,Common After-School Clubs: Film Club. Cooking Club. Foreign Language Club. Improv Club. Future Medical Professional Club. Soup Kitchen Club. Photography Club. Art History Club. More items...
What do students gain from being in DECA?,"   DECA provides you with the tools, knowledge and skills to get the edge over your competition. Applying for an internship, scholarship, job or college just got a little easier... DECA membership shows that you are driven, academically prepared, community-oriented and career-focused—ready to tackle your future. Aug 29, 2022"
What is the lowest GPA to play D1?,a 2.3 GPA  The minimum GPA you can have to be considered an early academic qualifier for D1 is a 2.3 GPA and a 980 SAT combined score or 75 ACT sum score. You will need a 2.2 GPA and a 900 SAT combined score or 68 ACT sum score to be eligible at the Division II level.
Which sport has the fittest athletes?,Water Polo is your Fittest Sport Ranking Sport Overall Fitness Rating (%) 1 Water Polo 80.3 2 Rugby 7s 79.6 3 American Football 79.3 4 Ultimate (Frisbee) 79.3 50 more rows
Does every D1 athlete get a full ride?,"Is every D1 offer a full ride? If you receive a scholarships offer from a Division 1 FBS football team, it is guaranteed to be a full-ride scholarship. For FCS teams, it may be a full or partial scholarship. Oct 21, 2022"
How many D1 athletes are poor?,A 2019 study conducted by the National College Players Association found that 86 percent of college athletes live below the federal poverty line.
Is it hard to get a D3 offer?,Only 7% of all high school athletes can even make it to the D3 level.
What percent of D1 athletes get full rides?,"Only 57% of Division I athletes receive some form of financial aid, ranging from a book scholarship to a “full ride.” The amount is slightly higher in Division II at 63%. Aug 11, 2022"
Do all D1 athletes get gear?,"D1 schools, with more money to spend and less budget restrictions, will typically give out more gear, equipment, recovery tools, and other random items to their athletes. However, this does not mean that D2 schools do not do the same thing."
Is being a D1 athlete worth it?,"D1 athletes are more competitive, and typically have a better chance of receiving scholarships and going pro in their sport. That being said, D2 athletes have more time to focus on their studies and pursue other interests. It comes down to a question of which league fits your interests and skills better."
What is a top 20% ACT score?,What Is a Good ACT Score Overall? Percentile Composite Reading 85 27 29-30 80 25-26 27 75 (good) 24 25 50 (median) 19-20 20 4 more rows
Will a 27 on the ACT get you scholarships?,"   Some scholarships don't even require one specific score, but rather one within a given range. At a minimum, an ACT score of 25 should qualify you for lower-level scholarship money. However, as the amount increases, scholarships become more competitive and the score ranges increase. May 29, 2020"
What GPA do scholarships want?,"   Although a strong GPA helps increase your chances of getting a full-ride scholarship, you don't need a perfect 4.0 to be qualified. In fact, GPA requirements are most commonly set at a 3.0 average, with what's considered to be a ""good GPA"" typically being a score between 3.5 and 3.8. Nov 7, 2022"
What is the best GPA to get a scholarship?,"3.0 GPA  Some scholarship committees only consider applicants whose GPA meets a certain threshold. Minimum requirements range from around 2.0 on the lower end to 3.75 or higher for competitive academic scholarships. Generally speaking, a 3.0 GPA or higher will give you a decent shot at qualifying for a variety of scholarships."
How much is the Coca-Cola scholarship?,"$20,000 scholarship  Coca-Cola Scholars Program Scholarship – High school seniors with a minimum 3.0 unweighted GPA may apply on our website in August of their senior year until the October 31 deadline. 150 Coca-Cola Scholars are selected each year to receive this $20,000 scholarship."
How rare is it to get a full ride scholarship?,"Less than 1 percent of students get full ride scholarships, showing just how difficult it is to earn one. However, with the right background, proper planning and by knowing where to look, your chances of landing a full ride scholarship can increase."
Can you keep leftover scholarship money?,"What happens to leftover scholarship money. If you earned scholarships and grants that add up to more than your total cost of attendance, your school may send you a refund of the leftover scholarship money. Keep in mind, you may have to pay taxes on that amount."
Can I use scholarship money for gas?,"While you may not be able to use scholarship money on purchasing a car, you may be able to get other transportation costs covered, like gas and public transportation expenses. If you have to commute to class, work with your financial aid office to see what they'll include in your cost of attendance. Mar 18, 2021"
Can I keep my Pell Grant money?,"4. Pell Grant funds can't be used to repay a student's loan. Loan payments aren't considered an education expense. account, the balance must be returned to the student unless the student provides written authorization for the school to hold the funds."
How many scholarships can a student get?,"You can apply for as many scholarships as you want to but can avail of only one. This condition of availing of a scholarship may vary from provider to provider. Dec 5, 2022"
Do scholarships go to your bank account?,"Most scholarship money will never enter your personal bank account or come as a check in the mail. Instead, the program will send the money you received directly to the college or university you're attending, to be put towards your tuition and approved expenses, such as room and board or books. Jan 24, 2023"
Do scholarships pay for dorms?,"Some cover room and board at the college only. Others cover expenses like books, computers and fees. However, you will find that there are scholarships out there with less rigid stipulations, and these can pay for off campus housing."
Are D1 scholarships 4 years?,"Myth # 3: Athletic Scholarships are guaranteed for 4 years. Truth: They are a one year deal. With the exception of major conferences (Power 5), the majority of athletic scholarships are guaranteed only for one year."
Do D1 athletes get free room and board?,"Still, full-ride scholarships as the goal for many athletes, as they typically cover tuition and fees, books, room and board, supplies, and sometimes even living expenses. If you receive a scholarship for a D1 headcount sport, you're guaranteed a full-ride."
Do D1 athletes get free meals?,"For many, this came as a surprise. After all, in the aftermath of Napier's highly-publicized, much-discussed comments, the National Collegiate Athletic Association (NCAA) changed its rules to allow Division I schools to provide unlimited meals to athletes. Mar 22, 2022"
Is there a downside to scholarships?,"Cons of College Scholarships    Since there are so many options and sources for scholarships vs grants, you'll have to do more research and put in more time. Scholarships provide access to education to a larger number of students. The large amount of options also makes competition high for most scholarships."
What are the disadvantages of scholarships?,"However, scholarships do come with their disadvantages. Since for some scholarships you don't apply, they might be based on merit, you won't always know if you'll get the scholarship in advance. Normally since they're given based on high achieving merits, they're in demand and are given to fewer people. Feb 25, 2022"
Can I spend my scholarship money on anything?,"Unfortunately, turning scholarship money into cash is not allowed. Despite being considered free money, scholarship funds are financial aid awarded for an intended purpose. That specific purpose is to pay educational expenses like college tuition, student fees, and other college costs. Sep 2, 2022"
How do you find scholarships that almost nobody knows about?,"So, Where Do You Find Unclaimed Scholarships? One good place to look for scholarships is on the Financial Aid Finder Scholarship Announcement Blog. Every Friday, the site lists several scholarship opportunities with upcoming deadlines."
What are 3 possible scholarships?,Some Examples: Academic Scholarships and Merit Scholarships. ...  Community Service Scholarships. ...  First in Family Scholarships. ...  Leadership Scholarships. ...  Legacy Scholarships. ...  Military Scholarships. ...  No Essay Scholarships. ...  Prestigious Scholarships. More items...
Is it possible to get 100k in scholarships?,"Surprisingly, there are only four private scholarship programs with a top prize of $100,000 or more. These scholarships can provide the winners with a free ride to the college of their choice."
How can I get Bill Gates Scholarship?,"   The Gates Scholarship – Am I eligible? High school senior. Identifying as one of the following: African American, American Indian/Alaska Native, Asian and Pacific Islander American, and/or Hispanic American. Pell-eligible. A U.S. citizen or permanent resident. Minimum GPA of 3.3 on a 4.0 scale. "
How much is the Bezos scholarship?,"To turn your passion into action.    Scholars develop and produce a project that makes a positive difference in their communities. We supply the resources and support, including $1,000 in funding, which projects can re-apply for annually."
Is there a NASA scholarship?,"   Applications for the 2023 NASA Scholarship are now being accepted. Click the link below for more information. The deadline to apply is April 30, 2023."
What GPA is required for Harvard?,"a 4.18 GPA or  You should also have a 4.18 GPA or higher. If your GPA is lower than this, you need to compensate with a higher SAT/ACT score. For a school as selective as Harvard, you'll also need to impress them with the rest of your application."
When should kids start applying for scholarships?,"Federal Student Aid recommends that students start researching for scholarships the summer after your junior year of high school. If you have time and energy, you should even start before that. Every scholarship has different rules and different deadlines. Some even require submissions a year prior to starting college."
How do I ask for a full-ride scholarship?,"Full-ride academic scholarship: Be at the top of your class with a great GPA, take AP/honors classes, and get perfect (or close to perfect) SAT or ACT scores. Along with academic merit, it also helps to also have leadership skills or community involvement, too (see below). Mar 29, 2022"
What is the highest GPA you can get?,"a 4.0  The unweighted scale is most common, and the highest possible GPA on this scale is a 4.0. The unweighted scale doesn't take the difficulty of a student's classes into account. Weighted scales are also used at many high schools. Typically, they go up to a 5.0."
Can I get a scholarship with a 3.7 college GPA?,"Students with a 3.7 GPA may qualify for scholarships offered by colleges, universities, and private organizations. Community colleges, four-year universities, and other academic institutions typically offer the best scholarships to students with a 3.7 GPA or higher."
What ACT score gets you a full ride?,"You will need to have at least a 3.75 GPA and SAT scores of 1270 or above or ACT scores of 27 or above. Oct 7, 2022"
Can I get full ride scholarship with 1450 SAT?,Earning a 1450 SAT score makes you eligible for most (if not all) merit-aid scholarships based on SAT score.
Can I get a scholarship with a 900 SAT score?,"   Scholarships for a 900 SAT Score    When it comes to earning scholarships for merit, a 900 isn't likely to make you eligible for most merit scholarships. There are tons of types of scholarships, though, including ones for extracurricular activities, life circumstances, and passions."
How do you get a full ride scholarship with a low GPA?,"How to get a scholarship when your grades 'suck' Play the scholarship “lotto” ...  Go for “no” or “low” GPA scholarships. ...  Tap your parents' network. ...  Pre-package your application materials. ...  Use social media. ...  Embrace failure. Jan 12, 2019"
Where is the best place to get scholarships?,How do I find scholarships? the financial aid office at a college or career school. a high school or TRIO counselor. the U.S. Department of Labor's FREE scholarship search tool. federal agencies. your state grant agency. your library's reference section. More items...
What grades start scholarships?,"junior  By the time they come to their junior and senior years, students will know how to apply for college scholarships, how to meet scholarship deadlines, and how to write strong scholarship essays. Many students begin their scholarship search in their junior year of high school. Sep 2, 2022"
What sport is easiest for scholarship?,"Track and field scholarships are considered to be one of the most accessible and easy to obtain. That is largely due to limited competition. Many athletes are involved in track and field disciplines. Aug 9, 2022"
What is the hardest sport to go D1?,"Boxing. The Sweet Science. That's the sport that demands the most from the athletes who compete in it. It's harder than football, harder than baseball, harder than basketball, harder than hockey or soccer or cycling or skiing or fishing or billiards or any other of the 60 sports we rated."
How many D1 athletes get a full ride?,"NCAA divisions    With 351 universities in DI and 313 in DII out of a total of 2,081 colleges in all divisions, your choice of four-year colleges becomes even more limited. Just 85 full ride scholarships are available to NCAA DI universities annually."
Are D3 scholarships full ride?,"As such, NCAA Division III institutions do not offer full or partial athletic scholarships to their student-athletes. Sep 8, 2021"
How much financial aid do D3 athletes get?,"D3 schools do not provide aid for athletics. But just because D3 schools don't provide athletic scholarships doesn't mean that they aren't affordable or a great option—as mentioned above, more than 80% of student athletes receive some form of non-athletic aid, such as need-based or academic. Jul 20, 2021"
What percent of D3 athletes go pro?,"Do many NCAA student-athletes go on to play professionally? Fewer than 2% of NCAA student-athletes go on to be professional athletes. In reality, most student-athletes depend on academics to prepare them for life after college. Education is important."
Do D3 athletes ever go pro?,"   D2 and D3 Players in the NFL Today. It's a common misconception that D1 is the only division with players getting drafted into the NFL. There are many D2 and D3-level players who get drafted."
Does D3 have national signing day?,"The NLI is a binding agreement between the student-athlete and a Division I or Division II academic institution, which has offered the student-athlete financial aid. We also have a spring signing day for Division III student-athletes."
Do D3 players get recruited?,"Division III schools are allowed to send athletes recruiting materials, such as brochures or invitations at any time, unlike Division I. DIII schools can also contact recruits via phone call or any other method at any time with no restrictions."
Do D3 schools have walk ons?,"NCAA Division II and III, NAIA schools and Junior colleges all welcome walk-ons. NCAA Division I colleges also offer tryouts but it tends to be more difficult."
Does D2 give full scholarships?,"Yes, D2 schools give athletic scholarships. Most scholarships at the D2 level are partial scholarships. Full scholarships at D2 school are rare, but still possible."
How many scholarships can D2 schools give?,"The NCAA limits each Division II school to 36 full, or partial, scholarships per year. With this limited availability of scholarships, Division II schools must look for the best all round players to recruit for their schools."
Can you play D1 with a 2.3 GPA?,"To study and compete at a Division I school, you must earn 16 NCAA-approved core-course credits, earn a minimum 2.3 core-course GPA and submit your final transcript with proof of graduation to the Eligibility Center. NCAA is a trademark of the National Collegiate Athletic Association. January 2023."
What GPA should a D1 athlete have?,"Student-athletes must earn a 2.0 cumulative grade-point average each year. Feb 10, 2021"
Do all D1 athletes get free gear?,"   D1 athletes will receive any and every type of gear you can possibly think of. This includes socks, shoes, compression pants, shorts, joggers, sweatpants, undershirts, t-shirts, long-sleeve shirts, polos, rain jackets, sweatshirts, coats, beanies, hats, and any other accessories related to the sport you play."
What is a 9.0 GPA?,GPA Conversion – 12.0 to 4.0 GPA Scale 12.0 Point GPA 4.0 Point GPA Percentage Grade 11 3.9 85-89 10 3.7 80-84 9 3.3 77-79 8 3.0 73-76 9 more rows
Is a GPA of 1.71 good?,"The answer is No. The national average for a GPA is around 3.0 and a 1.7 GPA puts you below that average. A 1.7 GPA means that you've gotten only C-s and D+s in your high school classes so far. Since this GPA is significantly below a 2.0, it will make things very difficult for you in the college application process."
What is the lowest GPA accepted to Yale?,"a 4.14 GPA or higher  You should also have a 4.14 GPA or higher. If your GPA is lower than this, you need to compensate with a higher SAT/ACT score. For a school as selective as Yale, you'll also need to impress them with the rest of your application."
Does a 5.0 GPA exist?,"A 5.0 generally indicates that a student took only 5.0-scale classes and earned only A's (and/or A+'s). Normally, all perfect straight-A grades result in a 4.0; with weighted classes, though, perfect straight-A grades could result in a 5.0 (or even higher). Jan 4, 2020"
What is the lowest GPA ever recorded?,0.0 on a 4.0 scale is the lowest GPA record.
How do you get a 10.03 GPA?,"For example, one student actually managed to get a 10.03 GPA score. He did this by taking 17 advanced classes at his school, which awarded him many points. The most common scale is from 0 to 4. This is also known as an unweighted scale, and it provides a more general scoring system with no numbers in between."
Is a 92% GPA good?,"   A 3.7 GPA, or Grade Point Average, is equivalent to an A- letter grade on a 4.0 GPA scale. This means is equivalent to a 90-92%. The national average GPA is 3.0 which means a 3.7 is well above average."
