topic,context
Which scholarship gives the most money?,"Featured Online Schools Miss America Additional Information Amount Awarded: Varies, up to $12,000 Deadline: Varies Coca-Cola Scholars Foundation Additional Information Amount Awarded: Up to $20,000 Deadline: August Buick Achievers Additional Information Amount Awarded: $25,000 Deadline: Varies 7 baris lainnya"
Which universities give maximum scholarships to international students?,Berea College is the only college that provides full funding to all international students in the first year of enrolment. ...  United States University of Alabama. George Washington University. University of Miami. Emory University. University of Georgia. Drake University. University of Chicago. Louisiana State. Item lainnya...
What country accepts the most international students?,"USA  Which Countries Accept International Students Easily? Sr No Country No. of Students 1 USA 1,095,299 2 UK 496,570 3 China 492,185 4 Canada 435,415 6 baris lainnya"
What country has the best free college?,Norway. Norway offers free college tuition at all of its public universities for both Norwegians and international students. The Norwegian government funds these universities to help degree-seekers graduate with less debt.
Which country is best for free study?,"Nordic nations Denmark, Finland, Iceland, Norway and Sweden all offer opportunities to study free or at low cost: In Norway, university study is available free of charge to all students, regardless of study level or nationality."
What GPA is required for scholarships USA?,"Some scholarship committees only consider applicants whose GPA meets a certain threshold. Minimum requirements range from around 2.0 on the lower end to 3.75 or higher for competitive academic scholarships. Generally speaking, a 3.0 GPA or higher will give you a decent shot at qualifying for a variety of scholarships."
Do international students get scholarships in USA undergraduate?,"University Scholarships for International Students    Just about every university in the United States offers scholarships to international students. Still, the amount of money the average international student typically pays is higher than the amount domestic students pay."
What is the #1 way to increase your chances for a scholarship?,"Apply as early as possible     Everyone always waits until the last minute when applying for scholarships but take our advice and apply early. It gives you more time to prepare and get the application just right, you'll be less stressed and this way you won't miss any deadlines."
Is it hard to get full scholarship in USA?,"Full scholarships are rare, and those that are available are very competitive. However, that doesn't mean you shouldn't apply for them – read on to discover how to increase your chances of being awarded one of these prestigious scholarships."
What's the hardest scholarship to get?,"   7 Hardest Scholarships to Get But Worth Every Penny The Gates Cambridge Scholarship. The Gates Millennium Scholars Program. The Fulbright scholarship program. Rhodes Scholarship. Churchill Scholarship. Princeton Scholarship. Mitchell Scholarship. Conclusion On The hardest scholarships to get. Read Also: 29 Nov 2022"
How do I get a 100% Harvard scholarship?,"Harvard does not offer any merit-based aid and no full-ride scholarships. However, they do meet 100% of students' demonstrated financial needs. Almost half of the batch at Harvard University avails need-based scholarships or financial aid every year. 22 Nov 2022"
What are 3 possible scholarships?,Some Examples: Academic Scholarships and Merit Scholarships. ...  Community Service Scholarships. ...  First in Family Scholarships. ...  Leadership Scholarships. ...  Legacy Scholarships. ...  Military Scholarships. ...  No Essay Scholarships. ...  Prestigious Scholarships. Item lainnya...
How can I get full scholarship for undergraduate in USA?,List of Fully Funded Undergraduate Scholarships in USA 2023 Clark Global Scholarship Program. ...  The HAAA Scholarship. ...  Yale University Scholarships USA. ...  Treasure Scholarship at Boise State University. ...  University of Memphis Scholarships. ...  Boston University Presidential Scholarship. ...  Berea College Scholarships. Item lainnya... • 3 Des 2022
What is the best time to apply scholarship?,"Federal Student Aid recommends that students start researching for scholarships the summer after your junior year of high school. If you have time and energy, you should even start before that. Every scholarship has different rules and different deadlines. Some even require submissions a year prior to starting college."
Is there an age limit for scholarships in USA?,"In general, there is no age limit for applying for a scholarship. 25 Nov 2020"
Are scholarship exams hard?,"   Preparing for a scholarship exam can be quite tiresome. You not only have to study for the scholarship exam but also for school. If you manage your time effectively, you will be able to create a perfect balance between the two. With a structured approach, you will get the maximum out of the time that you have. 25 Feb 2023"
How do you find scholarships that almost nobody knows about?,"So, Where Do You Find Unclaimed Scholarships? One good place to look for scholarships is on the Financial Aid Finder Scholarship Announcement Blog. Every Friday, the site lists several scholarship opportunities with upcoming deadlines."
Which state is cheapest for international students in USA?,"Cheapest States for International Students in USA Wyoming. Wyoming is a state having mountainous terrain. ...  Indiana. Indiana is one of the top states in affordability in the USA. ...  Missouri. It is another that is popular among international students. ...  Alabama. ...  Kansas. "
Which university in USA is the cheapest?,The cheapest universities in the USA 2023 - The USA is a foremost destination for students in pursuit of higher international studies. ...  Pennsylvania State University. ...  University of South Florida. ...  University at Buffalo. ...  Arizona State University. ...  Purdue University. ...  Iowa State University. Item lainnya... • 21 Des 2022
What is the age limit for student visa in USA?,"   Student Visa Age limit: 14 - 79 years. Applicants below or above are taken as special cases. Interview requirements is as decided by the US Consulate. Pass General Exam and Language Tests with high scores."
Who is the girl with a 1550 SAT score?,"Kaitlyn Younger  Kaitlyn Younger, 18, has been an academic standout since she started studying algebra in third grade. She scored 1550 on her SATs as a junior and will graduate this spring with an unweighted 3.95 grade-point average and as the founder of her school's accounting club. 1 Mei 2022"
Do SAT toppers get scholarship?,Who Can Apply for a Scholarship. Income-eligible students who live in India and get a total SAT score of 1300 or higher may qualify for a merit-cum-need scholarship at participating universities. Scholarship amounts are based on the student's annual family income.
Can I get a scholarship with 1500 SAT?,"With a 1500 SAT score, you should have no restrictions on applying for any merit-based scholarships."
What was Bill Gates SAT score out of 1600?,"1590  List of celebrity SAT scores Celebrity Score Known for Bill Gates 1590 Microsoft co-founder Bill O'Reilly 1585 Political commentator and host of The O'Reilly Factor James Woods 1579 Actor (Scary Movie 2, Any Given Sunday) Ben Stein 1573 Actor and game show host (Ferris Bueller's Day Off, Win Ben Stein's Money) 18 baris lainnya"
What SAT score will get you a full ride?,"Shoot for at least a 28 on the ACT or above 1300 on the SAT. Some scholarships allow for flexibility, so check the particular scholarship, but these numbers generally give you the most options. Encourage your student to also pursue a high GPA or even 4.0, especially their senior year."
Does SAT provide 100% scholarship?,"Test takers who score more than 1300 in the SAT, and whose family income is below a certain threshold, are offered 100% tuition-free scholarships to study at some of the top private universities in India, that are part of the India Global Alliance. 7 Des 2022"
Which state of USA is better for international students?,"California  California is among the best states in USA for international students known for the 9 top-ranked universities, the best graduate salaries nationally, and its landscape."
Which part of USA is best for international students?,"Boston. If you want to be around the world's greatest students and scholars, Boston is your best bet. ...  Chicago. If Boston is the academic hub, Chicago is the economic hub and definitely high on the list for best places in USA for Indian students. ...  San Francisco. ...  Los Angeles. ...  New York. ...  Atlanta. ...  Washington, DC. ...  San Diego. "
Is studying in USA Cheaper than Canada?,"A. On average, Canadian universities' tuition fees are 27% more economical than tuition fees at US universities. The tuition fee is not the only factor to consider while choosing to study. The cost of living is lower in Canada in comparison to the US for international students."
Is it better to study in Europe or USA?,"One factor to weigh when comparing higher education in Europe vs. the U.S. is how long it takes to get a degree. U.S. universities tend to offer breadth, requiring general education courses and exposing students to a variety of fields, while most European universities offer depth, focusing on a specific area of study."
Where is the cheapest place to live in the world English speaking?,"Possibly the cheapest English-speaking country to live in is South Africa. Not only can you get by without having to go to language school, but most South African cities also have a high standard of living, similar to Western cities, which will make the transition much easier. 2 Feb 2023"
Which is the cheapest university in the world?,"   Osaka University     The university offers different kinds of programs in the field of humanities, law, business at all levels. The tuition fees vary from INR 3,80,418 to INR 5,70,840 depending upon the choice of program selected by the student."
Which country is cheapest for international students?,"10 of the most affordable places to study abroad Germany. ...  France. ...  Mexico. ...  India. ...  Argentina. ...  Poland. ...  Malaysia. ...  South Africa. Concluding our look at some of the best places to study abroad on a budget, South Africa is renowned for its natural beauty, cultural diversity, and turbulent history. Item lainnya..."
Is there a free university in USA?,"Webb Institute is a tuition-free university in the United States. Webb Institute was founded in 1969, and it is currently the only tuition-free university in the United States. In addition to being tuition-free, Webb Institute offers a wide range of courses that are not available at other universities. 19 Feb 2023"
Where can I study for free in America?,"   Here's a list of 8 of the countries where American students can study for free in Europe: Germany. One of Europe's economic strongholds, Germany is known for being friendly and welcoming to international visitors. ...  France. ...  Iceland. ...  Norway. ...  Finland. ...  Sweden. ...  Slovenia. ...  Czech Republic. 13 Jun 2016"
What GPA do you need to get scholarships?,"Minimum requirements range from around 2.0 on the lower end to 3.75 or higher for competitive academic scholarships. Generally speaking, a 3.0 GPA or higher will give you a decent shot at qualifying for a variety of scholarships."
How can international students get scholarships in USA?,"Ask Your School. No matter where you live or attend school, your first step when searching for scholarships should be your school's financial aid office. Most colleges offer scholarship programs specifically for international students attending the institution."
Should I apply for scholarships before I get accepted?,Apply for scholarships early and often. Some scholarship deadlines are as early as a year before you start college. You don't need to wait until you've made your final decision about your school to apply.
What is the easiest scholarship to win?,"Top easy scholarships in 2023 $10,000 “No Essay” Scholarship. $2,000 Nitro College Scholarship – No Essay. $25,000 No Essay Scholarship. March Madness Scholarship. $5,000 Christian Connector Scholarship. $2,000 CampusReel Virtual Tour Scholarship. Annual Protestant Faith Based College Scholarship. Item lainnya... • 3 hari yang lalu"
What GPA is required for UNC Charlotte?,Minimum 2.0 cumulative college GPA for all college-level courses. *A 2.0 GPA does not guarantee admission; having a higher GPA makes you more competitive. Student must be in good standing and eligible to return to the last school attended. Must have demonstrated math proficiency at the college or high school level.
Is UNC the best public school?,"For the 22nd consecutive year, U.S. News & World Report's Best Colleges rankings list UNC-Chapel Hill in fifth place for top public schools among national universities. The 2023 rankings list Carolina as 29th overall between public and private institutions. 12 Sep 2022"
What GPA is required for Duke?,"a 4.13 GPA or higher  You should also have a 4.13 GPA or higher. If your GPA is lower than this, you need to compensate with a higher SAT/ACT score. For a school as selective as Duke, you'll also need to impress them with the rest of your application."
Does UNC Charlotte have a dress code?,"No. Executive Education at UNC Charlotte is committed to education, professional development, and networking. Please wear whatever you feel is appropriate."
Is UNC Charlotte a small school?,"   Campus. UNC Charlotte is the third largest university in North Carolina. Our large university with a small college feel, warm and sunny location, and outstanding academics are just a few reasons why students choose to shape what's next at UNC Charlotte."
What's the lowest GPA you can get into Harvard with?,"You should also have a 4.18 GPA or higher. If your GPA is lower than this, you need to compensate with a higher SAT/ACT score. For a school as selective as Harvard, you'll also need to impress them with the rest of your application. We'll cover those details next."
How can I increase my chances of getting into UNC?,How to Improve Your Chances of Getting into UNC Chapel Hill Achieve at least a 4.39 GPA while taking the most challenging classes available. ...  Aim for a 1460 SAT and 33 ACT. ...  Cultivate one or two Tier 1-2 extracurriculars (find your “spike”). ...  Write engaging essays. ...  Request great letters of recommendation. Item lainnya... • 15 Sep 2021
What GPA do you need to get into NYU?,"An undergraduate GPA of 3.0 or better is required for admission. Letters of Recommendation, a Statement of Purpose, and a professional resume are also required from all applicants seeking admission to any graduate program."
What GPA do you need to get into UCLA?,GPA and test scores of middle 25%-75% students High School GPA 4.18 - 4.32 ACT Composite Score 29 - 32 ACT English Language Arts 30 - 35 SAT Evidence Based Reading & Writing 670 - 760 2 baris lainnya
What GPA do you need to get into Stanford?,"There is no minimum GPA or test score, nor is there any specific number of AP or honors courses you must have on your transcript in order to have your application reviewed or be admitted to Stanford. 4 Agu 2022"
Why is Charlotte so affordable?,"   Part of the reason Charlotte is so affordable is thanks to how affordable land is. Because there is room to build homes, new builders can take advantage of the affordable land prices and build products that are of high quality for an affordable price."
What is a good salary in Charlotte?,"Most salaries in Charlotte range between $51,588 (25th percentile) to $84,028 (75th percentile) annually. Of course, salaries will vary depending on your occupation, experience, and many other factors."
What salary do you need to live in Charlotte?,"Typical Expenses  1 ADULT 2 ADULTS (1 WORKING)  0 Children 3 Children Required annual income after taxes $31,055 $75,439 Annual taxes $5,391 $14,101 Required annual income before taxes $36,446 $89,540 7 baris lainnya"
Is Charlotte cheap to live?,"Charlotte Living Is Cheap     The city's cost of living is 1% lower than the national average, while cost of housing is 2% lower than the national average. In fact, the median home price in Charlotte is $178,000, and the median monthly rent is $966. 1 Feb 2023"
Does it snow in Charlotte North Carolina?,"Mild winters are one of the perks of living in the South, but cold weather finds its way to Charlotte a few times each season accounting for an average accumulation of six inches of snow per year. Only about half of the winter days fall below freezing making a friendly forecast for a wintertime trip."
Which city is safer Charlotte or Raleigh?,"Though WalletHub changes its criteria annually, the rankings mark the third straight year that Raleigh has been named among the safest places in the country. Other North Carolina cities that landed outside of the top 10 included Winston-Salem at No. 12, Charlotte at No. 43, Durham at No. 10 Okt 2022"
Is Charlotte or Raleigh better?,"Raleigh offers a more suburban lifestyle, while Charlotte has more of a city feel. But, whichever city fits your needs, it is essential to remember that no city is perfect. These North Carolina cities' overall growth and development will continue to lure people to North Carolina for years to come. 14 Des 2022"
What is a livable salary in NC?,Living Wage Calculation for North Carolina  1 ADULT 2 ADULTS (BOTH WORKING)  0 Children 2 Children Living Wage $16.83 $25.38 Poverty Wage $6.53 $6.67 Minimum Wage $7.25 $7.25
Is Charlotte good for singles?,
Is Charlotte a good place to live after college?,"School is out and for college graduates, and that very first job is likely right around the corner. LinkedIn recently released its 2022 Guide to Kickstarting your Career and listed Charlotte as the fourth fastest growing city for recent graduates – ahead of cities like New York and Boston. 15 Jun 2022"
Is North Carolina Charlotte a good place to live?,"Q: Is Charlotte, NC, a good place to live? A: Charlotte, NC, is a lovely place to live. With a lower-than-average cost of living, strong financial industry, relatively mild climate, and up-and-coming food scene, it's no wonder it was one of the top 20 fastest-growing cities in the U.S. 12 Okt 2022"
What is the most popular major at UNC Charlotte?,Most Popular Majors Healthcare Management. 333 Graduates. 326 Graduates. Finance. 325 Graduates. Biology. 244 Graduates. Criminal Justice and Safety Studies. 232 Graduates. Marketing. 205 Graduates. Political Science and Government. 201 Graduates. Mechanical Engineering. 198 Graduates. Item lainnya...
What type of person goes to UNC?,
Is Dean's List a big deal?,"Earning a spot on the dean's list at your college is one the highest levels of recognition for scholarly achievement. Every term, the highest-ranked students based on GPA receive this award."
What GPA is president's list?,"The President's Honor Roll, published at the end of each semester, contains the names of students who have earned a GPA of 4.0."
Is 1.75 Dean's Lister?,"To qualify to the Dean's Honor List, the following guidelines should be considered: The student has a Grade Point Average (GPA) 1.75 or better with no grade lower than 2.00."
What majors have the lowest GPA?,"   Science majors tend to have lower GPAs on average, with chemistry being the major with the lowest average GPA. 15 Okt 2022"
What GPA do you need to get a scholarship?,"Minimum requirements range from around 2.0 on the lower end to 3.75 or higher for competitive academic scholarships. Generally speaking, a 3.0 GPA or higher will give you a decent shot at qualifying for a variety of scholarships."
What GPA is Deans List UNC?,"A 3.500 grade-point average  A 3.500 grade-point average wigradeth no grade lower than a C if enrolled in at least twelve but fewer than fifteen hours of letter- credit, exclusive of physical education activities courses."
How do you get a 100% scholarship?,"   How to get a full scholarship Know where to look. ...  Prepare in advance. ...  Work hard and keep motivated. ...  Make yourself stand out from other applicants. ...  Read the application instructions carefully. ...  Submit an exceptional scholarship essay or cover letter. ...  Be realistic. "
Can international students get full scholarships in USA?,"Fulbright Scholarships USA    Fulbright Scholarships are fully funded scholarships for international students. These scholarships are only offered for masters and PhD studies. Fulbright Foreign Student Program covers full tuition fee, a living stipend, full accommodation fee, airfare and health insurance. 4 Des 2022"
Is UNC considered a public Ivy?,"Moll's list of the Public Ivies consisted of 15 schools, including William & Mary, UC Berkeley, the University of North Carolina at Chapel Hill, the University of Michigan, UCLA, and the University of Virginia."
What GPA do you need to get into UNC Charlotte?,Minimum 2.0 cumulative college GPA for all college-level courses. *A 2.0 GPA does not guarantee admission; having a higher GPA makes you more competitive. Student must be in good standing and eligible to return to the last school attended. Must have demonstrated math proficiency at the college or high school level.
What is a good GPA to get into UNC?,A student who earns at least a 2.5 weighted high school grade point average OR a minimum test score on either the ACT (19) or the SAT (1010) is eligible for review by any of the 16 UNC System universities.
What major is UNC best known for?,"The most popular majors at University of North Carolina at Chapel Hill include: Social Sciences; Biological and Biomedical Sciences; Communication, Journalism, and Related Programs; Multi/Interdisciplinary Studies; Computer and Information Sciences and Support Services; Business, Management, Marketing, and Related ..."
What is UNC Charlotte known for?,"UNC Charlotte is North Carolina's urban research university. It leverages its location in the state's largest city to offer internationally competitive programs of research and creative activity, exemplary undergraduate, graduate, and professional programs, and a focused set of community engagement initiatives."
What is UNC reputation?,"UNC-Chapel Hill ranks fifth among national public universities for 22nd consecutive year. The 2023 rankings list Carolina as 29th overall between public and private institutions. In the best value category, Carolina claims first place among public institutions for the 18th consecutive year. 12 Sep 2022"
Why is UNC famous?,"The University of North Carolina at Chapel Hill, the nation's first public university, is a global higher education leader known for innovative teaching, research, and public service."
Does UNC have a good reputation?,
What is the lowest GPA accepted to NC State?,"   While NC State does not have a minimum GPA for admittance, the middle half of first-year enrolled students maintained a weighted GPA between 4.17 to 4.48, and the exact average was 4.28. Converted to an unweighted scale, this range amounts to 3.75 to 3.97, and an exact average of 3.83, which is quite competitive! 22 Mar 2022"
What is the prettiest campus in NC?,"   Travel + Leisure Magazine has picked Wake Forest University as the most beautiful campus in the state. The magazine notes that while North Carolina has no shortage of pretty schools, that Wake Forest has ""top quality"" groundskeeping, and that the buildings are ""gorgeous inside and out."" 22 Mar 2017"
Is North Carolina good for international students?,"   A Top Public Institution    NC State has received numerous national and international rankings for outstanding academic quality, affordable tuition rates, employability, and exceptional degree programs in science, technology, engineering, and mathematics."
Is Duke harder to get into than UNC?,"Is University of North Carolina at Chapel Hill (UNC) or Duke University Harder to get into? Which school is easier to get into? If you're looking at acceptance rate alone, then Duke University is more difficult to get into."
Who's Better North Carolina or Duke?,"The Tar Heels have six national championships compared to Duke's five, 51 NCAA Tournament appearances to Duke's 44, 20 Final Four appearances to Duke's 16, 130 NCAA Tournament wins to Duke's 118 and 50 total ACC championships to Duke's 40. 29 Mar 2022"
Is Wake Forest or UNC harder to get into?,"Is Wake Forest University or University of North Carolina at Chapel Hill (UNC) Harder to get into? Which school is easier to get into? If you're looking at acceptance rate alone, then Wake Forest University is more difficult to get into."
Is UNC more prestigious than Duke?,"Duke Is the Better School    Both schools have a good track record of producing well-educated players when they graduate, but Duke's academics top UNC's. According to BlueDevilDaily.com, Duke is better than North Carolina in NCSA Power Ranking (No. 3 vs. No."
Who is Xavier's biggest rival?,"the University of Cincinnati Bearcats  The Cincinnati–Xavier rivalry is a college sports rivalry between the University of Cincinnati Bearcats and the Xavier University Musketeers. The two schools are separated by less than 3 miles (4.8 km) in Cincinnati, making the archrivalry one of the closest major rivalries in the country."
Who is Duke rival?,
How did Duke lose to UNC?,
What is the Ivy League school in North Carolina?,"Are there Ivy League universities in North Carolina? Yes, Duke University is an Ivy League school in North Carolina, but you should consider North Carolina's other public and private universities, as well. 1 Sep 2022"
